Comment	CommentID	CreateTimeStamp	Type	videoID	videoTitle
Dear the singer thanks you it was very beautiful songs And I feel fine I just want to find my losting heart and repaired it for a long time	Ugy9sUDAWtzfvG-N7ZR4AaABAg	2018-11-11T16:09:14.000Z	Comment	zHNyp-3ELO8	Ed Sheeran - How Would You Feel [Lyrics]
myilke	UgwyF8EV0-lRN-x1rJZ4AaABAg	2018-11-11T08:38:04.000Z	Comment	zHNyp-3ELO8	Ed Sheeran - How Would You Feel [Lyrics]
What I want in all life me yes I want have family but who I wait you	Ugw63NY187YRmpGzxnB4AaABAg	2018-11-10T16:46:48.000Z	Comment	zHNyp-3ELO8	Ed Sheeran - How Would You Feel [Lyrics]
Poor Ellie has died	UgykNODfERCvkdFEN3Z4AaABAg	2018-11-10T13:17:35.000Z	Comment	zHNyp-3ELO8	Ed Sheeran - How Would You Feel [Lyrics]
I hope you d feel the same way that I feel for you	UgzadGrzLgcjbevTQxh4AaABAg	2018-11-10T12:25:55.000Z	Comment	zHNyp-3ELO8	Ed Sheeran - How Would You Feel [Lyrics]
hey bro can i disturb you alot can u make a video just how u make those pics of your lyrics in ADOBE PHOTOSHOP	UgwSA2gak7VPcluL0ix4AaABAg.8lpHsU31tdK8nPIF_DVptA	2018-11-08T21:18:51.000Z	Reply	zHNyp-3ELO8	Ed Sheeran - How Would You Feel [Lyrics]
My great grandmother passed away after a hip injury She was It ll be two years ago in a couple of weeks I cry every time I listen to this song I love you Grandma Luella	UgylepgnwcY920C0rqB4AaABAg	2018-12-08T01:15:16.000Z	Comment	bIB8EWqCPrQ	Ed Sheeran - Supermarket Flowers [Official Audio]
Sad song supermarket makes me cry	UgydQwn_XiEzDXymraV4AaABAg	2018-12-07T17:51:53.000Z	Comment	bIB8EWqCPrQ	Ed Sheeran - Supermarket Flowers [Official Audio]
I Love ed Sheeran Com	UgxFdoLN-pr3nIiVwSZ4AaABAg	2018-12-07T10:19:00.000Z	Comment	bIB8EWqCPrQ	Ed Sheeran - Supermarket Flowers [Official Audio]
i m crying	UgzyqVwsWpU57b2MP6Z4AaABAg	2018-12-07T07:42:17.000Z	Comment	bIB8EWqCPrQ	Ed Sheeran - Supermarket Flowers [Official Audio]
Oh I m in pieces it s tearing me up but I know a heart that s been broken is a heart that s been loved	UgwoeeTq43OSakX_uPB4AaABAg	2018-12-07T06:17:18.000Z	Comment	bIB8EWqCPrQ	Ed Sheeran - Supermarket Flowers [Official Audio]
Miss you Paula anctil Too the Best mother ever	Ugxokp6IWUOwL97KW1N4AaABAg	2018-12-07T03:04:45.000Z	Comment	bIB8EWqCPrQ	Ed Sheeran - Supermarket Flowers [Official Audio]
this song omg	Ugw-zAiTLuBSWgurGTd4AaABAg	2018-12-07T01:54:44.000Z	Comment	bIB8EWqCPrQ	Ed Sheeran - Supermarket Flowers [Official Audio]
My sister died on the rd of march and ive been listening to this for months now and it still makes me cry r i p debbie i will always love you	UgzjqC9ALvNkb1Rt-EB4AaABAg	2018-12-06T23:39:54.000Z	Comment	bIB8EWqCPrQ	Ed Sheeran - Supermarket Flowers [Official Audio]
Favourit song	Ugx1BN6TrMbKw6D4zBN4AaABAg	2018-12-06T21:51:36.000Z	Comment	bIB8EWqCPrQ	Ed Sheeran - Supermarket Flowers [Official Audio]
This is my most favorite song among Ed s list of amazing songs This one just hits home right there in your heart I no longer have grandparents My last grandpa died one month today Can t help tearing up each time I listen to this song I get so emotional I guess this is what good music does to you and when it s genuine Ed is definitely one of the most authentic artists out there	UgxWKSAUpKOeUK6-Ku14AaABAg	2018-12-06T18:58:14.000Z	Comment	bIB8EWqCPrQ	Ed Sheeran - Supermarket Flowers [Official Audio]
my gma died of anemone I cry when i hear this song love you gma	Ugw28RFcKei5V03oAb14AaABAg	2018-12-06T16:25:33.000Z	Comment	bIB8EWqCPrQ	Ed Sheeran - Supermarket Flowers [Official Audio]
This hits so hard growing up without any relatives My Father left when I was a little child and my mother left because of a heart attack years later And it still breaks my heart Ed Sheeran put all this feelings in this song it s heartbreaking but it s also breathtaking	Ugy2vwPDI3V95xHwBrN4AaABAg	2018-12-06T15:53:19.000Z	Comment	bIB8EWqCPrQ	Ed Sheeran - Supermarket Flowers [Official Audio]
When i was on vacation in Barcelona I met this Galway girl named Nancy Mulligan I was happier then before and thought that hearts don t break around here I bought her supermarket flowers and told her i fell in love with the shape of you and i would dive in the deepest ocean for you Everything was just perfect But days later when i was at the castle on the hill I saw her with a new man I asked her How would you feel if i did that to you She said I m sorry i just had to save myself for you to hurt me But what do i know I took an eraser and deleted the memory and thought bibia be ye ye everything will be alright	UgzFaj89NHJvQ8yZwz14AaABAg	2018-12-06T10:29:48.000Z	Comment	bIB8EWqCPrQ	Ed Sheeran - Supermarket Flowers [Official Audio]
my mum and dad died two hours ago in a car crash If it wasn t for Ed Sheeran and this song I wouldn t be cooping and I have no family members around me cause my brothers died last year and now this my best friend committed suicide weeks ago it s like everyone around me is just disappearing my mum had been in hospital for months and had just been released on Sunday it s like the world wasn t wanting her around anymore R I P Philippa mum Allan dad Micheal brother Mitchell brother Emily Brittney BFF LIFE BTW the boys were twins died the same day at the same time by a drive by they would have been on December th They were my twin brothers we were triplets so losing them was really hard like hope for me xxxxxx	UgwsEXaMNsWFMjRjgsx4AaABAg	2018-12-06T04:38:29.000Z	Comment	bIB8EWqCPrQ	Ed Sheeran - Supermarket Flowers [Official Audio]
NOTHING LIKE THIS HAPPENED TO ME STILL I AM CRYING IS IT MAGIC OF THE MAGICIAN CALLED ED SHEERAN	UgxRIH_iGwl-1malZ2Z4AaABAg	2018-12-05T20:04:22.000Z	Comment	bIB8EWqCPrQ	Ed Sheeran - Supermarket Flowers [Official Audio]
My Grandma died days ago she was so good to me One day before she died I was at her hospital bed and she hold my face and said we will see us tomorrow and I cried so bad she was so nice and helped me when I had beef with my parents I love her This Song remembers me on my granny	UgwQZMffdt8-dlQKNNV4AaABAg	2018-12-05T17:01:50.000Z	Comment	bIB8EWqCPrQ	Ed Sheeran - Supermarket Flowers [Official Audio]
My bffs heart stoped last night the day both my grandfathers passed away I hate December forever cancer is a jerk	UgxOHgFNBYUgNqfHh094AaABAg	2018-12-04T21:23:07.000Z	Comment	bIB8EWqCPrQ	Ed Sheeran - Supermarket Flowers [Official Audio]
A Couple days ago my dog my nanny and Rockies dog died and he was and I will Always love him Rest in peace rocky	UgytG7RBBaGDWMxxpIB4AaABAg	2018-12-04T19:54:59.000Z	Comment	bIB8EWqCPrQ	Ed Sheeran - Supermarket Flowers [Official Audio]
My best friend died	UgxQQpc_iyEw7A4cP1F4AaABAg	2018-12-04T19:12:12.000Z	Comment	bIB8EWqCPrQ	Ed Sheeran - Supermarket Flowers [Official Audio]
We used this son on my Grammas funrol	UgzBNzceBYGekCtW_Up4AaABAg	2018-12-04T03:15:14.000Z	Comment	bIB8EWqCPrQ	Ed Sheeran - Supermarket Flowers [Official Audio]
fucking anal mainstream	UgyJvdDDpjnA7dMo2bt4AaABAg	2018-12-07T20:27:02.000Z	Comment	DKEkAf4EYCA	Ed Sheeran before he was famous - Street performing
Oooohhhh	UgwVQ2wiankYp4uqL-l4AaABAg	2018-12-07T07:59:59.000Z	Comment	DKEkAf4EYCA	Ed Sheeran before he was famous - Street performing
Lmao at the guy who started clapping off beat RIP failed clap guy	UgwpLya64namdFomZAB4AaABAg	2018-12-07T01:30:28.000Z	Comment	DKEkAf4EYCA	Ed Sheeran before he was famous - Street performing
I felt so happy for you You rock	Ugzvor5TibBYFY753pp4AaABAg	2018-12-06T13:31:07.000Z	Comment	DKEkAf4EYCA	Ed Sheeran before he was famous - Street performing
Little did he know	Ugwx0YLLzzcU4dgziN54AaABAg	2018-12-05T17:00:17.000Z	Comment	DKEkAf4EYCA	Ed Sheeran before he was famous - Street performing
Naw it is millioners	UgyMWnlHXsJolzzUzqt4AaABAg	2018-12-05T15:47:49.000Z	Comment	DKEkAf4EYCA	Ed Sheeran before he was famous - Street performing
oh I jst loved it you are so cool	UgzwBi9Krmr630vzFMd4AaABAg	2018-12-02T09:32:19.000Z	Comment	DKEkAf4EYCA	Ed Sheeran before he was famous - Street performing
bruv you spoke too soon	Ugzg1P3XDXoHg7HYxHR4AaABAg	2018-11-28T17:31:00.000Z	Comment	DKEkAf4EYCA	Ed Sheeran before he was famous - Street performing
what s the name of the title	UgwiDYjMIqG0FIfdJUh4AaABAg	2018-11-24T20:14:03.000Z	Comment	DKEkAf4EYCA	Ed Sheeran before he was famous - Street performing
Watchin this After He hit Billions	UgxAUHVajta0f0GWlBR4AaABAg	2018-11-17T15:09:56.000Z	Comment	DKEkAf4EYCA	Ed Sheeran before he was famous - Street performing
That melts my heart	Ugx_CVydRcQckiXUPL54AaABAg	2018-11-12T20:41:37.000Z	Comment	DKEkAf4EYCA	Ed Sheeran before he was famous - Street performing
Wicked ronald weasly vibes	UgyYLkbskZRdAeppXOd4AaABAg	2018-11-10T22:11:18.000Z	Comment	DKEkAf4EYCA	Ed Sheeran before he was famous - Street performing
Why couldn t i have been there	UgwFuZ887EOt967YMRl4AaABAg	2018-11-10T22:09:35.000Z	Comment	DKEkAf4EYCA	Ed Sheeran before he was famous - Street performing
I love him so much i m crying	UgwhY2QlJrhSO4WODvd4AaABAg	2018-11-10T22:08:49.000Z	Comment	DKEkAf4EYCA	Ed Sheeran before he was famous - Street performing
Heeeeeeey	Ugx3DrNC-JB4o6XBNh94AaABAg	2018-11-03T20:43:19.000Z	Comment	DKEkAf4EYCA	Ed Sheeran before he was famous - Street performing
Pure talent	Ugw36zdwNqIscPm-Uy94AaABAg	2018-10-31T06:33:08.000Z	Comment	DKEkAf4EYCA	Ed Sheeran before he was famous - Street performing
And now he is a lucky man hitting everyone s ears	UgynGXwO0C7LFdBUgd94AaABAg	2018-10-30T08:20:51.000Z	Comment	DKEkAf4EYCA	Ed Sheeran before he was famous - Street performing
This looks like poor rich to me	UgwnDCdCv1cGueJd3sB4AaABAg	2018-10-28T13:47:12.000Z	Comment	DKEkAf4EYCA	Ed Sheeran before he was famous - Street performing
Throwback I would watch this every day so I could learn how he engages a crowd I m starting my own in field Musician film webisodes if anyone wants to check it out First episode coming in a week	UgxbF03gfSN9V32zu4t4AaABAg	2018-10-22T12:39:11.000Z	Comment	DKEkAf4EYCA	Ed Sheeran before he was famous - Street performing
December	UgzJV3Y1zCgctJqDmCZ4AaABAg	2018-12-08T00:33:41.000Z	Comment	G2fOum_KWQU	Ed Sheeran - Drunk [Official Video]
million views I just love this song one of my favorite s from Ed	UgxGHv4FCEXsMYSd-wp4AaABAg	2018-12-02T05:06:23.000Z	Comment	G2fOum_KWQU	Ed Sheeran - Drunk [Official Video]
zoophilia is a crime denounce	UgzuNSSHM6wS92f93cF4AaABAg	2018-12-02T04:36:15.000Z	Comment	G2fOum_KWQU	Ed Sheeran - Drunk [Official Video]
this video is so cute Love the cat	UgzFd26Uhaam8jZhv_x4AaABAg	2018-12-01T23:56:26.000Z	Comment	G2fOum_KWQU	Ed Sheeran - Drunk [Official Video]
Anyone December	Ugz_ifc2Pe3yXswmYu54AaABAg	2018-12-01T21:59:50.000Z	Comment	G2fOum_KWQU	Ed Sheeran - Drunk [Official Video]
million	UgxqbYGJqW9h4KW5UYJ4AaABAg	2018-11-30T16:28:38.000Z	Comment	G2fOum_KWQU	Ed Sheeran - Drunk [Official Video]
What else was he on	UgyKuqU0rYY9r3eBNhx4AaABAg	2018-11-29T11:20:59.000Z	Comment	G2fOum_KWQU	Ed Sheeran - Drunk [Official Video]
I think this is one of his underrated songs like Don t and You need me I don t need you	Ugzt1k_TqNH_yfHZB1R4AaABAg	2018-11-28T17:22:38.000Z	Comment	G2fOum_KWQU	Ed Sheeran - Drunk [Official Video]
at least he has a cat i have nobody	Ugw4KWbk89zSQQUKQPZ4AaABAg	2018-11-27T21:13:25.000Z	Comment	G2fOum_KWQU	Ed Sheeran - Drunk [Official Video]
R u getting drunk off beer	Ugyg_rsbPIN1MCPXY_54AaABAg	2018-11-26T11:46:12.000Z	Comment	G2fOum_KWQU	Ed Sheeran - Drunk [Official Video]
OMG ED	UgyAgc-IHBQ8RZv1y0V4AaABAg	2018-11-24T10:07:16.000Z	Comment	G2fOum_KWQU	Ed Sheeran - Drunk [Official Video]
Guitar Campfire Ed	UgwoanHjpemNbfLHAr14AaABAg	2018-11-23T08:28:04.000Z	Comment	G2fOum_KWQU	Ed Sheeran - Drunk [Official Video]
First to say first	UgzkGWXRCrQAl7y6sbt4AaABAg	2018-11-23T07:42:51.000Z	Comment	G2fOum_KWQU	Ed Sheeran - Drunk [Official Video]
On cold days coldplay s out like the band name	UgzqHIwaw84XZ_JVo154AaABAg	2018-11-22T20:18:40.000Z	Comment	G2fOum_KWQU	Ed Sheeran - Drunk [Official Video]
Ed Sheeran is a nice cat That guy s a weirdo though	Ugw_R-FZ59Zih2q1XNd4AaABAg	2018-11-22T00:37:31.000Z	Comment	G2fOum_KWQU	Ed Sheeran - Drunk [Official Video]
November	Ugyhff_d97NfnM_uK0t4AaABAg	2018-11-20T13:24:34.000Z	Comment	G2fOum_KWQU	Ed Sheeran - Drunk [Official Video]
car XD	Ugw71IrY7xGUNnyGzTZ4AaABAg.8nm9FWdfErH8oSFjfUNsBF	2018-12-04T21:26:00.000Z	Reply	G2fOum_KWQU	Ed Sheeran - Drunk [Official Video]
i m dead	Ugz4YSL7v6WgnvWR6lV4AaABAg	2018-12-08T02:08:23.000Z	Comment	oAKMx14lMH0	SUGA * HYPOTHETICAL ED SHEERAN ST ROUGH
Min YoonGi just come out and show yourself We know it s you OR YOU MAYBE WORKING AT JINHIT If its you Marry me	UgxrCsinTUuEXQNct814AaABAg	2018-12-08T02:07:46.000Z	Comment	oAKMx14lMH0	SUGA * HYPOTHETICAL ED SHEERAN ST ROUGH
Now we understand why yoongi sleeps a lot during the day and hate dance rehearsals	UgyMuc-ra56pLrpMUPZ4AaABAg	2018-12-08T02:04:32.000Z	Comment	oAKMx14lMH0	SUGA * HYPOTHETICAL ED SHEERAN ST ROUGH
Realmente este Suga roba mi corazon As no se bale pinche hombre guapo Ni siquiera eres mi bias	UgwaLjQhyv9_dNcJeT94AaABAg	2018-12-08T01:42:05.000Z	Comment	oAKMx14lMH0	SUGA * HYPOTHETICAL ED SHEERAN ST ROUGH
This is beautiful good job boy	UgyEjrO3-EOwKUI4mLp4AaABAg	2018-12-08T01:34:32.000Z	Comment	oAKMx14lMH0	SUGA * HYPOTHETICAL ED SHEERAN ST ROUGH
ce o bich o mesmo hein	Ugxx3jq1lT9Tp4XLFp94AaABAg	2018-12-08T01:31:58.000Z	Comment	oAKMx14lMH0	SUGA * HYPOTHETICAL ED SHEERAN ST ROUGH
S s suga Well m maybe it s not something ehhh IDK jumps out window	Ugy6GVnqoCzG2nmG1uJ4AaABAg	2018-12-08T01:26:34.000Z	Comment	oAKMx14lMH0	SUGA * HYPOTHETICAL ED SHEERAN ST ROUGH
we stan a genius	UgwzxCceUaYl3EvHJ1Z4AaABAg	2018-12-08T01:20:59.000Z	Comment	oAKMx14lMH0	SUGA * HYPOTHETICAL ED SHEERAN ST ROUGH
When hes actually yoongi	Ugw9sVOWNtZMZ3L5Jup4AaABAg	2018-12-08T00:43:54.000Z	Comment	oAKMx14lMH0	SUGA * HYPOTHETICAL ED SHEERAN ST ROUGH
Omg i loved ArmyPer Minyoongi	UgyD1MeCZunq6OBc3y54AaABAg	2018-12-08T00:34:03.000Z	Comment	oAKMx14lMH0	SUGA * HYPOTHETICAL ED SHEERAN ST ROUGH
real or not this sounds good	UgwNjB9qWCSoe97LUNR4AaABAg	2018-12-08T00:22:53.000Z	Comment	oAKMx14lMH0	SUGA * HYPOTHETICAL ED SHEERAN ST ROUGH
gue denger ada blue side nya wkwk	UgzrC2RzcH_cuUkwQlZ4AaABAg	2018-12-08T00:07:36.000Z	Comment	oAKMx14lMH0	SUGA * HYPOTHETICAL ED SHEERAN ST ROUGH
The most magical melody I am not kidding And I can t stop crying	UgxgGb3YWZBOTZLGrZ54AaABAg	2018-12-08T00:05:21.000Z	Comment	oAKMx14lMH0	SUGA * HYPOTHETICAL ED SHEERAN ST ROUGH
It ll be cool to see how accurate this was when if the song comes out	UgylsIstcvdpwKKW0ql4AaABAg	2018-12-07T23:48:29.000Z	Comment	oAKMx14lMH0	SUGA * HYPOTHETICAL ED SHEERAN ST ROUGH
R Y U Real Yoongi Unbelievable	UgxILMXib79XN3YCbjF4AaABAg	2018-12-07T23:47:49.000Z	Comment	oAKMx14lMH0	SUGA * HYPOTHETICAL ED SHEERAN ST ROUGH
I actually can hear BTS members voices when I m listening to this There are no lyrics but I clearly can hear their voices in my head xD	UgxxRo04uB182cZS1CB4AaABAg	2018-12-07T23:45:25.000Z	Comment	oAKMx14lMH0	SUGA * HYPOTHETICAL ED SHEERAN ST ROUGH
How about a Mash Up with My immortal by Evanescence It would fit quite perfectly imo	UgwxKF1KzsTc3ThNRGl4AaABAg	2018-12-07T23:21:18.000Z	Comment	oAKMx14lMH0	SUGA * HYPOTHETICAL ED SHEERAN ST ROUGH
This is sooo chill to listen to	UgwzvUZiAh0catviMp94AaABAg	2018-12-07T23:13:44.000Z	Comment	oAKMx14lMH0	SUGA * HYPOTHETICAL ED SHEERAN ST ROUGH
Idk how i can appreciate your work on this BUT GIRL THANK YOU GOD BLESS YOUR EVERYTHING	UgxLdlsWF4aJrn3KK0t4AaABAg	2018-12-07T23:13:24.000Z	Comment	oAKMx14lMH0	SUGA * HYPOTHETICAL ED SHEERAN ST ROUGH
years	UgzzatK6XPDZRBwjQXR4AaABAg	2018-12-07T22:12:05.000Z	Comment	A_af256mnTE	Ed Sheeran - Small Bump [Official Video]
Who s peeling those fecking onions	UgzCYDxb5rR0aS81kyd4AaABAg	2018-12-07T15:49:48.000Z	Comment	A_af256mnTE	Ed Sheeran - Small Bump [Official Video]
one of my faves	UgwPHJ5G0Xsl1Mbzm_Z4AaABAg	2018-12-07T02:46:05.000Z	Comment	A_af256mnTE	Ed Sheeran - Small Bump [Official Video]
People say he s a just a generic guy need to listen to this song Man substance is what it s about lads I couldn t care less about your cocaine and sex raps Good that you think you re great when bots generate more than half of your views	UgxsAkKdkgQqagHDZXB4AaABAg	2018-12-06T19:58:55.000Z	Comment	A_af256mnTE	Ed Sheeran - Small Bump [Official Video]
Hello Very nice title song pretty voice singer men with video vevo give me smiley star thanks your send and I appreciate so much	Ugz1GDJ-Ty8LheMlXoV4AaABAg	2018-12-06T02:38:15.000Z	Comment	A_af256mnTE	Ed Sheeran - Small Bump [Official Video]
I miss my child I never had How so	UgyOnlYS0gK1a9H-T_94AaABAg	2018-12-03T21:37:22.000Z	Comment	A_af256mnTE	Ed Sheeran - Small Bump [Official Video]
Perfect	UgyJIZDXLIVNGG5-q-R4AaABAg	2018-12-03T21:13:33.000Z	Comment	A_af256mnTE	Ed Sheeran - Small Bump [Official Video]
My heart stopped on	Ugy-Z6XRhkosNyL1sGZ4AaABAg	2018-12-03T18:22:18.000Z	Comment	A_af256mnTE	Ed Sheeran - Small Bump [Official Video]
Beautiful	UgwYQ-0WJ--padNNSbV4AaABAg	2018-12-03T09:49:34.000Z	Comment	A_af256mnTE	Ed Sheeran - Small Bump [Official Video]
My ex had about miscarriages and it tore me apart im only but i have a heart	UgzEC-13w7e43rvcFql4AaABAg	2018-12-03T05:46:01.000Z	Comment	A_af256mnTE	Ed Sheeran - Small Bump [Official Video]
Miscarriages are a surprisingly common occurrence Thirty to fifty percent of all babies are miscarried and it s a hard thing to overcome If after three months past miscarriage you are still inherently sad or for example cannot look at children or pregnant women you do have PTSD Please make this aware to people because miscarriage is a hard thing and to continue to live through it for months years after it is a horrible fate Please seek therapy counselling anything My would have been due date was two days ago and it still bothers me because of my PTSD related to it Please seek help please try to make yourselves happy Nobody ever says I regret making myself happy	Ugxp8DdTW8HKhNkCVJx4AaABAg	2018-12-03T04:32:04.000Z	Comment	A_af256mnTE	Ed Sheeran - Small Bump [Official Video]
Me is the line you might be left with my hair but you have your mother s eyes referring to harry potter	UgyK0bZpSh1KqcU73VR4AaABAg	2018-12-02T20:00:59.000Z	Comment	A_af256mnTE	Ed Sheeran - Small Bump [Official Video]
im sry for your los	Ugwnq4mRUpbpA88_0gx4AaABAg	2018-12-02T08:08:36.000Z	Comment	A_af256mnTE	Ed Sheeran - Small Bump [Official Video]
such a sad song but yet doesn t sound like a sad song unless you listen closely to the words	UgzW_pEVyrr3ZXnK4fl4AaABAg	2018-12-02T00:21:55.000Z	Comment	A_af256mnTE	Ed Sheeran - Small Bump [Official Video]
I saw this video had over one hundred million views so I figured I should check it out Now I m trying to figure it out	Ugysga0x-Uj7J9YIu2F4AaABAg	2018-11-30T06:49:38.000Z	Comment	A_af256mnTE	Ed Sheeran - Small Bump [Official Video]
This song make me think of the future and how my life going to be with my baby and how more happy i am knowing that im having this baby in my life	UgzBkeuesEeEgkb0wNN4AaABAg	2018-11-30T06:24:22.000Z	Comment	A_af256mnTE	Ed Sheeran - Small Bump [Official Video]
I have tears in my eyes everytime when I listen this song And I cried right now This is the most emotional song I ever hear I love you Ed	Ugyx9Efn_KtLdh4O-_x4AaABAg	2018-11-29T23:09:44.000Z	Comment	A_af256mnTE	Ed Sheeran - Small Bump [Official Video]
AAAAAH no sabes cuanto te admiro we n enserio	UgxFlHr7L3ZhNzuOGnR4AaABAg	2018-11-29T22:32:02.000Z	Comment	A_af256mnTE	Ed Sheeran - Small Bump [Official Video]
fuck me dad	UgzwbZAOAYSnfhsHTPd4AaABAg	2018-11-29T00:24:13.000Z	Comment	A_af256mnTE	Ed Sheeran - Small Bump [Official Video]
same	Ugysga0x-Uj7J9YIu2F4AaABAg.8oGOGR3p1EI8oHvjGYUcvu	2018-11-30T21:10:02.000Z	Reply	A_af256mnTE	Ed Sheeran - Small Bump [Official Video]
This song is smokin	UgwScfwe_CoFMyBo2kx4AaABAg	2018-12-07T13:24:46.000Z	Comment	VFlZXlfda6Y	Ed Sheeran - Nancy Mulligan [Official Audio]
Amazing	UgyE_jW4sp7th1oNmd14AaABAg	2018-12-07T03:23:11.000Z	Comment	VFlZXlfda6Y	Ed Sheeran - Nancy Mulligan [Official Audio]
proud to be Irish bitches	UgwNMLiUSb2pS8NYqdl4AaABAg	2018-12-06T20:43:27.000Z	Comment	VFlZXlfda6Y	Ed Sheeran - Nancy Mulligan [Official Audio]
OMG go Ed	UgwPgU8Y8zNI6_cncqZ4AaABAg	2018-12-06T16:23:33.000Z	Comment	VFlZXlfda6Y	Ed Sheeran - Nancy Mulligan [Official Audio]
the beat to this is just really satisfying	UgwpDRAZueVW8VlD8aV4AaABAg	2018-12-06T15:54:09.000Z	Comment	VFlZXlfda6Y	Ed Sheeran - Nancy Mulligan [Official Audio]
You know you ve made it when you can stare at the video and not need the lyrics	UgwRm0xckgzGi9N5Rh94AaABAg	2018-12-04T22:34:44.000Z	Comment	VFlZXlfda6Y	Ed Sheeran - Nancy Mulligan [Official Audio]
SUBSCRIBE TO PEWDIEPIE	UgzpAeR_Au38cnsHSDZ4AaABAg	2018-12-03T21:33:51.000Z	Comment	VFlZXlfda6Y	Ed Sheeran - Nancy Mulligan [Official Audio]
I Love sheeran I Wish i could see him	UgwYBGdg-Bd5owVURdp4AaABAg	2018-12-03T17:34:46.000Z	Comment	VFlZXlfda6Y	Ed Sheeran - Nancy Mulligan [Official Audio]
Oh my god my little Nova Scotian heart is LOVING this	UgwI1PAbPVSSoBWa75d4AaABAg	2018-12-03T04:38:08.000Z	Comment	VFlZXlfda6Y	Ed Sheeran - Nancy Mulligan [Official Audio]
Sheeran	Ugz7-zqzVp_QyBnskZl4AaABAg	2018-12-02T23:31:57.000Z	Comment	VFlZXlfda6Y	Ed Sheeran - Nancy Mulligan [Official Audio]
my sister is irish so i can relate to ED SHEERNA YAY D	Ugx4XGt0Y8CjFJMDiKV4AaABAg	2018-12-02T23:31:43.000Z	Comment	VFlZXlfda6Y	Ed Sheeran - Nancy Mulligan [Official Audio]
Do a fort nite dance every time a word comes up fortnite	Ugz-4N09yniZU7rnpuN4AaABAg	2018-12-02T14:20:21.000Z	Comment	VFlZXlfda6Y	Ed Sheeran - Nancy Mulligan [Official Audio]
rad	Ugyy19tgXhYFOiC0VWN4AaABAg	2018-12-02T14:17:42.000Z	Comment	VFlZXlfda6Y	Ed Sheeran - Nancy Mulligan [Official Audio]
I m Irish Love you man	Ugze8sAhmVhmbwzVl9V4AaABAg	2018-12-01T23:44:04.000Z	Comment	VFlZXlfda6Y	Ed Sheeran - Nancy Mulligan [Official Audio]
EIGHT children Disgusting	Ugy-XMtuLKH67l7VRv14AaABAg	2018-12-01T23:37:23.000Z	Comment	VFlZXlfda6Y	Ed Sheeran - Nancy Mulligan [Official Audio]
Keep It lit brother	UgyZRR1UMrn1oS-X5Ql4AaABAg	2018-12-01T18:30:33.000Z	Comment	VFlZXlfda6Y	Ed Sheeran - Nancy Mulligan [Official Audio]
love it x	UgzyUBrPbBNet88QxkF4AaABAg	2018-11-30T23:25:23.000Z	Comment	VFlZXlfda6Y	Ed Sheeran - Nancy Mulligan [Official Audio]
keeeeeeeep track	UgyI8SF0c6yLdKigT414AaABAg	2018-11-30T20:21:21.000Z	Comment	VFlZXlfda6Y	Ed Sheeran - Nancy Mulligan [Official Audio]
First to watch first to comment first to like	UgyTd5UJdY345kw89y54AaABAg	2018-12-05T11:21:18.000Z	Comment	PAgsOcvevGc	Ed Sheeran, Bruno Mars ,Charlie Puth Best Hits Songs,Greatest Hits Pop Playlist 2018
Wow cute pic ed sheeran you look genius oh a very nice songs nice compilation of the songs thank you for sharing happy wednesday GOD BLESS	UgxI3z2Dubc_X_sCP_94AaABAg	2018-12-05T11:44:17.000Z	Comment	GxEpZc_FEx0	The Best of Ed Sheeran - Ed Sheeran Greatest Hits Full Album
Good evening world	UgypGjJa0EcUHkTIxcB4AaABAg	2018-12-05T11:39:32.000Z	Comment	GxEpZc_FEx0	The Best of Ed Sheeran - Ed Sheeran Greatest Hits Full Album
its a best music of the planet i love love yourself with the ed sheran my favorite singer	UgxqTwBu9D8yuhXUGPJ4AaABAg	2018-12-05T21:58:48.000Z	Comment	zzezWLxdIyY	Ed Sheeran - Love Yourself (Lyrics)
With respect to ed this is not good	UgxnoyfSID_0fJCmVA14AaABAg	2018-12-04T10:30:19.000Z	Comment	zzezWLxdIyY	Ed Sheeran - Love Yourself (Lyrics)
Better than justin	UgzQRDni1gnAnS7q1RZ4AaABAg	2018-12-02T13:04:40.000Z	Comment	zzezWLxdIyY	Ed Sheeran - Love Yourself (Lyrics)
Hej jak si mysl e to zasp v l p ne justin kokote vyjebanej to tvoje se ned ani poslouchat	Ugz-CP6uPpEdQJTKbvl4AaABAg	2018-11-26T21:30:28.000Z	Comment	zzezWLxdIyY	Ed Sheeran - Love Yourself (Lyrics)
This is fantastically	UgyZaf1mi0L3jYjuZUx4AaABAg	2018-11-26T18:52:02.000Z	Comment	zzezWLxdIyY	Ed Sheeran - Love Yourself (Lyrics)
Ed is my favorite but Justin is the best singer for love yourself	Ugyr1W33-JRb3SakgJd4AaABAg	2018-11-26T12:25:03.000Z	Comment	zzezWLxdIyY	Ed Sheeran - Love Yourself (Lyrics)
hey you could have given this to anyone but justin i mean seriously dude	UgyQEmo6-HcvkpgJ2I54AaABAg	2018-11-25T13:31:31.000Z	Comment	zzezWLxdIyY	Ed Sheeran - Love Yourself (Lyrics)
XD i go to the video and i see your Jungkook picture and i said i like this person XD	UgyrEXsPNFPM5x9WXet4AaABAg	2018-11-24T23:22:04.000Z	Comment	zzezWLxdIyY	Ed Sheeran - Love Yourself (Lyrics)
La chica del canal es ARMY	Ugym2tbh8Agtba7EDiR4AaABAg	2018-11-24T15:35:12.000Z	Comment	zzezWLxdIyY	Ed Sheeran - Love Yourself (Lyrics)
This is without autotune	UgzcnJQ0bimZ0CLOdWt4AaABAg	2018-11-24T05:10:08.000Z	Comment	zzezWLxdIyY	Ed Sheeran - Love Yourself (Lyrics)
oh and i like your pfp of V	UgwPvWJFEgUa1M4dMlJ4AaABAg	2018-11-23T11:14:00.000Z	Comment	zzezWLxdIyY	Ed Sheeran - Love Yourself (Lyrics)
BEAUTIFUL	UgxdgLX8Jd3jcSGgsKR4AaABAg	2018-11-23T11:13:37.000Z	Comment	zzezWLxdIyY	Ed Sheeran - Love Yourself (Lyrics)
Justin bieber wrote this song	UgzEzjcbBhIN84QRBA94AaABAg	2018-11-22T11:28:32.000Z	Comment	zzezWLxdIyY	Ed Sheeran - Love Yourself (Lyrics)
Well actually JB ED and Benny Blanco wrote it all together so that means not only ED wrote this song and JB sounds better I do not like ED s voice	UgxCEZLYgVqHjhY2dFx4AaABAg	2018-11-18T16:59:44.000Z	Comment	zzezWLxdIyY	Ed Sheeran - Love Yourself (Lyrics)
Imagine ed sing the original and not Justin sorry for bad English	Ugzr-Q-ktJXFbcmvaH94AaABAg	2018-11-18T15:31:53.000Z	Comment	zzezWLxdIyY	Ed Sheeran - Love Yourself (Lyrics)
PUT it tells something happened on Justin life	UgzQo0re8IXPQiu52Vd4AaABAg	2018-11-17T01:57:42.000Z	Comment	zzezWLxdIyY	Ed Sheeran - Love Yourself (Lyrics)
Love this song since he wrote it but im glad he let justin sing it	Ugzd93w5At9EAERgTgF4AaABAg	2018-11-16T23:27:23.000Z	Comment	zzezWLxdIyY	Ed Sheeran - Love Yourself (Lyrics)
I was wondering why I liked this song so much when I found out Ed wrote this song it all made sense hahah	UgyNCyK2SEkbzbznq8R4AaABAg	2018-11-16T05:36:23.000Z	Comment	zzezWLxdIyY	Ed Sheeran - Love Yourself (Lyrics)
