Comment	CommentID	CreateTimeStamp	Type	videoID	videoTitle
I didn t lose any of my family members but I just cried because this is too good	UgxR6UsR4zcIVJJcu6d4AaABAg	2018-12-06T05:18:04.000Z	Comment	BaKwRXMoL1Q	Supermarket Flowers - Ed Sheeran [Lyric]
Rip poppy you left us too soon motor neurone disease is horrible I sometimes stop to think that you are really gone love you	Ugx7ZqvR_w3yUPOBmlV4AaABAg	2018-12-06T04:50:08.000Z	Comment	BaKwRXMoL1Q	Supermarket Flowers - Ed Sheeran [Lyric]
my mum and dad died two hours ago in a car crash If it wasn t for Ed Sheeran and this song I wouldn t be cooping and I have no family members around me cause my brothers died last year and now this my best friend committed suicide weeks ago it s like everyone around me is just disappearing my mum had been in hospital for months and had just been released on Sunday it s like the world wasn t wanting her around anymore R I P Philippa mum Allan dad Micheal brother Mitchell brother Emily Brittney BFF LIFE BTW the boys were twins died the same day at the same time by a drive by they would have been on December th They were my twin brothers we were triplets so losing them was really hard like hope for me xxxxxx	Ugw0zJaL6ZsnqJdCVVt4AaABAg	2018-12-06T04:36:09.000Z	Comment	BaKwRXMoL1Q	Supermarket Flowers - Ed Sheeran [Lyric]
About to lose my mum This song makes me cry every time I am crying while typing this Help I love you Mum I don t want you to go I love you as always and forever	Ugw-FvmFyBfaqlLo9S54AaABAg	2018-12-05T20:27:59.000Z	Comment	BaKwRXMoL1Q	Supermarket Flowers - Ed Sheeran [Lyric]
Jij kan heel mooi zingen	UgzvX_7XO9wHN-PEzMl4AaABAg.8ZDmO_Ssw768nL8bQ0FG9I	2018-11-07T06:37:38.000Z	Reply	BaKwRXMoL1Q	Supermarket Flowers - Ed Sheeran [Lyric]
Good	UgzvX_7XO9wHN-PEzMl4AaABAg.8ZDmO_Ssw768n57qKTQVNN	2018-11-01T01:23:05.000Z	Reply	BaKwRXMoL1Q	Supermarket Flowers - Ed Sheeran [Lyric]
Vincent Gap	UgzvX_7XO9wHN-PEzMl4AaABAg.8ZDmO_Ssw768m3p7qM_Xhy	2018-10-06T16:40:12.000Z	Reply	BaKwRXMoL1Q	Supermarket Flowers - Ed Sheeran [Lyric]
Wew	UgzvX_7XO9wHN-PEzMl4AaABAg.8ZDmO_Ssw768lu2Hogfi3z	2018-10-02T12:12:16.000Z	Reply	BaKwRXMoL1Q	Supermarket Flowers - Ed Sheeran [Lyric]
Vincent Gap z	UgzvX_7XO9wHN-PEzMl4AaABAg.8ZDmO_Ssw768l_5MrK7DWk	2018-09-24T08:55:07.000Z	Reply	BaKwRXMoL1Q	Supermarket Flowers - Ed Sheeran [Lyric]
Titixa K I m	UgzvX_7XO9wHN-PEzMl4AaABAg.8ZDmO_Ssw768kJE9Gf3LZ4	2018-08-23T23:13:25.000Z	Reply	BaKwRXMoL1Q	Supermarket Flowers - Ed Sheeran [Lyric]
Brodie Lynn dude he s a miracle	UgzvX_7XO9wHN-PEzMl4AaABAg.8ZDmO_Ssw768i55ujpQL4J	2018-06-29T18:29:14.000Z	Reply	BaKwRXMoL1Q	Supermarket Flowers - Ed Sheeran [Lyric]
nakakainlovekatalaga	UgzvX_7XO9wHN-PEzMl4AaABAg.8ZDmO_Ssw768h_AZQvgvXb	2018-06-16T23:34:56.000Z	Reply	BaKwRXMoL1Q	Supermarket Flowers - Ed Sheeran [Lyric]
Makes me cry	UgzvX_7XO9wHN-PEzMl4AaABAg.8ZDmO_Ssw768h4yanXxGvz	2018-06-04T20:45:13.000Z	Reply	BaKwRXMoL1Q	Supermarket Flowers - Ed Sheeran [Lyric]
So I sing halilula	UgzvX_7XO9wHN-PEzMl4AaABAg.8ZDmO_Ssw768ghNrB08Sjm	2018-05-26T07:33:38.000Z	Reply	BaKwRXMoL1Q	Supermarket Flowers - Ed Sheeran [Lyric]
Vincent Gap ok	UgzvX_7XO9wHN-PEzMl4AaABAg.8ZDmO_Ssw768gcUOmgmuzl	2018-05-24T09:54:35.000Z	Reply	BaKwRXMoL1Q	Supermarket Flowers - Ed Sheeran [Lyric]
Vincent Gap	UgzvX_7XO9wHN-PEzMl4AaABAg.8ZDmO_Ssw768gL8c6CmLhB	2018-05-17T06:57:58.000Z	Reply	BaKwRXMoL1Q	Supermarket Flowers - Ed Sheeran [Lyric]
This song makes me happy	UgzvX_7XO9wHN-PEzMl4AaABAg.8ZDmO_Ssw768g4Ou4MGW7Z	2018-05-10T18:53:08.000Z	Reply	BaKwRXMoL1Q	Supermarket Flowers - Ed Sheeran [Lyric]
Vincent Gap q	UgzvX_7XO9wHN-PEzMl4AaABAg.8ZDmO_Ssw768fqEItz8Hgs	2018-05-04T21:31:56.000Z	Reply	BaKwRXMoL1Q	Supermarket Flowers - Ed Sheeran [Lyric]
Vincent Gap good song	UgzvX_7XO9wHN-PEzMl4AaABAg.8ZDmO_Ssw768f_cRm7nVw5	2018-04-28T10:44:31.000Z	Reply	BaKwRXMoL1Q	Supermarket Flowers - Ed Sheeran [Lyric]
Vincent Gap no	UgzvX_7XO9wHN-PEzMl4AaABAg.8ZDmO_Ssw768fSWz-JnDRr	2018-04-25T07:14:06.000Z	Reply	BaKwRXMoL1Q	Supermarket Flowers - Ed Sheeran [Lyric]
This song is hidden in side me it makes me cry	UgzvX_7XO9wHN-PEzMl4AaABAg.8ZDmO_Ssw768fBtectwcTu	2018-04-18T20:13:56.000Z	Reply	BaKwRXMoL1Q	Supermarket Flowers - Ed Sheeran [Lyric]
Vi ncent Gap	UgzvX_7XO9wHN-PEzMl4AaABAg.8ZDmO_Ssw768erfvvWl-yc	2018-04-10T14:29:55.000Z	Reply	BaKwRXMoL1Q	Supermarket Flowers - Ed Sheeran [Lyric]
Vincent Gap really good song ed is cool	UgzvX_7XO9wHN-PEzMl4AaABAg.8ZDmO_Ssw768ekpVZHxywV	2018-04-07T22:38:53.000Z	Reply	BaKwRXMoL1Q	Supermarket Flowers - Ed Sheeran [Lyric]
Hahaah	UgyGw5c91HnAjsk4K614AaABAg.8oXrH9Gd2ep8oXrKRSgjFM	2018-12-07T01:39:25.000Z	Reply	BaKwRXMoL1Q	Supermarket Flowers - Ed Sheeran [Lyric]
Oo nga	UgyGw5c91HnAjsk4K614AaABAg.8oXrH9Gd2ep8oXrJafuRWy	2018-12-07T01:39:18.000Z	Reply	BaKwRXMoL1Q	Supermarket Flowers - Ed Sheeran [Lyric]
ICONIC	UgzMqkRn1gh0n_T_pAR4AaABAg	2018-12-07T10:13:18.000Z	Comment	3TqGEbROFd4	Ed Sheeran - Don't [Official]
Why does this song fit so well when I play the Doom	Ugx_uMrAJjNkJNuf1954AaABAg	2018-12-06T23:36:41.000Z	Comment	3TqGEbROFd4	Ed Sheeran - Don't [Official]
Ellie Goulding has left the chat	UgycWmTPAXJ-2cfLtyl4AaABAg	2018-12-06T02:28:25.000Z	Comment	3TqGEbROFd4	Ed Sheeran - Don't [Official]
Almost someone	UgxdpdAsmvDZaeG9o2t4AaABAg	2018-12-05T20:31:12.000Z	Comment	3TqGEbROFd4	Ed Sheeran - Don't [Official]
This is got a brilliant beat like if you agree	Ugybv3friDcXUjEko254AaABAg	2018-12-04T17:47:17.000Z	Comment	3TqGEbROFd4	Ed Sheeran - Don't [Official]
I love this song	UgxWuFNQlDasOB5WxRd4AaABAg	2018-12-04T07:13:06.000Z	Comment	3TqGEbROFd4	Ed Sheeran - Don't [Official]
this is why I hate ellie Goulding CHEATER	UgxClWcMSyFINSQOhEt4AaABAg	2018-12-03T20:52:25.000Z	Comment	3TqGEbROFd4	Ed Sheeran - Don't [Official]
This was my childhood	UgxYU-48eTdW08J_lSZ4AaABAg	2018-12-03T03:00:36.000Z	Comment	3TqGEbROFd4	Ed Sheeran - Don't [Official]
December anyone	Ugw7kIOIgd_HpfGkjip4AaABAg	2018-12-03T02:42:48.000Z	Comment	3TqGEbROFd4	Ed Sheeran - Don't [Official]
SO GOOD	UgxOus1DOEe3CDsGsi94AaABAg	2018-12-02T18:04:52.000Z	Comment	3TqGEbROFd4	Ed Sheeran - Don't [Official]
Best Ed Sheeran song of all time	Ugx_Fo68KJh8OlT8b6N4AaABAg	2018-12-02T18:02:32.000Z	Comment	3TqGEbROFd4	Ed Sheeran - Don't [Official]
Why so many dislikes by the way	Ugzm8X6V8TGfiCBq7sJ4AaABAg	2018-12-02T12:32:38.000Z	Comment	3TqGEbROFd4	Ed Sheeran - Don't [Official]
i met this song late night in bed i thought it would be an awful song but i was wrong and it apeard to be a superhit you need to read that in the melody of the song	UgwFJnZEwTrx8SqcdhN4AaABAg	2018-12-02T12:29:15.000Z	Comment	3TqGEbROFd4	Ed Sheeran - Don't [Official]
As his friend queen Taylor would put it Don t be mean to people you never know who s a songwriter	UgxB_AAe7FcIQVH7pGB4AaABAg	2018-11-30T18:22:40.000Z	Comment	3TqGEbROFd4	Ed Sheeran - Don't [Official]
yass	UgwkqUrAa1wuZ078nMh4AaABAg	2018-11-30T18:11:28.000Z	Comment	3TqGEbROFd4	Ed Sheeran - Don't [Official]
Amooo essa m sica	UgyIhNLhjKBxGPfd5qV4AaABAg	2018-11-28T15:16:45.000Z	Comment	3TqGEbROFd4	Ed Sheeran - Don't [Official]
Go Ed	UgxttcrLBzGivO3SsER4AaABAg	2018-11-28T12:36:02.000Z	Comment	3TqGEbROFd4	Ed Sheeran - Don't [Official]
Thank you all for the beautiful comments and a special thank to the people who are sharing parts of their lives feeling so comfortable here under this video and telling us their losses That s what music is suppost to be connection between people who don t even know each other Ed Sheeran is a living legend	Ugx2hWV4kSDuPobwDxh4AaABAg	2017-09-07T08:36:39.000Z	Comment	3Mk0F6mLKik	Ed Sheeran - Supermarket Flowers (Music Video)
im terrified of losing my mum im not scared of anything in my life but losing my mum shes all i have and all i love so much what do you do without your mum as long as i live i will make sure shes always happy and knows how much i love her	UgyavR8xuaDHLr1KpWV4AaABAg	2018-12-08T00:24:58.000Z	Comment	3Mk0F6mLKik	Ed Sheeran - Supermarket Flowers (Music Video)
pumbu	UgzZXxWraynvQbz9pVJ4AaABAg	2018-12-07T22:38:40.000Z	Comment	3Mk0F6mLKik	Ed Sheeran - Supermarket Flowers (Music Video)
I lost my mom last Jan and this song is the only thing that got me thru it And now the anniversary of her death approaches Listening to it again	Ugz9MGQSrOd1u40nPa94AaABAg	2018-12-07T20:51:05.000Z	Comment	3Mk0F6mLKik	Ed Sheeran - Supermarket Flowers (Music Video)
thank you ed you have touched so many lives with this song we are in tears over this my grandmother died when i was only six but i still remember her smile even to her last breath she thanked god for her life you are incredible	UgzA4NlsLKQV8QFjkgN4AaABAg	2018-12-07T18:38:23.000Z	Comment	3Mk0F6mLKik	Ed Sheeran - Supermarket Flowers (Music Video)
played this at my nannys funeral she was a lovely woman she was so funny and caring i might not get likes but can i get for her loss	UgwjefP128hFLmD_r6p4AaABAg	2018-12-07T15:30:13.000Z	Comment	3Mk0F6mLKik	Ed Sheeran - Supermarket Flowers (Music Video)
I m crying while I m watching these these reminds me of my father that died from long cancer at my first birthday	UgxXf_HdBlCnf1LaZk14AaABAg	2018-12-07T13:00:58.000Z	Comment	3Mk0F6mLKik	Ed Sheeran - Supermarket Flowers (Music Video)
I remember when die of my grandfather on heart attack	UgxASUdwKej1XZv3hqh4AaABAg	2018-12-07T07:26:20.000Z	Comment	3Mk0F6mLKik	Ed Sheeran - Supermarket Flowers (Music Video)
Jemand deutsch hier Bin einsam	UgymCY175twPxBNqJUB4AaABAg	2018-12-06T12:59:01.000Z	Comment	3Mk0F6mLKik	Ed Sheeran - Supermarket Flowers (Music Video)
i dont even have a chance to see my grandma when i was kids i ask my mother where is my grandma and she cry	UgygQ22gbfTl7ol5CpZ4AaABAg	2018-12-06T11:40:40.000Z	Comment	3Mk0F6mLKik	Ed Sheeran - Supermarket Flowers (Music Video)
my mum and dad died two hours ago in a car crash If it wasn t for Ed Sheeran and this song I wouldn t be cooping and I have no family members around me cause my brothers died last year and now this my best friend committed suicide weeks ago it s like everyone around me is just disappearing my mum had been in hospital for months and had just been released on Sunday it s like the world wasn t wanting her around anymore R I P Philippa mum Allan dad Micheal brother Mitchell brother Emily Brittney BFF LIFE BTW the boys were twins died the same day at the same time by a drive by they would have been on December th They were my twin brothers we were triplets so losing them was really hard like hope for me xxxxxx	UgwMv3RVM0MPtRbmgR54AaABAg	2018-12-06T04:42:29.000Z	Comment	3Mk0F6mLKik	Ed Sheeran - Supermarket Flowers (Music Video)
Hey Alexa this is so sad play despacito	Ugxgwbd9WdZ-xyCgJQR4AaABAg	2018-12-06T03:45:41.000Z	Comment	3Mk0F6mLKik	Ed Sheeran - Supermarket Flowers (Music Video)
It hurts so much every lyrics touches the heart together with my tears	UgyIzJMIs4nGp45tHlV4AaABAg	2018-12-06T02:04:39.000Z	Comment	3Mk0F6mLKik	Ed Sheeran - Supermarket Flowers (Music Video)
Hallelujah	UgyrjZUPtYNbDzCOzV54AaABAg	2018-12-05T08:48:24.000Z	Comment	3Mk0F6mLKik	Ed Sheeran - Supermarket Flowers (Music Video)
This comment isn t about a mom or a parental figure It s about my brother who drowned in a river at the age of if he were still alive he d be or it s been years he passed away on July nd and his body was found on The Fourth of July and I was when he died you think it s gets better after that No it doesn t I also lost another brother who was in a hospital for about years of his life He died a few months after the first brother who died Then I lost a lot of animals over the past few years and just two years ago My dad had a major heart attack and almost didn t make it back alive He left for the hospital the day before my first day at middle school It was hard for me to sit in class without worrying about him He did make it back and he s better now after waiting months for him to come back when I was told it would be sooner Anyway I ve lost so much but I did say the most of it If you did read this comment and all of it thank you for reading this and I hope your having an amazing day	Ugz4HVwgCJKQM-xBKVl4AaABAg	2018-12-05T04:34:00.000Z	Comment	3Mk0F6mLKik	Ed Sheeran - Supermarket Flowers (Music Video)
Reminds of me of my grandfather who passed away this year It was the first near death I ve ever experienced It was the last day of my final exams and my friends and I were just hanging out My mom kept calling me and I noticed her voice sounded a little tired and depressed Eventually around the last call she told me in a very quiet voice Yoon grandfather went to heaven And then I couldn t hold in my tears Because I was so busy it had been two weeks since I had visited the hospital He had this disease where he couldn t talk or move for five years I even forgot how he sounded like and my parents both used to say he had a beautiful voice And because the exam was over I was planning to go meet him that week Holding a handmade card I had already made tell him about what happened at school And I remember suddenly falling to my knees looking up and whispering to myself Grandpa I am so sorry I was going to visit him two days later and I failed him Can I at least get likes That s how old I am right now	UgzcGHVuZRv6CNQvobR4AaABAg	2018-12-04T14:52:21.000Z	Comment	3Mk0F6mLKik	Ed Sheeran - Supermarket Flowers (Music Video)
Who can dislike this song	Ugzf8-eTkGl26AgH9ON4AaABAg	2018-12-04T05:04:22.000Z	Comment	3Mk0F6mLKik	Ed Sheeran - Supermarket Flowers (Music Video)
We played this at my girlfiend s funeral This was her favorite song She was just and died of cancer She was a very brave fighter and was just smiling at me hours before she passed away I ll forever love her	UgyexL9LcpMBWOe3zcN4AaABAg	2018-12-03T22:58:20.000Z	Comment	3Mk0F6mLKik	Ed Sheeran - Supermarket Flowers (Music Video)
This song hits close to home My sister was murdered on January th At her funeral i sang this but sang it as You were an angel in the shape of my sister she was my love and my world I miss her so much but i sing this song every day by her bed and make sure that she can hear me from heaven I protect her soul with all my heart she is forever in my mind singing this song and i will never forget her Rip Mylee Faith Spread your wings my angel	Ugx3s8nUvZvRaIkbJwt4AaABAg	2018-12-03T21:31:29.000Z	Comment	3Mk0F6mLKik	Ed Sheeran - Supermarket Flowers (Music Video)
This video this song both are very sad this song is gonna be my st favourite I cried	Ugyq6NwWs8bEs888zdp4AaABAg	2018-12-03T16:55:55.000Z	Comment	3Mk0F6mLKik	Ed Sheeran - Supermarket Flowers (Music Video)
U posted this song on u Facebook the day after my grandmother	Ugx2hWV4kSDuPobwDxh4AaABAg.8XCRaNwbT-98oPB_KA1lER	2018-12-03T16:51:55.000Z	Reply	3Mk0F6mLKik	Ed Sheeran - Supermarket Flowers (Music Video)
Ivy Joy Morilla Who calls him Edward Still love that comment Gave u a like	Ugx2hWV4kSDuPobwDxh4AaABAg.8XCRaNwbT-98o9NQeC8hEb	2018-11-27T13:27:36.000Z	Reply	3Mk0F6mLKik	Ed Sheeran - Supermarket Flowers (Music Video)
I m really sorry for you even though I don t know this feeling it must hurt Lots of love	Ugx2hWV4kSDuPobwDxh4AaABAg.8XCRaNwbT-98o9NDQE-_9r	2018-11-27T13:25:48.000Z	Reply	3Mk0F6mLKik	Ed Sheeran - Supermarket Flowers (Music Video)
My dad died and I never new him	Ugx2hWV4kSDuPobwDxh4AaABAg.8XCRaNwbT-98nbODsnvl13	2018-11-13T23:21:11.000Z	Reply	3Mk0F6mLKik	Ed Sheeran - Supermarket Flowers (Music Video)
Your songs are always played in my earphone	Ugx2hWV4kSDuPobwDxh4AaABAg.8XCRaNwbT-98n2UPL_0RRV	2018-10-31T00:42:31.000Z	Reply	3Mk0F6mLKik	Ed Sheeran - Supermarket Flowers (Music Video)
You put this on your Facebook the day after grandma died	Ugx2hWV4kSDuPobwDxh4AaABAg.8XCRaNwbT-98n1PUQeTntT	2018-10-30T14:40:17.000Z	Reply	3Mk0F6mLKik	Ed Sheeran - Supermarket Flowers (Music Video)
Our mum just passed away This song has meaning for me and my family Thank you	Ugx2hWV4kSDuPobwDxh4AaABAg.8XCRaNwbT-98knZ_3QOvmU	2018-09-05T03:17:02.000Z	Reply	3Mk0F6mLKik	Ed Sheeran - Supermarket Flowers (Music Video)
His music is just gets you inside and makes a difference He always has music that just blows everyone s mind	Ugx2hWV4kSDuPobwDxh4AaABAg.8XCRaNwbT-98kBjOO-Rbsj	2018-08-21T01:21:11.000Z	Reply	3Mk0F6mLKik	Ed Sheeran - Supermarket Flowers (Music Video)
Mom	Ugx2hWV4kSDuPobwDxh4AaABAg.8XCRaNwbT-98jen9crnIM3	2018-08-07T20:59:56.000Z	Reply	3Mk0F6mLKik	Ed Sheeran - Supermarket Flowers (Music Video)
elisssa	Ugx2hWV4kSDuPobwDxh4AaABAg.8XCRaNwbT-98id3CAMLuEq	2018-07-13T08:18:57.000Z	Reply	3Mk0F6mLKik	Ed Sheeran - Supermarket Flowers (Music Video)
elisssa	Ugx2hWV4kSDuPobwDxh4AaABAg.8XCRaNwbT-98iRuUwJAXa0	2018-07-08T15:03:15.000Z	Reply	3Mk0F6mLKik	Ed Sheeran - Supermarket Flowers (Music Video)
Reynanblackvaldez V t	Ugx2hWV4kSDuPobwDxh4AaABAg.8XCRaNwbT-98hzZu4_weeF	2018-06-27T05:36:36.000Z	Reply	3Mk0F6mLKik	Ed Sheeran - Supermarket Flowers (Music Video)
elisssa Thank you for this song it s beautiful Seven months ago I watch my grandma slowly die from cancer So thank Ed I know this song has a special place in your heart it has a place in my heart to Your song help me deal with the pain of my grandmother s passing	Ugx2hWV4kSDuPobwDxh4AaABAg.8XCRaNwbT-98hudnOgRoB9	2018-06-25T07:43:11.000Z	Reply	3Mk0F6mLKik	Ed Sheeran - Supermarket Flowers (Music Video)
Btw my kids better not be in Hardin County or well I m sure the IRS has a list of names	Ugx2hWV4kSDuPobwDxh4AaABAg.8XCRaNwbT-98htzWC8aL9C	2018-06-25T01:33:42.000Z	Reply	3Mk0F6mLKik	Ed Sheeran - Supermarket Flowers (Music Video)
elisssa Lady of Justice is symbolic of Department of Justice	Ugx2hWV4kSDuPobwDxh4AaABAg.8XCRaNwbT-98htxCYdL-DA	2018-06-25T01:13:32.000Z	Reply	3Mk0F6mLKik	Ed Sheeran - Supermarket Flowers (Music Video)
elisssa I wonder if the local states attorney still believes in FREEDOM of Speech over silver of coin hidden in someone s home Better take it to Supreme Court CV and harass the crap out of MOM afterwards	Ugx2hWV4kSDuPobwDxh4AaABAg.8XCRaNwbT-98htx5u0PwCz	2018-06-25T01:12:38.000Z	Reply	3Mk0F6mLKik	Ed Sheeran - Supermarket Flowers (Music Video)
This reminds me of my wife s mum and my sons nanny Sharon Baxter who we lost a year ago	Ugx2hWV4kSDuPobwDxh4AaABAg.8XCRaNwbT-98hqJznS-sAP	2018-06-23T15:24:25.000Z	Reply	3Mk0F6mLKik	Ed Sheeran - Supermarket Flowers (Music Video)
I meant lung cancer	UgxXf_HdBlCnf1LaZk14AaABAg.8oZ4KGsmqkF8oZ4_0fSR26	2018-12-07T13:03:07.000Z	Reply	3Mk0F6mLKik	Ed Sheeran - Supermarket Flowers (Music Video)
man this is so damn beautiful	Ugy9PA0Md0n5I8K4APF4AaABAg	2018-12-08T01:47:50.000Z	Comment	CFbyq4Zv4RM	SUGA ED SHEERAN * SEESAW BLOODSTREAM * ST ROUGH MIX
I M SCREAMING	Ugw5km0t1PlsqDhQPrB4AaABAg	2018-12-08T01:47:07.000Z	Comment	CFbyq4Zv4RM	SUGA ED SHEERAN * SEESAW BLOODSTREAM * ST ROUGH MIX
alright she dropped the cheesecake	UgxPgT3lbJVNMcgFxYV4AaABAg	2018-12-08T01:26:45.000Z	Comment	CFbyq4Zv4RM	SUGA ED SHEERAN * SEESAW BLOODSTREAM * ST ROUGH MIX
hey when I listen it in my first time I just think hmm it s not bad But when I listen it once again and again I can t stop looking it cause it s AMAZING	Ugzxtn6G8vwm811AEbt4AaABAg	2018-12-07T23:26:13.000Z	Comment	CFbyq4Zv4RM	SUGA ED SHEERAN * SEESAW BLOODSTREAM * ST ROUGH MIX
I LOVE ED SHEERAN	Ugwp7dnYUo09_xeSDCd4AaABAg	2018-12-07T23:01:31.000Z	Comment	CFbyq4Zv4RM	SUGA ED SHEERAN * SEESAW BLOODSTREAM * ST ROUGH MIX
This is it I swear	UgzY3knm2R0tTHgefPR4AaABAg	2018-12-07T21:36:04.000Z	Comment	CFbyq4Zv4RM	SUGA ED SHEERAN * SEESAW BLOODSTREAM * ST ROUGH MIX
A M A Z I N G	UgwEt-LnSrZ1bhepho94AaABAg	2018-12-07T20:44:01.000Z	Comment	CFbyq4Zv4RM	SUGA ED SHEERAN * SEESAW BLOODSTREAM * ST ROUGH MIX
THIS IS YOONGI	Ugy_rNv0W0KvUNPjg1Z4AaABAg	2018-12-07T19:55:37.000Z	Comment	CFbyq4Zv4RM	SUGA ED SHEERAN * SEESAW BLOODSTREAM * ST ROUGH MIX
This is magic	UgycYNcQs9AJbFqFVL14AaABAg	2018-12-07T19:55:29.000Z	Comment	CFbyq4Zv4RM	SUGA ED SHEERAN * SEESAW BLOODSTREAM * ST ROUGH MIX
this is amazing	UgzDg-H6Hdvfh1ARzx14AaABAg	2018-12-07T19:54:24.000Z	Comment	CFbyq4Zv4RM	SUGA ED SHEERAN * SEESAW BLOODSTREAM * ST ROUGH MIX
yeah no what the fuck	Ugx2Rz-Bc7aAz36jpep4AaABAg	2018-12-07T19:47:15.000Z	Comment	CFbyq4Zv4RM	SUGA ED SHEERAN * SEESAW BLOODSTREAM * ST ROUGH MIX
Yoongi We know it s you	Ugz75FGKwhJ7dkLwWlB4AaABAg	2018-12-07T18:55:59.000Z	Comment	CFbyq4Zv4RM	SUGA ED SHEERAN * SEESAW BLOODSTREAM * ST ROUGH MIX
i m fallin love with this song so soft i don t know how to stop listen i listen again again and again	UgyM4u86f377fPCLgsZ4AaABAg	2018-12-07T18:50:52.000Z	Comment	CFbyq4Zv4RM	SUGA ED SHEERAN * SEESAW BLOODSTREAM * ST ROUGH MIX
I hope Suga sees this	UgydELy-hSUZoe5zaod4AaABAg	2018-12-07T17:53:25.000Z	Comment	CFbyq4Zv4RM	SUGA ED SHEERAN * SEESAW BLOODSTREAM * ST ROUGH MIX
This is so beautiful	Ugx0c9LbSjMDkqisTpV4AaABAg	2018-12-07T17:17:08.000Z	Comment	CFbyq4Zv4RM	SUGA ED SHEERAN * SEESAW BLOODSTREAM * ST ROUGH MIX
Tu es un g nie sache le	UgxDvOzKa5Gw73-_4vV4AaABAg	2018-12-07T17:09:18.000Z	Comment	CFbyq4Zv4RM	SUGA ED SHEERAN * SEESAW BLOODSTREAM * ST ROUGH MIX
si es verdad suga es un genio	UgxNkTMWcOVja9iGcdR4AaABAg	2018-12-07T16:08:02.000Z	Comment	CFbyq4Zv4RM	SUGA ED SHEERAN * SEESAW BLOODSTREAM * ST ROUGH MIX
Ya me gust esta vaina	UgxMF_0aRc2t0As5yzN4AaABAg	2018-12-07T16:07:42.000Z	Comment	CFbyq4Zv4RM	SUGA ED SHEERAN * SEESAW BLOODSTREAM * ST ROUGH MIX
This was just so beautiful that it s making me tear up a little	Ugy3BeAsGRm75H65xBd4AaABAg	2018-12-07T16:06:56.000Z	Comment	CFbyq4Zv4RM	SUGA ED SHEERAN * SEESAW BLOODSTREAM * ST ROUGH MIX
I m on my friends phone no we just call our self brother and sister I m a girl he a boy	Ugyz2EZOvB8T6qvktfh4AaABAg	2018-12-07T20:55:31.000Z	Comment	jmR1j1tFlYw	Perfect - Ed Sheeran (lyrics)
I love this song I always blast the music	UgwEmetkUSBVpJW2ioh4AaABAg	2018-12-05T22:30:23.000Z	Comment	jmR1j1tFlYw	Perfect - Ed Sheeran (lyrics)
This kid has a crush on me and i like him too but i don t know if o should be his girlfriend	UgxoNBLnFdaVrDIAlEd4AaABAg	2018-12-05T00:35:30.000Z	Comment	jmR1j1tFlYw	Perfect - Ed Sheeran (lyrics)
Every man lied this way at least once	UgwddkICSh8Zp9byqzl4AaABAg	2018-12-03T19:57:05.000Z	Comment	jmR1j1tFlYw	Perfect - Ed Sheeran (lyrics)
Best song ever	Ugy6y7NrzJbTinTMYUx4AaABAg	2018-12-02T16:04:40.000Z	Comment	jmR1j1tFlYw	Perfect - Ed Sheeran (lyrics)
Someday wend i get married this will be my wedding song	UgztBN4WaRS0CIzBHcF4AaABAg	2018-12-01T19:28:01.000Z	Comment	jmR1j1tFlYw	Perfect - Ed Sheeran (lyrics)
Song is good love the song	UgypqA8VE39XVwbgnGx4AaABAg	2018-12-01T01:02:29.000Z	Comment	jmR1j1tFlYw	Perfect - Ed Sheeran (lyrics)
This song gets me every time love it This will be my wedding song when I dance with my future husband	Ugwui20yKHlngbGmSIJ4AaABAg	2018-11-30T21:35:31.000Z	Comment	jmR1j1tFlYw	Perfect - Ed Sheeran (lyrics)
Loving it	UgyZgz_TguyJsS8mlU94AaABAg	2018-11-30T21:32:25.000Z	Comment	jmR1j1tFlYw	Perfect - Ed Sheeran (lyrics)
Is it mine and my boyfriend song	UgwqkxexDbUd4t3CiPl4AaABAg	2018-11-30T07:00:19.000Z	Comment	jmR1j1tFlYw	Perfect - Ed Sheeran (lyrics)
Love this song	UgxzgqUc22Vi0BXbDd54AaABAg	2018-11-24T15:51:50.000Z	Comment	jmR1j1tFlYw	Perfect - Ed Sheeran (lyrics)
I like this song for my boyfriend	Ugx2Dt47ZCUNMp_rH0F4AaABAg	2018-11-23T00:42:58.000Z	Comment	jmR1j1tFlYw	Perfect - Ed Sheeran (lyrics)
This mine and my boyfriends song	Ugw4E95jFCnH95up8zl4AaABAg	2018-11-22T02:07:24.000Z	Comment	jmR1j1tFlYw	Perfect - Ed Sheeran (lyrics)
I love this song so much	UgwsH8_b01i4SEM0pl54AaABAg	2018-11-18T16:51:13.000Z	Comment	jmR1j1tFlYw	Perfect - Ed Sheeran (lyrics)
this is an awsome love song	UgzqXVQnvgf9fTx3cbB4AaABAg	2018-03-09T02:02:16.000Z	Comment	jmR1j1tFlYw	Perfect - Ed Sheeran (lyrics)
khkhijljj	UgypqA8VE39XVwbgnGx4AaABAg.8oILKjXeCzH8oJinB1OMfE	2018-12-01T13:55:27.000Z	Reply	jmR1j1tFlYw	Perfect - Ed Sheeran (lyrics)
ghgfgfggffghwedva	Ugwui20yKHlngbGmSIJ4AaABAg.8oHydqAsX6A8oW1XXMKq9q	2018-12-06T08:38:50.000Z	Reply	jmR1j1tFlYw	Perfect - Ed Sheeran (lyrics)
So cute	Ugw4E95jFCnH95up8zl4AaABAg.8nwHbEbpWO48oZmKpEMDOb	2018-12-07T19:34:15.000Z	Reply	jmR1j1tFlYw	Perfect - Ed Sheeran (lyrics)
Kaitlyn Holubec same	Ugw4E95jFCnH95up8zl4AaABAg.8nwHbEbpWO48oI1W4mbehh	2018-11-30T22:09:16.000Z	Reply	jmR1j1tFlYw	Perfect - Ed Sheeran (lyrics)
Check out Josh Michaels song Awaken Now on Spotify It is gaining lots of popularity Save add it to your playlists	UgwSA2gak7VPcluL0ix4AaABAg	2018-09-30T15:52:17.000Z	Comment	zHNyp-3ELO8	Ed Sheeran - How Would You Feel [Lyrics]
Awwwstu my heart attack	Ugx64XT8bHr7o8n-ou54AaABAg	2018-12-06T23:24:34.000Z	Comment	zHNyp-3ELO8	Ed Sheeran - How Would You Feel [Lyrics]
anyone D	Ugx-SzgexaWYDjHpbF14AaABAg	2018-11-29T18:34:36.000Z	Comment	zHNyp-3ELO8	Ed Sheeran - How Would You Feel [Lyrics]
Oooooh crying like a baby	UgyE0DppDNUeJVYrXBZ4AaABAg	2018-11-26T14:04:21.000Z	Comment	zHNyp-3ELO8	Ed Sheeran - How Would You Feel [Lyrics]
I m soooo sad	UgxZq3C5wZjgbA4Y_Dt4AaABAg	2018-11-24T16:23:48.000Z	Comment	zHNyp-3ELO8	Ed Sheeran - How Would You Feel [Lyrics]
Hi Hope you would like my song Feel With You Thanks	UgylzyQ3gnfW9QRl0lZ4AaABAg	2018-11-20T16:11:03.000Z	Comment	zHNyp-3ELO8	Ed Sheeran - How Would You Feel [Lyrics]
I love you too	UgwXn_vLtovQZifzFVR4AaABAg	2018-11-19T00:29:55.000Z	Comment	zHNyp-3ELO8	Ed Sheeran - How Would You Feel [Lyrics]
The rd time that I cried haha i thought i can fight it but i was wrong still touches my heart Full of love	UgxlF_PUb5WtW9kRbyp4AaABAg	2018-11-14T04:28:24.000Z	Comment	zHNyp-3ELO8	Ed Sheeran - How Would You Feel [Lyrics]
love it so much	UgyGwJv1TzGD5MBbYah4AaABAg	2018-11-13T09:58:24.000Z	Comment	zHNyp-3ELO8	Ed Sheeran - How Would You Feel [Lyrics]
Linda can o Ainda mais quando o filho canta para voc Eu neste momento fui no c u Te amo GABRIEL	Ugy8LS1CmnFXWNmMx7B4AaABAg	2018-11-12T18:34:10.000Z	Comment	zHNyp-3ELO8	Ed Sheeran - How Would You Feel [Lyrics]
its sad when you really love someone and can t be with them	UgzxoHvuQoRFIitnftV4AaABAg	2018-11-11T20:14:28.000Z	Comment	zHNyp-3ELO8	Ed Sheeran - How Would You Feel [Lyrics]
