Comment	CommentID	CreateTimeStamp	Type	videoID	videoTitle
How sad would it be to be one of these iFail sheeple in the comments with a sore ass	Ugzk96Njx_YTxExyMyx4AaABAg	2018-12-07T22:03:35.000Z	Comment	KOq8yQ0UzQM	Galaxy Note 9 vs iPhone Xs Max - Full Comparison (Extended)
samsung always wins apple jacked up the prices and not giving free chargers because they lost money from their shitty iphones	Ugy6E4813EocNIcCrvt4AaABAg	2018-12-07T04:18:00.000Z	Comment	KOq8yQ0UzQM	Galaxy Note 9 vs iPhone Xs Max - Full Comparison (Extended)
Great comparison vid Feature wise they will always be miles apart But both flagships phones offer little significant extras relative to their predecessors	UgwO2r-V8R2MRqGkpbZ4AaABAg	2018-12-07T03:01:00.000Z	Comment	KOq8yQ0UzQM	Galaxy Note 9 vs iPhone Xs Max - Full Comparison (Extended)
Note	UgzTWV8pKlZXHUwabXJ4AaABAg	2018-12-07T00:13:27.000Z	Comment	KOq8yQ0UzQM	Galaxy Note 9 vs iPhone Xs Max - Full Comparison (Extended)
This guy he says somethings that are contradictory to what he was saying like the stereo speakers what dose that have to do with the headphone jack And then he brings up how the power is on the phones and then talks about how Apple is extremely strong but mentions memory for no reason and says it s a draw when clearly it isn t just saying there is a lot of biased going on here	UgxGkwyAFrJ0s1Gd9j14AaABAg	2018-12-06T21:37:32.000Z	Comment	KOq8yQ0UzQM	Galaxy Note 9 vs iPhone Xs Max - Full Comparison (Extended)
In the other hand i still use S Thank you	Ugx6wO-4pv-qLn3cy9l4AaABAg	2018-12-05T18:20:25.000Z	Comment	KOq8yQ0UzQM	Galaxy Note 9 vs iPhone Xs Max - Full Comparison (Extended)
I want the iphone for the clout	UgzFxL8NKBvZ_eN_4cx4AaABAg	2018-12-05T02:13:14.000Z	Comment	KOq8yQ0UzQM	Galaxy Note 9 vs iPhone Xs Max - Full Comparison (Extended)
Note com certeza	Ugz30UvymE_cFkUjd8V4AaABAg	2018-12-04T15:55:29.000Z	Comment	KOq8yQ0UzQM	Galaxy Note 9 vs iPhone Xs Max - Full Comparison (Extended)
Note is better in all way with xs max	UgyztU4sQvGd87_U5k94AaABAg	2018-12-04T04:48:03.000Z	Comment	KOq8yQ0UzQM	Galaxy Note 9 vs iPhone Xs Max - Full Comparison (Extended)
Gaming wise yes the iPhone may pull ahead due to the more powerful processor But for note to have that much cool shit inside the phone I can honestly say from being a apple fan boy The note is a better phone	UgyXCr1VCZli4ErOZN14AaABAg	2018-12-04T04:43:40.000Z	Comment	KOq8yQ0UzQM	Galaxy Note 9 vs iPhone Xs Max - Full Comparison (Extended)
Xs audio dope	UgyL8l-LxP5hKbEafQ54AaABAg	2018-12-03T15:39:47.000Z	Comment	KOq8yQ0UzQM	Galaxy Note 9 vs iPhone Xs Max - Full Comparison (Extended)
Saki stop using oldbench it uses opengl instead of Vulkan Vulkan is on iOS but Android adopted it in Antutu sounds right but whatever it is IT MUST NOT BE GEEKBENCH FFS	Ugx1TxhmT74jufTq8Al4AaABAg	2018-12-03T11:09:18.000Z	Comment	KOq8yQ0UzQM	Galaxy Note 9 vs iPhone Xs Max - Full Comparison (Extended)
Apple should include fast charging Adaptor in the box at the first place	UgzBZpY3dcQZDsJvM794AaABAg	2018-12-02T15:20:17.000Z	Comment	KOq8yQ0UzQM	Galaxy Note 9 vs iPhone Xs Max - Full Comparison (Extended)
He is just jealous of the note so he tries to make it seem like the iPhone is better	UgzOZ-yxW7ZTW70L75N4AaABAg	2018-12-01T22:17:15.000Z	Comment	KOq8yQ0UzQM	Galaxy Note 9 vs iPhone Xs Max - Full Comparison (Extended)
in my country ip xs max cost usd	UgySHpIL5kiJDV_YN_Z4AaABAg	2018-12-01T19:51:12.000Z	Comment	KOq8yQ0UzQM	Galaxy Note 9 vs iPhone Xs Max - Full Comparison (Extended)
Based on your assessment I would say the Note best suits me The ONLY plus to me with iPhones are the security of my personal information because of the iCloud which of course would be the game changer my current dilemma and fork in the road Also the FaceTime feature experience all my children use iphones	UgwdgN8NgLe9n690i2N4AaABAg	2018-12-01T11:38:48.000Z	Comment	KOq8yQ0UzQM	Galaxy Note 9 vs iPhone Xs Max - Full Comparison (Extended)
So the only thing apple is better than the note is the processor and it s barely seen or even noticed and the note is better In every thing else so I ll go with note	UgzMzJU-SKxtfV4Kt8J4AaABAg	2018-12-01T10:50:17.000Z	Comment	KOq8yQ0UzQM	Galaxy Note 9 vs iPhone Xs Max - Full Comparison (Extended)
The and only reason that is keeping me away from the note is the Snapchat quality	Ugx3NU6plXz6FoPpTSJ4AaABAg	2018-12-01T09:11:26.000Z	Comment	KOq8yQ0UzQM	Galaxy Note 9 vs iPhone Xs Max - Full Comparison (Extended)
Samsung galaxy Note all the way	UgwrW20n7hK9h1VJX5V4AaABAg	2018-12-01T03:49:35.000Z	Comment	KOq8yQ0UzQM	Galaxy Note 9 vs iPhone Xs Max - Full Comparison (Extended)
I phone x no fornite v bucks or skin Samsung bitch we got a promotion and we better than u apple were trying to contact epic games and we got a promotion Samsung Bitch where	Ugxp0sstTnOqm0UcX494AaABAg	2018-11-30T15:50:19.000Z	Comment	KOq8yQ0UzQM	Galaxy Note 9 vs iPhone Xs Max - Full Comparison (Extended)
Note all the way	UgzhFtT5Ki_CxB0JdB54AaABAg	2018-12-06T21:05:50.000Z	Comment	o42Shm7FyQo	Galaxy Note 9 vs iPhone XS Max: Which is Worth Your $1,000?
This fool is paid to up talk that apple pos	UgyFeL198OxD1dKqSBx4AaABAg	2018-12-05T01:11:10.000Z	Comment	o42Shm7FyQo	Galaxy Note 9 vs iPhone XS Max: Which is Worth Your $1,000?
Note for me I had every note since the first one and pretty much know everything about them	UgxdbL3nLSxX5ill5DJ4AaABAg	2018-12-03T17:25:38.000Z	Comment	o42Shm7FyQo	Galaxy Note 9 vs iPhone XS Max: Which is Worth Your $1,000?
very bald of you to praise the iPhone on an Android channel	Ugy9WfyoDS8ZCIDRDpl4AaABAg	2018-12-03T13:47:44.000Z	Comment	o42Shm7FyQo	Galaxy Note 9 vs iPhone XS Max: Which is Worth Your $1,000?
Over all I think note is my favourite	UgzyDx-V0lU4mhNR8hF4AaABAg	2018-12-01T15:16:07.000Z	Comment	o42Shm7FyQo	Galaxy Note 9 vs iPhone XS Max: Which is Worth Your $1,000?
so let me get this straight You d rather pay at least more for the iPhone because it DOESN T have a headphone Jack or S pen Or am I obviously misunderstanding something	Ugz6gR8r_ItQ4ouzTmV4AaABAg	2018-11-28T13:12:57.000Z	Comment	o42Shm7FyQo	Galaxy Note 9 vs iPhone XS Max: Which is Worth Your $1,000?
Here in Brazil the Note is costing about half of the price of the iPhone XS Max	Ugwz39oUmbA8bjl6S_B4AaABAg	2018-11-27T12:15:41.000Z	Comment	o42Shm7FyQo	Galaxy Note 9 vs iPhone XS Max: Which is Worth Your $1,000?
Been using the note since late October and this is easily the best phone I have ever used it s snappy it has tons of features the camera is great in most situations it s a phone what do you expect the battery life is amazing compared to every other phone I ve had screen is amazing this is the first phone I actually want to game on the tall screen makes a world of difference hands down an amazing phone But it all depends on your preferences some people like the simplicity of apple some like me like the customization of Android and features it has No point in fanboying to either side I ve never owned an iPhone but I don t have a problem with them Just choose the device your happy with and the device that suits your needs	UgwSulbeydqSidlQxkl4AaABAg	2018-11-26T20:28:47.000Z	Comment	o42Shm7FyQo	Galaxy Note 9 vs iPhone XS Max: Which is Worth Your $1,000?
Great review Unbiased and amazing	Ugyz-lJDkLnhi8v2f_Z4AaABAg	2018-11-24T13:17:05.000Z	Comment	o42Shm7FyQo	Galaxy Note 9 vs iPhone XS Max: Which is Worth Your $1,000?
People dont want to hear opinions on what you like better we want you to pick the one we think is better	UgxV88Dhc6dtCNwUqhx4AaABAg	2018-11-24T09:10:44.000Z	Comment	o42Shm7FyQo	Galaxy Note 9 vs iPhone XS Max: Which is Worth Your $1,000?
Note sucks	UgxAiZs0wTiXimPyShF4AaABAg	2018-11-21T17:39:13.000Z	Comment	o42Shm7FyQo	Galaxy Note 9 vs iPhone XS Max: Which is Worth Your $1,000?
samsung for life	UgzFVg4TwLVzl-q7Xn14AaABAg	2018-11-20T10:28:11.000Z	Comment	o42Shm7FyQo	Galaxy Note 9 vs iPhone XS Max: Which is Worth Your $1,000?
I may switch to a different carrier my carrier uses cdma that means I need a brand new phone iPhone x or note	Ugy7bdtQisGV2V9E5nN4AaABAg	2018-11-18T19:00:57.000Z	Comment	o42Shm7FyQo	Galaxy Note 9 vs iPhone XS Max: Which is Worth Your $1,000?
The note and max are on par for hardware Software it s a different story you can t beat iOS I ve used different android phones over the years and I used to be a fandroid bashing iPhones left and right then switched to an iPhone one day just to try it out and now I can t go back The ease of use on iOS is incredible the features work all the time I like android don t get me wrong was very tempted to get one recently but I don t care about customization which is all android has over iOS years in and my iPhone is actually faster than when I got it due to iOS All I can do is thank android for the great competition it s put on apple to improve iPhone hardware and software	Ugx2cYO252n18ut_6Nh4AaABAg	2018-11-16T16:47:22.000Z	Comment	o42Shm7FyQo	Galaxy Note 9 vs iPhone XS Max: Which is Worth Your $1,000?
You sound like MKBHD	UgxFMzR-hQZuWi2Y7ot4AaABAg	2018-11-13T16:39:18.000Z	Comment	o42Shm7FyQo	Galaxy Note 9 vs iPhone XS Max: Which is Worth Your $1,000?
Is this video sponsored by apple	UgxzvgPKBcsWb3N5NQB4AaABAg	2018-11-12T19:19:16.000Z	Comment	o42Shm7FyQo	Galaxy Note 9 vs iPhone XS Max: Which is Worth Your $1,000?
You can expand go to setting go to iCloud yo can upgrade to TB for only every month	UgxKfFp57MAJa7BeBQx4AaABAg	2018-11-11T18:24:26.000Z	Comment	o42Shm7FyQo	Galaxy Note 9 vs iPhone XS Max: Which is Worth Your $1,000?
Sorry apple boy Im NOTE all the way	UgzOr30STzBYRHNzkkt4AaABAg	2018-11-10T21:53:33.000Z	Comment	o42Shm7FyQo	Galaxy Note 9 vs iPhone XS Max: Which is Worth Your $1,000?
Choosing a POS over a Beast This vid has lost all credibility	UgzAMsPtsDu9WCEMaY94AaABAg	2018-11-09T02:54:13.000Z	Comment	o42Shm7FyQo	Galaxy Note 9 vs iPhone XS Max: Which is Worth Your $1,000?
The newly annouced Samsung One UI with Android Pie that s coming in January changes everything	UgziAEi3-yioMK_DVCN4AaABAg	2018-11-07T23:49:06.000Z	Comment	o42Shm7FyQo	Galaxy Note 9 vs iPhone XS Max: Which is Worth Your $1,000?
So which do you think is the better device overall iPhone XS Max vs Samsung Galaxy Note	Ugxqmz67c25FUxUc6QJ4AaABAg	2018-09-13T00:18:20.000Z	Comment	bXnPcyABPK0	iPhone XS Max vs Samsung Galaxy Note 9
iphone used in this video is fake	UgyMIbVrhPXlNJkwaDh4AaABAg	2018-12-07T19:01:28.000Z	Comment	bXnPcyABPK0	iPhone XS Max vs Samsung Galaxy Note 9
And the note offers you butter chicken lol I m changing to Samsung I really mean it so I get free lunch daily	UgykCHQ8dOPD2sOrleR4AaABAg	2018-12-07T17:31:18.000Z	Comment	bXnPcyABPK0	iPhone XS Max vs Samsung Galaxy Note 9
I have both the XS Max and Note At the end of the day iPhone wins because of it seamless integration with all it s devices and eco system There is just too much tinkering you have to do with Samsung phones to do a simple task sometimes and this gets annoying	UgzsMmhoAfgCwmknye94AaABAg	2018-12-07T16:55:06.000Z	Comment	bXnPcyABPK0	iPhone XS Max vs Samsung Galaxy Note 9
Watching this in my note	UgxgLgV9c6lHXWTGUhB4AaABAg	2018-12-07T09:16:13.000Z	Comment	bXnPcyABPK0	iPhone XS Max vs Samsung Galaxy Note 9
All phones are the same anyway but ok	UgwMbLdzZRkmPHhUMIN4AaABAg	2018-12-07T03:56:09.000Z	Comment	bXnPcyABPK0	iPhone XS Max vs Samsung Galaxy Note 9
Samsung note is the winner	Ugy8yu5uDXTppo9JtXl4AaABAg	2018-12-07T02:22:54.000Z	Comment	bXnPcyABPK0	iPhone XS Max vs Samsung Galaxy Note 9
ngomong apaan si anjir	UgyiLOnLyY_bh_K0skt4AaABAg	2018-12-06T22:48:35.000Z	Comment	bXnPcyABPK0	iPhone XS Max vs Samsung Galaxy Note 9
Note At least Samsung doesn t write software that kills your battery and installs it without your knowledge Obviously it appears that apple wanted to make their customers want to buy their latest phone This resulted in several lawsuits I ll never buy another Apple again I really like my note So much freedom	UgzGaUWoK9Wil4IkEXN4AaABAg	2018-12-06T15:12:14.000Z	Comment	bXnPcyABPK0	iPhone XS Max vs Samsung Galaxy Note 9
Tbh almost everyone I know loves apple but it sucks I feel like they try to make the coolest names possible And why are they SO EXPENSIVE Samsung s and Androids and like half the price of apples but better quality and everything I hate apple now	UgzF2ZUrLFuAM2mfbc54AaABAg	2018-12-06T11:28:23.000Z	Comment	bXnPcyABPK0	iPhone XS Max vs Samsung Galaxy Note 9
I ll go for samsung	UgwwakcGV38N0fuR1QR4AaABAg	2018-12-06T07:40:06.000Z	Comment	bXnPcyABPK0	iPhone XS Max vs Samsung Galaxy Note 9
Who is winner Samsung like Iphone comment	UgwtJqErRK2M3pNoTCB4AaABAg	2018-12-06T01:47:27.000Z	Comment	bXnPcyABPK0	iPhone XS Max vs Samsung Galaxy Note 9
This is what I call an unbiased review great job	UgwrerxoH8sKF_VSdqh4AaABAg	2018-12-05T15:22:30.000Z	Comment	bXnPcyABPK0	iPhone XS Max vs Samsung Galaxy Note 9
The Nintendo Ds is better	Ugy5gj7xZE5Bh4xi8td4AaABAg	2018-12-05T04:03:31.000Z	Comment	bXnPcyABPK0	iPhone XS Max vs Samsung Galaxy Note 9
I had the Note and returned it and got the iPhone XS Max Much better battery and better video camera	UgzT5v809b9CjHYv-SN4AaABAg	2018-12-05T03:09:17.000Z	Comment	bXnPcyABPK0	iPhone XS Max vs Samsung Galaxy Note 9
If the Iphone had a wireless charger and an ipen included it would be worth the price tag because these are missing i would go for the note clearly the apple iphone is more robust though better build but no headphone jack Note has a bigger battery If i would design a phone i would put the best features of both phones What is Apple waiting to make a phone with pen	Ugzq_YyRM2fmfeDaunx4AaABAg	2018-12-04T23:36:38.000Z	Comment	bXnPcyABPK0	iPhone XS Max vs Samsung Galaxy Note 9
I m a Samsung fan through and through I m still carrying the Note because I mean I absolutely fell in love with it I ve had a Apple phone hated it They re operating system sucks And being able to do additional stuff on your phone is very limited for me that s a no brainer but I m trying to wait for the Samsung Note to come out before I upgrade And to top that my girls have gone through two Apple phones cuz they crashed to the point that can recover them after a couple years So they upgraded because I had no other choice Fortunate for me we had the Jump program with T Mobile That s one thing I want to mention to anyone thinking about going to Apple that they don t last as long The battery after a year doesn t hold its charge as long as the Samsung	UgyJWsGpEH6raq9Jujt4AaABAg	2018-12-04T08:18:18.000Z	Comment	bXnPcyABPK0	iPhone XS Max vs Samsung Galaxy Note 9
I m planning on upgrading my almost year old iPhone S to either the iPhone XS MAX or the Samsung Galaxy Note this month December My head says I should upgrade to the iPhone XS Max because I want to retain everything from my iPhone S and the iOS ecosystem has really grown on me to be very simple and straightforward However my heart says I should go with the Samsung Galaxy Note because of the features and value for the money that I might be expending I m torn Halp	UgwRq53tdQypbc6Xr2J4AaABAg	2018-12-04T07:39:06.000Z	Comment	bXnPcyABPK0	iPhone XS Max vs Samsung Galaxy Note 9
Note is the best Phone and fuck iphone like if u think that too	UgwDIapNifC1okHw5_l4AaABAg	2018-12-04T01:44:01.000Z	Comment	bXnPcyABPK0	iPhone XS Max vs Samsung Galaxy Note 9
Apple is following Black Berry s steps soon will die	UgyhFysg5ijX751hRnt4AaABAg	2018-12-04T00:29:05.000Z	Comment	bXnPcyABPK0	iPhone XS Max vs Samsung Galaxy Note 9
I have Just ordered the note for hubby	Ugxqmz67c25FUxUc6QJ4AaABAg.8l6qUG-uJfS8nUTFDlb0GD	2018-11-10T21:31:08.000Z	Reply	bXnPcyABPK0	iPhone XS Max vs Samsung Galaxy Note 9
SuperSaf TV of course the NOTE Duh	Ugxqmz67c25FUxUc6QJ4AaABAg.8l6qUG-uJfS8lCuOZZjieE	2018-09-15T08:47:57.000Z	Reply	bXnPcyABPK0	iPhone XS Max vs Samsung Galaxy Note 9
Mike C apple shit	Ugxqmz67c25FUxUc6QJ4AaABAg.8l6qUG-uJfS8lCuMz6Bf6R	2018-09-15T08:47:44.000Z	Reply	bXnPcyABPK0	iPhone XS Max vs Samsung Galaxy Note 9
TheKrazy injun note is better than iphone	Ugxqmz67c25FUxUc6QJ4AaABAg.8l6qUG-uJfS8lCuJlt8JFX	2018-09-15T08:47:18.000Z	Reply	bXnPcyABPK0	iPhone XS Max vs Samsung Galaxy Note 9
Sean Burns yea i will get note for months and i think its smart buy	Ugxqmz67c25FUxUc6QJ4AaABAg.8l6qUG-uJfS8lCuC_tf5oT	2018-09-15T08:46:19.000Z	Reply	bXnPcyABPK0	iPhone XS Max vs Samsung Galaxy Note 9
Note is better than all of Apple smartphones	Ugxqmz67c25FUxUc6QJ4AaABAg.8l6qUG-uJfS8lCmrTCd6O6	2018-09-15T07:42:08.000Z	Reply	bXnPcyABPK0	iPhone XS Max vs Samsung Galaxy Note 9
You joking note	Ugxqmz67c25FUxUc6QJ4AaABAg.8l6qUG-uJfS8lCmp_MVwb8	2018-09-15T07:41:52.000Z	Reply	bXnPcyABPK0	iPhone XS Max vs Samsung Galaxy Note 9
beameron lmfao I ve had iPhones for ten years and I just bought the Note I know exactly wtf I m talking about Clearly YOU don t know about the iOS and what all it can do so you have no clue what android s short comings are	Ugxqmz67c25FUxUc6QJ4AaABAg.8l6qUG-uJfS8lCjiwrTzVE	2018-09-15T07:14:45.000Z	Reply	bXnPcyABPK0	iPhone XS Max vs Samsung Galaxy Note 9
Steve Chong wtf that must be euros they don t cost that much in America	Ugxqmz67c25FUxUc6QJ4AaABAg.8l6qUG-uJfS8lCjVX3sLzz	2018-09-15T07:12:47.000Z	Reply	bXnPcyABPK0	iPhone XS Max vs Samsung Galaxy Note 9
Hirokie that s what a otterbox is for my iPhone X is glass what s the problem	Ugxqmz67c25FUxUc6QJ4AaABAg.8l6qUG-uJfS8lCjGVnSkfZ	2018-09-15T07:10:44.000Z	Reply	bXnPcyABPK0	iPhone XS Max vs Samsung Galaxy Note 9
Derek Kronenberger i phone NEVER had better hardware	Ugxqmz67c25FUxUc6QJ4AaABAg.8l6qUG-uJfS8lCi_cVB2eI	2018-09-15T07:04:45.000Z	Reply	bXnPcyABPK0	iPhone XS Max vs Samsung Galaxy Note 9
Crypto Jihadi you have no clue what you re talking about Please learn about both android and iOS in their current state then come back	Ugxqmz67c25FUxUc6QJ4AaABAg.8l6qUG-uJfS8lCiX9DXbHK	2018-09-15T07:04:16.000Z	Reply	bXnPcyABPK0	iPhone XS Max vs Samsung Galaxy Note 9
walter alas these days android is better faster more stable and your flexible then iOS You are wrong sorry	Ugxqmz67c25FUxUc6QJ4AaABAg.8l6qUG-uJfS8lCiMw2Z9L2	2018-09-15T07:02:52.000Z	Reply	bXnPcyABPK0	iPhone XS Max vs Samsung Galaxy Note 9
Note	Ugxqmz67c25FUxUc6QJ4AaABAg.8l6qUG-uJfS8lChnLWyjje	2018-09-15T06:57:53.000Z	Reply	bXnPcyABPK0	iPhone XS Max vs Samsung Galaxy Note 9
Samsung Now is it worth the upgrade for the extra RAM and Storage	Ugxqmz67c25FUxUc6QJ4AaABAg.8l6qUG-uJfS8lC_C-HfLos	2018-09-15T05:42:44.000Z	Reply	bXnPcyABPK0	iPhone XS Max vs Samsung Galaxy Note 9
Note	Ugxqmz67c25FUxUc6QJ4AaABAg.8l6qUG-uJfS8lCSr33LIrr	2018-09-15T04:38:35.000Z	Reply	bXnPcyABPK0	iPhone XS Max vs Samsung Galaxy Note 9
The Screen brought to by samsung	Ugxqmz67c25FUxUc6QJ4AaABAg.8l6qUG-uJfS8lCRkXMm8t5	2018-09-15T04:28:57.000Z	Reply	bXnPcyABPK0	iPhone XS Max vs Samsung Galaxy Note 9
iPhone XS MAX is better	Ugxqmz67c25FUxUc6QJ4AaABAg.8l6qUG-uJfS8lCRinTWvBa	2018-09-15T04:28:43.000Z	Reply	bXnPcyABPK0	iPhone XS Max vs Samsung Galaxy Note 9
Note	Ugxqmz67c25FUxUc6QJ4AaABAg.8l6qUG-uJfS8lCP_vd7jda	2018-09-15T04:10:01.000Z	Reply	bXnPcyABPK0	iPhone XS Max vs Samsung Galaxy Note 9
Note Fast charging yes Expandable storage yes TB of storage yes And most importantly the headphone jack yes So me note	Ugxqmz67c25FUxUc6QJ4AaABAg.8l6qUG-uJfS8lCPF5lc_nm	2018-09-15T04:07:02.000Z	Reply	bXnPcyABPK0	iPhone XS Max vs Samsung Galaxy Note 9
Here it is The only video you need to watch iPhone XS Max vs Note Which one would you choose Hit me up on discord if you have any questions discord gg mattmoniz	UgzHVFvzDxkMXS8kMx14AaABAg	2018-09-24T15:02:28.000Z	Comment	o1T9gjVWVv8	iPhone XS Max vs Galaxy Note 9 // The iPhone Wins!?
From a consumer perspective the note actually feels like it s worth For me the iPhone xs max does not Just my opinion Apple makes great devices but compared to what the note has to offer I don t see why we are even debating which is better Clearly the note Is better Features screen fast charge out of the box micro sd slot price ect	Ugy9cUmtIsSjlCsMAfl4AaABAg	2018-12-07T12:52:50.000Z	Comment	o1T9gjVWVv8	iPhone XS Max vs Galaxy Note 9 // The iPhone Wins!?
Note just got one after this lol	UgwxvifqbaMmqxcM_IB4AaABAg	2018-12-07T06:46:30.000Z	Comment	o1T9gjVWVv8	iPhone XS Max vs Galaxy Note 9 // The iPhone Wins!?
Note for sure is the best	UgwDNWkmGJpJptzRAeF4AaABAg	2018-12-06T12:03:45.000Z	Comment	o1T9gjVWVv8	iPhone XS Max vs Galaxy Note 9 // The iPhone Wins!?
Although the iPhone does not have Apple Pencil support the Note is too small for drawing art although it is a big phone otherwise The S Pen is just a novelty for most people not ALL MOST	Ugx7pMvI376JVrGaWkx4AaABAg	2018-12-06T02:22:00.000Z	Comment	o1T9gjVWVv8	iPhone XS Max vs Galaxy Note 9 // The iPhone Wins!?
Note sound tinny compared to the XS max	UgwbLQx-0IdVS7s1GTN4AaABAg	2018-12-06T02:15:27.000Z	Comment	o1T9gjVWVv8	iPhone XS Max vs Galaxy Note 9 // The iPhone Wins!?
Watching this on my note	UgzOSwAvQOGbi3XP37h4AaABAg	2018-12-05T23:53:27.000Z	Comment	o1T9gjVWVv8	iPhone XS Max vs Galaxy Note 9 // The iPhone Wins!?
The Galaxy is more ellegant	UgxKCpBwpmIpOPVhGdF4AaABAg	2018-12-05T20:49:29.000Z	Comment	o1T9gjVWVv8	iPhone XS Max vs Galaxy Note 9 // The iPhone Wins!?
I had an iPhone but moved onto Galaxy Note I hated the iPhone but love the iPad Pro For having both operating systems I have found out that IOS is superior in gaming and quality apps However the Note series is all about productivity I can get so much stuff done in no time I m currently using the iPad for making music but that s about it I m going to buy the Galaxy Tab S to go hand in hand with my Note for superior productivity I ll always use both operating systems because I do make music and enjoy gaming on IOS I need the unlimited possibilities with Android	Ugze9MW_b4Gxskc_uPR4AaABAg	2018-12-05T20:32:50.000Z	Comment	o1T9gjVWVv8	iPhone XS Max vs Galaxy Note 9 // The iPhone Wins!?
My Note and S still blazing fast	Ugz-yOypj6CmB4nMvjp4AaABAg	2018-12-05T19:37:07.000Z	Comment	o1T9gjVWVv8	iPhone XS Max vs Galaxy Note 9 // The iPhone Wins!?
FUK IPHONE	Ugwzl2OA6r0ELeTkQtp4AaABAg	2018-12-05T18:59:27.000Z	Comment	o1T9gjVWVv8	iPhone XS Max vs Galaxy Note 9 // The iPhone Wins!?
Watching on oneplus	UgwenoysiPFRXTwzd1t4AaABAg	2018-12-05T13:56:01.000Z	Comment	o1T9gjVWVv8	iPhone XS Max vs Galaxy Note 9 // The iPhone Wins!?
This is the most entertaining video I ve ever seen today	UgzGpY7qJMzsrETIuQR4AaABAg	2018-12-05T06:46:52.000Z	Comment	o1T9gjVWVv8	iPhone XS Max vs Galaxy Note 9 // The iPhone Wins!?
Porque o titulo est em portugu s BR	UgxEh0YCPDdQKy8A1_94AaABAg	2018-12-05T05:07:10.000Z	Comment	o1T9gjVWVv8	iPhone XS Max vs Galaxy Note 9 // The iPhone Wins!?
At least apple doesnt lag like every samsung phone and it outperforms the samsung in speed Apple doesnt explode	UgxvB3Qax9POqXwrHVJ4AaABAg	2018-12-05T03:09:22.000Z	Comment	o1T9gjVWVv8	iPhone XS Max vs Galaxy Note 9 // The iPhone Wins!?
Okay I get hours SOT and hours on my N without any regard for battery optimisation all radios on always on display although on fhd not wqhd I ve noticed that initially battery life was horrible SOT and hrs but after a few charges not using QC as I don t really need it for charging overnight it got longer and longer Now I m impressed with the battery on this device all day usage on medium heavy workloads such as YouTube Netflix casual games and phonecalls	UgzyOLo6sqRHRPvtfOx4AaABAg	2018-12-05T01:28:24.000Z	Comment	o1T9gjVWVv8	iPhone XS Max vs Galaxy Note 9 // The iPhone Wins!?
What vesion of cpu did you use on the samsung note	Ugy_EogZap60YYVXTlx4AaABAg	2018-12-04T16:11:26.000Z	Comment	o1T9gjVWVv8	iPhone XS Max vs Galaxy Note 9 // The iPhone Wins!?
No iphone is no longer the fastest phone on the market it s the huawei mate pro I watched videos and the XS max lost big time to mate pro	UgzH-uGuaAvBm_8HQHh4AaABAg	2018-12-04T15:28:21.000Z	Comment	o1T9gjVWVv8	iPhone XS Max vs Galaxy Note 9 // The iPhone Wins!?
I got hours of screen time with still percent left in the tank	UgxNVVMOojxc__qtWYx4AaABAg	2018-12-04T15:23:11.000Z	Comment	o1T9gjVWVv8	iPhone XS Max vs Galaxy Note 9 // The iPhone Wins!?
The amount of people aggressively claiming their Note is better just shows how self conscious Android users are Show them the Apple logo and they freak the fuck out lol	UgwDSDs7Tp5-Dzcugz94AaABAg	2018-12-04T00:16:13.000Z	Comment	o1T9gjVWVv8	iPhone XS Max vs Galaxy Note 9 // The iPhone Wins!?
Zy Erik Smith On the Note you can swipe any direction anywhere instead of swiping up from the very bottom	UgzHVFvzDxkMXS8kMx14AaABAg.8l_kPOJIPPL8oYF07mKGEF	2018-12-07T05:15:05.000Z	Reply	o1T9gjVWVv8	iPhone XS Max vs Galaxy Note 9 // The iPhone Wins!?
Matthew Moniz if the Face ID is faster in the max then why do u have to swipe to open to the home screen after unlocking the phone with ur Face ID	UgzHVFvzDxkMXS8kMx14AaABAg.8l_kPOJIPPL8oYEZaxdLSV	2018-12-07T05:11:12.000Z	Reply	o1T9gjVWVv8	iPhone XS Max vs Galaxy Note 9 // The iPhone Wins!?
Note	UgzHVFvzDxkMXS8kMx14AaABAg.8l_kPOJIPPL8oF_rOw-5R0	2018-11-29T23:20:26.000Z	Reply	o1T9gjVWVv8	iPhone XS Max vs Galaxy Note 9 // The iPhone Wins!?
Note smacks and slices off Xs Max s camera bump and back glass	UgzHVFvzDxkMXS8kMx14AaABAg.8l_kPOJIPPL8nu8PeEQiXk	2018-11-21T06:08:33.000Z	Reply	o1T9gjVWVv8	iPhone XS Max vs Galaxy Note 9 // The iPhone Wins!?
Note kicks the apple xs max	UgzHVFvzDxkMXS8kMx14AaABAg.8l_kPOJIPPL8nqwUf1KbrR	2018-11-20T00:17:55.000Z	Reply	o1T9gjVWVv8	iPhone XS Max vs Galaxy Note 9 // The iPhone Wins!?
It comes down to os preferance If u want android then the note is for u If u r use to apples large ecosystem then u should go with iPhone Spec wise the phones r very similar and will handle anything thrown at them For me the reason I have stuck with samsung is for the microsd card support It is a cheap way to get a lot more storage on ur phone	UgzHVFvzDxkMXS8kMx14AaABAg.8l_kPOJIPPL8nq59xR6l9i	2018-11-19T16:23:14.000Z	Reply	o1T9gjVWVv8	iPhone XS Max vs Galaxy Note 9 // The iPhone Wins!?
