Comment	CommentID	CreateTimeStamp	Type	videoID	videoTitle
Congrats xsmax	UgwAZHwPImviDbV_FuZ4AaABAg	2018-12-03T15:45:22.000Z	Comment	RTzxUeYNSgE	Fortnite: iPhone XS Max vs Note 9 - Which phone for gaming?
After seeing how phone users play Fortnite mobile I see why I am so much better on my iPad Pro inch xD	UgzZxmIVcHDD_8xEzhl4AaABAg	2018-12-03T05:29:36.000Z	Comment	RTzxUeYNSgE	Fortnite: iPhone XS Max vs Note 9 - Which phone for gaming?
The iphone needs more respect it has phones and the samsung took so many phones get to the note	UgyY7ZohGTJAT8isokR4AaABAg	2018-12-03T03:27:56.000Z	Comment	RTzxUeYNSgE	Fortnite: iPhone XS Max vs Note 9 - Which phone for gaming?
Just wait until fortnite is optimized for the androids just wait and see	UgxqjkSX05N0x1XzHRV4AaABAg	2018-12-02T14:46:22.000Z	Comment	RTzxUeYNSgE	Fortnite: iPhone XS Max vs Note 9 - Which phone for gaming?
His name is literally apple insider we all knew he would like xs max	UgwcsS5PibWjlTNuwyV4AaABAg	2018-12-02T12:51:31.000Z	Comment	RTzxUeYNSgE	Fortnite: iPhone XS Max vs Note 9 - Which phone for gaming?
This nigga is a lie the ip did have frame drop at bruh	Ugx-lJhi-0GtSKliiP94AaABAg	2018-12-02T07:52:41.000Z	Comment	RTzxUeYNSgE	Fortnite: iPhone XS Max vs Note 9 - Which phone for gaming?
Note was made for gaming but still gets beaten wow what a shame	UgySes9TnQv5EMFukdJ4AaABAg	2018-12-02T06:33:05.000Z	Comment	RTzxUeYNSgE	Fortnite: iPhone XS Max vs Note 9 - Which phone for gaming?
Damn this comment section is gonna start a new World War	UgycYBr9UN_EGX_M_1Z4AaABAg	2018-12-01T17:30:52.000Z	Comment	RTzxUeYNSgE	Fortnite: iPhone XS Max vs Note 9 - Which phone for gaming?
The XS Max s highest setting is high settings but the Note s highest setting is epic settings so if you put down the settings on the the Note to high then it would perform the exact same as the XS Max but ig I m just some angry Samsung fanboy	UgyilMLjAaWpCMwX6zN4AaABAg	2018-12-01T05:57:00.000Z	Comment	RTzxUeYNSgE	Fortnite: iPhone XS Max vs Note 9 - Which phone for gaming?
Get the note so you get the galaxy skin	Ugy410h9Gk6b1episnB4AaABAg.8letQ3bs3mA8nvg0HT_3-x	2018-11-21T20:30:09.000Z	Reply	RTzxUeYNSgE	Fortnite: iPhone XS Max vs Note 9 - Which phone for gaming?
why they cause a lot	Ugy410h9Gk6b1episnB4AaABAg.8letQ3bs3mA8nZS8yLQxkP	2018-11-12T19:57:44.000Z	Reply	RTzxUeYNSgE	Fortnite: iPhone XS Max vs Note 9 - Which phone for gaming?
shahmeer baig note was built for gaming	Ugy410h9Gk6b1episnB4AaABAg.8letQ3bs3mA8nHb6H96rfW	2018-11-05T21:38:25.000Z	Reply	RTzxUeYNSgE	Fortnite: iPhone XS Max vs Note 9 - Which phone for gaming?
iPhone is beast and best	Ugy410h9Gk6b1episnB4AaABAg.8letQ3bs3mA8nHDOKHsyV4	2018-11-05T18:02:26.000Z	Reply	RTzxUeYNSgE	Fortnite: iPhone XS Max vs Note 9 - Which phone for gaming?
Note	Ugy410h9Gk6b1episnB4AaABAg.8letQ3bs3mA8n5HTch17ej	2018-11-01T02:47:14.000Z	Reply	RTzxUeYNSgE	Fortnite: iPhone XS Max vs Note 9 - Which phone for gaming?
Rick Mcdonald the whole game is still in beta This doesn t change anything	Ugy410h9Gk6b1episnB4AaABAg.8letQ3bs3mA8mvTq7uCPPu	2018-10-27T22:03:39.000Z	Reply	RTzxUeYNSgE	Fortnite: iPhone XS Max vs Note 9 - Which phone for gaming?
AppleInsider you forgot to turn on performance mode on noob on note	Ugy410h9Gk6b1episnB4AaABAg.8letQ3bs3mA8mvROrzrTK1	2018-10-27T21:42:19.000Z	Reply	RTzxUeYNSgE	Fortnite: iPhone XS Max vs Note 9 - Which phone for gaming?
AppleInsider IPhone X s max	Ugy410h9Gk6b1episnB4AaABAg.8letQ3bs3mA8mrmvcIQ-FE	2018-10-26T11:42:12.000Z	Reply	RTzxUeYNSgE	Fortnite: iPhone XS Max vs Note 9 - Which phone for gaming?
I think that u are a apple fan and u wanted that apple gonna win	Ugy410h9Gk6b1episnB4AaABAg.8letQ3bs3mA8mpyBNNNQ15	2018-10-25T18:42:07.000Z	Reply	RTzxUeYNSgE	Fortnite: iPhone XS Max vs Note 9 - Which phone for gaming?
Justin Games Studios note it s still in beta stages and still is better	Ugy410h9Gk6b1episnB4AaABAg.8letQ3bs3mA8moIZKZ9sQq	2018-10-25T03:10:25.000Z	Reply	RTzxUeYNSgE	Fortnite: iPhone XS Max vs Note 9 - Which phone for gaming?
Justin Games Studios u right	Ugy410h9Gk6b1episnB4AaABAg.8letQ3bs3mA8moIScfqCz2	2018-10-25T03:09:30.000Z	Reply	RTzxUeYNSgE	Fortnite: iPhone XS Max vs Note 9 - Which phone for gaming?
Note wins	Ugy410h9Gk6b1episnB4AaABAg.8letQ3bs3mA8mn9IEyd7vv	2018-10-24T16:30:12.000Z	Reply	RTzxUeYNSgE	Fortnite: iPhone XS Max vs Note 9 - Which phone for gaming?
Jina S shut up idiot note won just cause iPhone x max is your favorite	Ugy410h9Gk6b1episnB4AaABAg.8letQ3bs3mA8mlWpEuaDdA	2018-10-24T01:17:20.000Z	Reply	RTzxUeYNSgE	Fortnite: iPhone XS Max vs Note 9 - Which phone for gaming?
Note samaung	Ugy410h9Gk6b1episnB4AaABAg.8letQ3bs3mA8mlWkC62P-M	2018-10-24T01:16:39.000Z	Reply	RTzxUeYNSgE	Fortnite: iPhone XS Max vs Note 9 - Which phone for gaming?
Note	Ugy410h9Gk6b1episnB4AaABAg.8letQ3bs3mA8mk8Zk70fu3	2018-10-23T12:26:08.000Z	Reply	RTzxUeYNSgE	Fortnite: iPhone XS Max vs Note 9 - Which phone for gaming?
AppleInsider go to hell	Ugy410h9Gk6b1episnB4AaABAg.8letQ3bs3mA8mf6nkyfvzx	2018-10-21T13:34:30.000Z	Reply	RTzxUeYNSgE	Fortnite: iPhone XS Max vs Note 9 - Which phone for gaming?
My iPhone because it was actually affordable	Ugy410h9Gk6b1episnB4AaABAg.8letQ3bs3mA8mdAYV4C2yp	2018-10-20T19:28:45.000Z	Reply	RTzxUeYNSgE	Fortnite: iPhone XS Max vs Note 9 - Which phone for gaming?
Idiot you left Blue Light Filter on on the Note Fortnite is still in beta on Andriod and you didn t turn Performamce Mode to gaming on the Note Idiot	Ugy410h9Gk6b1episnB4AaABAg.8letQ3bs3mA8mcWdXWGtF1	2018-10-20T13:22:34.000Z	Reply	RTzxUeYNSgE	Fortnite: iPhone XS Max vs Note 9 - Which phone for gaming?
CPU and GPU in Razer Phone is much weaker than A on iPhone XS Max	Ugwc6WhUma6H6JagFs54AaABAg.8oSu1VgDNEn8oUFFHZ6wXp	2018-12-05T16:00:12.000Z	Reply	RTzxUeYNSgE	Fortnite: iPhone XS Max vs Note 9 - Which phone for gaming?
iphone when u throw it to a dog its gonna be okay but note u throw it it will be crush iphone have quality protection but even your phone have a good system its not important if not quality protection its just rubbish like use and throwing	Ugyh0zwjCgm6gBociBl4AaABAg	2018-12-07T02:51:35.000Z	Comment	Tholtj0QA6k	I switched from the  Samsung Note 9 to the iPhone XS MAX - Was this a mistake?!
what is the them ur using in the not	Ugx0u16zB7qUtH8J4zJ4AaABAg	2018-12-05T23:57:39.000Z	Comment	Tholtj0QA6k	I switched from the  Samsung Note 9 to the iPhone XS MAX - Was this a mistake?!
Notch is notch for me	UgxBDOskWkW1flQj3e54AaABAg	2018-12-05T20:26:28.000Z	Comment	Tholtj0QA6k	I switched from the  Samsung Note 9 to the iPhone XS MAX - Was this a mistake?!
I have a iPhone Xs max and it s amazing	Ugyy3BO0D9VFEo7r5Zh4AaABAg	2018-12-05T16:35:40.000Z	Comment	Tholtj0QA6k	I switched from the  Samsung Note 9 to the iPhone XS MAX - Was this a mistake?!
Report shows that note has better battery isn t it	UgxiXZdUUsoUgVHcqfZ4AaABAg	2018-12-05T14:58:27.000Z	Comment	Tholtj0QA6k	I switched from the  Samsung Note 9 to the iPhone XS MAX - Was this a mistake?!
I m sorry for you Going back in the Apple golden jail must be torture	UgwN59bR-Z-4M45Q5j14AaABAg	2018-12-05T09:12:47.000Z	Comment	Tholtj0QA6k	I switched from the  Samsung Note 9 to the iPhone XS MAX - Was this a mistake?!
When s came it will kill phonexsmax	UgyklxnzWIuiGuu9frB4AaABAg	2018-12-04T18:40:30.000Z	Comment	Tholtj0QA6k	I switched from the  Samsung Note 9 to the iPhone XS MAX - Was this a mistake?!
Not impossible to use just tKes more time to get to it Just needs some tweaking and update To make make it work	UgyDQ0exSOk85l9g3ot4AaABAg	2018-12-03T17:30:14.000Z	Comment	Tholtj0QA6k	I switched from the  Samsung Note 9 to the iPhone XS MAX - Was this a mistake?!
He sounds like gru	Ugy8f51kr8eQPEy6dDZ4AaABAg	2018-12-03T08:56:45.000Z	Comment	Tholtj0QA6k	I switched from the  Samsung Note 9 to the iPhone XS MAX - Was this a mistake?!
Well this was helpful I m sticking to my Samsung Note	UgxDnujsAztTIVf71E94AaABAg	2018-12-03T02:14:58.000Z	Comment	Tholtj0QA6k	I switched from the  Samsung Note 9 to the iPhone XS MAX - Was this a mistake?!
I do simply use androids and always stayed away from iphones IPhones offer very little bang for the money their software has always been very limited so as their memory capacity without micro sd card slots On top of this iPhone screens keep cracking and were always very fragile and are extremely expensive to fix iphones become fashion rather than technology	Ugz1OsrydzDSuurQJgt4AaABAg	2018-12-02T21:48:22.000Z	Comment	Tholtj0QA6k	I switched from the  Samsung Note 9 to the iPhone XS MAX - Was this a mistake?!
Mamasita por favor	UgwVlf6NES8TGvxeoYJ4AaABAg	2018-12-02T12:05:59.000Z	Comment	Tholtj0QA6k	I switched from the  Samsung Note 9 to the iPhone XS MAX - Was this a mistake?!
Hello friends I would like to buy iphone xs max please let me know how s this phone and good work after two months Mention please how s this phone	UgwACRAurJa90oMheFx4AaABAg	2018-12-02T09:02:45.000Z	Comment	Tholtj0QA6k	I switched from the  Samsung Note 9 to the iPhone XS MAX - Was this a mistake?!
SOON WHEN I SEEN THE TITLE I SAID DUDE YOU MADE THE WORST MISTAKE IN HISTORY SMH	UgyOvV-wd3a9Hf0Ejz94AaABAg	2018-12-02T05:50:38.000Z	Comment	Tholtj0QA6k	I switched from the  Samsung Note 9 to the iPhone XS MAX - Was this a mistake?!
Made the switch to a note and everything is better buuuut There is no synergy between other android devices By that i mean messaging sucks imessage is better by star systems and call quality is sometimes good but mostly not God i wish android would be seamless between devices then itd be perfect	UgyakOGFW3hOQwagfVR4AaABAg	2018-11-30T17:47:30.000Z	Comment	Tholtj0QA6k	I switched from the  Samsung Note 9 to the iPhone XS MAX - Was this a mistake?!
A lack of available alternatives to Airdrop on Android devices is isn t a reflection of a lack of competitiveness within Android It s a reflection of the walled garden that is Apple Anyone who uses Apple knows that That isn t a shortcoming of Android it s a shortcoming of Apple	UgwA4ohVtlyM_eiGszV4AaABAg	2018-11-29T17:37:31.000Z	Comment	Tholtj0QA6k	I switched from the  Samsung Note 9 to the iPhone XS MAX - Was this a mistake?!
Iphone more powerfull better battery better both camera better speaker better Face Id better speed He said that Bye I dont need app use and p youtube vid	Ugz6c_M9CHOl-70X2Vh4AaABAg	2018-11-29T16:25:31.000Z	Comment	Tholtj0QA6k	I switched from the  Samsung Note 9 to the iPhone XS MAX - Was this a mistake?!
No is not a mistake	UgwycPa5cATd4vnYDgx4AaABAg	2018-11-29T14:44:53.000Z	Comment	Tholtj0QA6k	I switched from the  Samsung Note 9 to the iPhone XS MAX - Was this a mistake?!
You thanks for the video hello from texas	UgyPfGw6_LOujKJ1BIJ4AaABAg	2018-11-29T02:50:11.000Z	Comment	Tholtj0QA6k	I switched from the  Samsung Note 9 to the iPhone XS MAX - Was this a mistake?!
The only good thing i phone has is its hardware other than that Samsung Galaxy note has better software	Ugzo9LWZEjJt6GLSwDx4AaABAg	2018-11-28T22:58:49.000Z	Comment	Tholtj0QA6k	I switched from the  Samsung Note 9 to the iPhone XS MAX - Was this a mistake?!
Redskull thank you for reply	Ugx0u16zB7qUtH8J4zJ4AaABAg.8oV5tDZxURn8oWPMXg82ex	2018-12-06T12:07:03.000Z	Reply	Tholtj0QA6k	I switched from the  Samsung Note 9 to the iPhone XS MAX - Was this a mistake?!
hey using Nova Launcher and the Glif Icon Pack	Ugx0u16zB7qUtH8J4zJ4AaABAg.8oV5tDZxURn8oV7N47PH0O	2018-12-06T00:10:36.000Z	Reply	Tholtj0QA6k	I switched from the  Samsung Note 9 to the iPhone XS MAX - Was this a mistake?!
That s great	Ugyy3BO0D9VFEo7r5Zh4AaABAg.8oUJIypCkJ68oUaAm1tmtu	2018-12-05T19:11:49.000Z	Reply	Tholtj0QA6k	I switched from the  Samsung Note 9 to the iPhone XS MAX - Was this a mistake?!
I switched back	UgwN59bR-Z-4M45Q5j14AaABAg.8oTWcJX0L-q8oTxwkF3yLl	2018-12-05T13:20:15.000Z	Reply	Tholtj0QA6k	I switched from the  Samsung Note 9 to the iPhone XS MAX - Was this a mistake?!
Cool story bro	Ugy8f51kr8eQPEy6dDZ4AaABAg.8oOLC5Jipr98oQKIS2Usst	2018-12-04T03:27:22.000Z	Reply	Tholtj0QA6k	I switched from the  Samsung Note 9 to the iPhone XS MAX - Was this a mistake?!
Good plan I still use my Note	UgxDnujsAztTIVf71E94AaABAg.8oNcDKa6aWX8oQKMbCG5hj	2018-12-04T03:27:56.000Z	Reply	Tholtj0QA6k	I switched from the  Samsung Note 9 to the iPhone XS MAX - Was this a mistake?!
Falls ihr euch genauer f r die Akkulaufzeit zwischen Note und iPhone Xs Max interessiert	UgxjMVUsn1O_MH23jNB4AaABAg	2018-10-13T08:51:07.000Z	Comment	AmEK6SZncAw	iPhone Xs Max vs Galaxy Note 9 - Was ist besser?
Ehrlich gesagt finde ich die Note Bilder besser	UgyNfvHFSofwKW7AG8J4AaABAg	2018-12-07T20:27:59.000Z	Comment	AmEK6SZncAw	iPhone Xs Max vs Galaxy Note 9 - Was ist besser?
ich finde samsung viel besser als apple	UgysyiSvu4Hrb13CRZ14AaABAg	2018-12-07T18:22:58.000Z	Comment	AmEK6SZncAw	iPhone Xs Max vs Galaxy Note 9 - Was ist besser?
Das iPhone ist schneller sagt er aber bei dem Beispiel Video ist das Note schneller	UgxnaBIAeYByFp67oat4AaABAg	2018-12-05T14:33:36.000Z	Comment	AmEK6SZncAw	iPhone Xs Max vs Galaxy Note 9 - Was ist besser?
Verarbeitung beim Note kann man wohl nicht gut nennen meins hatte light bleeding und habe es Zur ck gegeben Kaufe mir aber ein neues da ich den Stift sehr sinnvoll finde aber hoffentlich Dan ohne light bleeding F r ein Ger t nicht akzeptabel und erst Recht nicht das das Ger t beim Marktstart kostete	UgzJnJb0NMGsJ2NSrfF4AaABAg	2018-12-05T06:16:50.000Z	Comment	AmEK6SZncAw	iPhone Xs Max vs Galaxy Note 9 - Was ist besser?
Ich h tte ein iPhone plus bin dann auf das Note gewechselt und muss sagen das ios echt geiler war aber ich seh es nicht ein so viel Geld hinzulegen wenn sich kaum was ndert	UgwkQv0rWsadyE3b_Ct4AaABAg	2018-12-04T08:48:19.000Z	Comment	AmEK6SZncAw	iPhone Xs Max vs Galaxy Note 9 - Was ist besser?
ihpone kostet aber auch mehr	Ugz8HyebLs3C5AFYUaF4AaABAg	2018-12-03T18:41:32.000Z	Comment	AmEK6SZncAw	iPhone Xs Max vs Galaxy Note 9 - Was ist besser?
Mag das Design des Note halt einfach nicht	UgxTgql3Fiw0EC3ozTR4AaABAg	2018-12-03T12:54:35.000Z	Comment	AmEK6SZncAw	iPhone Xs Max vs Galaxy Note 9 - Was ist besser?
Mitlerweile es ist in der Basis Variante g nstiger und in der h chsten Variante mit GB f r die kleine Varente krieg ich ein Galaxy S dazu und ein bei der Gro en sogar zweites Galaxy Note mit einer GB SD Karte dazu	UgxzyjznIpF4Fzetzbh4AaABAg	2018-12-02T19:35:08.000Z	Comment	AmEK6SZncAw	iPhone Xs Max vs Galaxy Note 9 - Was ist besser?
Ich habe schon alle m glichen Smartphones gehabt iPhone ist das beste und das beste hat nun mal seinen Preis	Ugzz6viutvslVp-RRsp4AaABAg	2018-12-02T18:12:49.000Z	Comment	AmEK6SZncAw	iPhone Xs Max vs Galaxy Note 9 - Was ist besser?
Warum ist Apple den Randlos	Ugx0YDqwOS7GADSblsN4AaABAg	2018-12-01T09:50:29.000Z	Comment	AmEK6SZncAw	iPhone Xs Max vs Galaxy Note 9 - Was ist besser?
Ich besitze das Note und finde es x geiler als schei apple	Ugy6YAyWbc3X5FjvvuN4AaABAg	2018-11-29T06:08:18.000Z	Comment	AmEK6SZncAw	iPhone Xs Max vs Galaxy Note 9 - Was ist besser?
Die Kamera beim s finde ich deutlich besser als die vom iphone	Ugy2pXIGuUFMJzrnbaR4AaABAg	2018-11-28T16:05:15.000Z	Comment	AmEK6SZncAw	iPhone Xs Max vs Galaxy Note 9 - Was ist besser?
One plus bleibt trodem mein ein und alles	UgxGPQGG71ZGdJhe3ON4AaABAg	2018-11-27T20:18:38.000Z	Comment	AmEK6SZncAw	iPhone Xs Max vs Galaxy Note 9 - Was ist besser?
Gesichtserkennung benutzt man nicht echt wegen der Sicherheit wer wirklich so Angst hat das jemand in sein iphone samsung unerlaubt reinkommt verwendet das einfach nicht und nimmt einen code oder so etwas	Ugz2RtI81vJmBhH3TsZ4AaABAg	2018-11-25T16:02:35.000Z	Comment	AmEK6SZncAw	iPhone Xs Max vs Galaxy Note 9 - Was ist besser?
Warum l sst du den HR sensor der neben den LED flashlight ist im Note aus den das iphone XS Max nicht hat Trotzdem tolles Video	UgyYk5dVx1Y77kRIKjh4AaABAg	2018-11-25T12:46:50.000Z	Comment	AmEK6SZncAw	iPhone Xs Max vs Galaxy Note 9 - Was ist besser?
Kannst du Mal eine Galaxy Note vs Huawei mate pro Video hochladen	Ugw3eJtQsFOFU1EPVH94AaABAg	2018-11-23T18:39:42.000Z	Comment	AmEK6SZncAw	iPhone Xs Max vs Galaxy Note 9 - Was ist besser?
Ich habe mir die ganz Zeit berlegt welches der beiden Smartphones ich mir kaufe Da es das Note jetzt aber beim Black Friday f r gab hab ich zugeschlagen	UgzF3q3UOyYBfWeYRCl4AaABAg	2018-11-23T17:07:07.000Z	Comment	AmEK6SZncAw	iPhone Xs Max vs Galaxy Note 9 - Was ist besser?
Samsung ist klar in f hrung Bei genauer betrachtung Jetzt kommen Apple kids mimimi apple ist immer besser	UgxIF-7GsPcfYBcQYfN4AaABAg	2018-11-23T11:03:42.000Z	Comment	AmEK6SZncAw	iPhone Xs Max vs Galaxy Note 9 - Was ist besser?
Alles sch n und gut allerdings ist die Kamera bei low light beim Note um Welten besser weshalb der Punkt eigentlich an das Note gehen m sste und damit w re das IPhone auch ohne das preisliche Argument geschlagen	UgyQBWSF8I4gzqemsL54AaABAg	2018-11-21T14:07:37.000Z	Comment	AmEK6SZncAw	iPhone Xs Max vs Galaxy Note 9 - Was ist besser?
Verena Schmidt ich w rde dir mal so viel Sonne sagen k nnen bei Android bist du freier da hast du mehr Freiheiten also kannst dein Handy dir so anpassen wie du es willst bei iOS hast du Nachteile sag ihr klipp und klar ich habe selber ein iPhone und bin mit dem iPhone jetzt bitte unzufrieden weil wenn es dann ber Nacht ladet dann ladet nicht richtig dann geht immer aus WLAN an bernachten wenn ich fr h drauf guckt kommen lauter Nachrichten rein weiss WLAN in der Nacht einfach so angeht aber mit Android da bist du besser aufgehoben glaub mir	UgxjMVUsn1O_MH23jNB4AaABAg.8mL008_xPhr8nJWBCAxZLZ	2018-11-06T15:25:09.000Z	Reply	AmEK6SZncAw	iPhone Xs Max vs Galaxy Note 9 - Was ist besser?
Ich brauche dringend Hilfe Ich bin bis jetzt noch apple und ich liebe IOS aber ich kann es mir einfach nicht mehr leisten Aber glaubst du ich w rde jetzt wieder mit Android klarkommen	UgxjMVUsn1O_MH23jNB4AaABAg.8mL008_xPhr8nH-7aNsse6	2018-11-05T15:57:49.000Z	Reply	AmEK6SZncAw	iPhone Xs Max vs Galaxy Note 9 - Was ist besser?
Empyrion ich finde auch du hast vollkommen recht das Note berfl gelt alle anderen Handys mit ihr mit seiner Kamera mit dem S Pen und allen anderen Features	UgxjMVUsn1O_MH23jNB4AaABAg.8mL008_xPhr8n-KysSBK0P	2018-10-29T19:22:24.000Z	Reply	AmEK6SZncAw	iPhone Xs Max vs Galaxy Note 9 - Was ist besser?
Hi ich habe ein s sollte ich eher IPhone xs max oder note holen	UgxjMVUsn1O_MH23jNB4AaABAg.8mL008_xPhr8mfFYJw7FUi	2018-10-21T14:50:54.000Z	Reply	AmEK6SZncAw	iPhone Xs Max vs Galaxy Note 9 - Was ist besser?
Ich kann mich immer noch nicht f r eins f r beide entscheiden	UgxjMVUsn1O_MH23jNB4AaABAg.8mL008_xPhr8md6MiQvF2H	2018-10-20T18:52:11.000Z	Reply	AmEK6SZncAw	iPhone Xs Max vs Galaxy Note 9 - Was ist besser?
den kannste auch vergessen da werden fast nur spiele laufen gelassen und die gpu ist echt gut was strom angeht verbraucht weniger als die alte beim x oder plus aber im normalen app verbrauch ist das max einfach nur scheisse und nein ich bin kein hater ich hab selber ein max	UgxjMVUsn1O_MH23jNB4AaABAg.8mL008_xPhr8malcP8L3R5	2018-10-19T21:03:45.000Z	Reply	AmEK6SZncAw	iPhone Xs Max vs Galaxy Note 9 - Was ist besser?
Double G Bullshit von vorne bis hinten	UgxjMVUsn1O_MH23jNB4AaABAg.8mL008_xPhr8mRPtb7DyEt	2018-10-15T20:32:43.000Z	Reply	AmEK6SZncAw	iPhone Xs Max vs Galaxy Note 9 - Was ist besser?
Peter Paul das note is dem xs nirgendwo berlegen gibt gen gend tests wo das xs max l nger durchh lt und bedenke das note hat ein gr eren akku als xs max die kamera ist vom xs max besser die lautsprecher sind viel besser da bringt auch kein dolby atmos vom note etwas die performance vom xs ist ebenfalls besser somit ist das note ein haufen schei e im vergleich zum xs max schau dir englische youtuber an vorallem im gameplay ist das note eine blamage gegen das xs max	UgxjMVUsn1O_MH23jNB4AaABAg.8mL008_xPhr8mRPk1BR1dn	2018-10-15T20:31:24.000Z	Reply	AmEK6SZncAw	iPhone Xs Max vs Galaxy Note 9 - Was ist besser?
Peter Paul das note is dem xs nirgendwo berlegen gibt gen gend tests wo das xs max l nger durchh lt und bedenke das note hat ein gr eren akku als xs max die kamera ist vom xs max besser die lautsprecher sind viel besser da bringt auch kein dolby atmos vom note etwas die performance vom xs ist ebenfalls besser somit ist das note ein haufen schei e im vergleich zum xs max schau dir englische youtuber an vorallem im gameplay ist das note eine blamage gegen das xs max	UgxjMVUsn1O_MH23jNB4AaABAg.8mL008_xPhr8mRPk1WvTE_	2018-10-15T20:31:24.000Z	Reply	AmEK6SZncAw	iPhone Xs Max vs Galaxy Note 9 - Was ist besser?
Jakob warum soll der test unfair sein alter berleg mal wenn er das note auf fullhd setzt hat das xs max eine h here aufl sung somit kann man jz auch sagen es sei unfair das note hat ein kleineres display und mehr akkukapazit t wenn das nicht schon peinlich genug f r samsung sein sollte das das xs max genauso lang h lt vorallem im alltag l nger als das note nen freund hat es und sein akkustand sinkt schneller als meiner vorallem beim zocken	UgxjMVUsn1O_MH23jNB4AaABAg.8mL008_xPhr8mRPQYxlbCX	2018-10-15T20:28:36.000Z	Reply	AmEK6SZncAw	iPhone Xs Max vs Galaxy Note 9 - Was ist besser?
ist auch nicht an dich gerichtet	UgxjMVUsn1O_MH23jNB4AaABAg.8mL008_xPhr8mRJ0KPtNxQ	2018-10-15T19:32:36.000Z	Reply	AmEK6SZncAw	iPhone Xs Max vs Galaxy Note 9 - Was ist besser?
Das Note ist halt einfach so gut wie in jedem Belang dem iPhone klar berlegen	UgxjMVUsn1O_MH23jNB4AaABAg.8mL008_xPhr8mPlHTTDMYB	2018-10-15T05:09:52.000Z	Reply	AmEK6SZncAw	iPhone Xs Max vs Galaxy Note 9 - Was ist besser?
Ich habe jetzt schon einige Videos zum Note gesehen Habe es bevor ich es bestellt habe noch nicht in der Hand gehalten es ist wirklich riesig im vergleich zu denen die ich vorher hatte Aber ich verstehe beim besten willen nicht wie sich absolut jeder Smartphone Vloger ber den Fingerabdrucksensor aufregen kann Ich selbst komme wunderbar an den Sensor aber auch beim Note ist er f r mich pers nlich an einer guten stelle platziert Ich komme bei normaler handhabe mit dem Zeigefinger locker ber den oberen Smartphone Rand Aus diesem Grund bleibt nur eine M glichkeit Ihr habt sehr kleine H nde o	UgxjMVUsn1O_MH23jNB4AaABAg.8mL008_xPhr8mNG3D67B1z	2018-10-14T05:49:49.000Z	Reply	AmEK6SZncAw	iPhone Xs Max vs Galaxy Note 9 - Was ist besser?
Txktik und keiner will deinen Kommentar lesen du Kevin	UgxjMVUsn1O_MH23jNB4AaABAg.8mL008_xPhr8mMKdvekF6B	2018-10-13T21:10:40.000Z	Reply	AmEK6SZncAw	iPhone Xs Max vs Galaxy Note 9 - Was ist besser?
Hu Man bei Vodafone	UgxjMVUsn1O_MH23jNB4AaABAg.8mL008_xPhr8mMDh_QiqIx	2018-10-13T20:10:00.000Z	Reply	AmEK6SZncAw	iPhone Xs Max vs Galaxy Note 9 - Was ist besser?
ja ist etwas zu lange und etwas mehr Abs ze h tten nicht geschadet	UgxjMVUsn1O_MH23jNB4AaABAg.8mL008_xPhr8mLl1cth7J2	2018-10-13T15:50:44.000Z	Reply	AmEK6SZncAw	iPhone Xs Max vs Galaxy Note 9 - Was ist besser?
Jonas L scher keiner will das lesen hahahhaha	UgxjMVUsn1O_MH23jNB4AaABAg.8mL008_xPhr8mLbn-EI72i	2018-10-13T14:29:58.000Z	Reply	AmEK6SZncAw	iPhone Xs Max vs Galaxy Note 9 - Was ist besser?
Zu Beginn Vielen Dank f r deine M he und deine gute Qualit t Ich fand das Video gut gemacht und bin nat rlich nicht bei allen Punkten einverstanden Kann deine Begr ndungen jedoch verstehen Was ich nicht verstanden habe ist was die AppleWatch in diesem Video zu suchen hat Es beginnt ja beim S Pen welcher ja nur die Note Reihe von Samsung hat Das hast du ja auch gesagt Dann kommst du aber mit der AppleWatch und sagst das es momentan die beste SmartWatch ist und man kann sie nur mit eine iPhone nutzen Also das ist ein Argument f r das s Max Kannst du mir erkl ren wieso du diesen Sprung machst Ich k nnte es ja verstehen wenn der S Penslot im Note leer ist und man daf r extra einen S Pen kaufen m sste Dem ist aber nicht so Der S Pen geh rt zum Preis Die AppleWatch nicht Und das Problem ist das du ein ganz neues Fass aufmachst Nun k nnen wir ja mal sehen was es denn nur f r Apple und nur f r die Note gibt Da finden wir sicherlich vieles und wenn dann jedes f r nur dieses Smartphone sprechen w rde das ist doch ein Witz Aber du l sst das aller ausser Acht sagst das es ein Argument f r das sMax ist Und zu guter letzt gibst du beiden einen Punkt obwohl das Note viel mehr zus tzliches f r weniger zu bieten hat Das einzige womit Apple trumpfen kann ist das eigene Apple Universum dass jo so gut harmoniert Man bedenke auch hier Wieder alles Produkte die man nicht beim Kauf des besten iPhones erh lt Aus meiner Sicht also sicherlich keinen Punkt Und falls man das eben doch dazu z hlen m chte Dasselbe gibt es ja auch bei Samsung Die haben auch ihr eigenes Universum Mein Samsungfernseher kann ich auch nur mit meinem Note steuern Wie eine Vielzahl weiterer Produkte aus dem Hause Samsung Ich finde das so schade dass du aus meiner Sicht vieles vernachl ssigst oder nicht bis zu Ende gedacht hast Und zum Schluss der Preis Hier gehst du wieder nur auf das Produkt zur ck Doch gerade der Punkt Ausstattung welchen du beiden Smartphones je einen Punkt gibst wird es nicht gerecht Das Note hat keine Hilfe von zus tzlichen Ger ten erhalten Das iPhone aber massiv Dennoch ist es immer noch teurer und eine AppleWatch ist ja noch nicht dabei Und dann gibt es daf r keine Punkte D Also ich finde doch der Preis ist sehr wohl einen Punkt wert und dieser Punkt kann nat rlich nur an das Note gehen Es bietet f r seinen Preis doch einiges mehr und kostet doch einiges weniger Ah ich finde es so schade das du diesen Schritt nicht gewagt hast Aber dennoch ansonsten wieder ein tolles Video mit viel Qualit t Mir geht es auch nicht um dich fertig zu machen Daf r h tte es gereicht wenn ich etwas viel k rzeres verfasst h tte Ich hoffe du weisst was ich meine und ich weiss das du eben auch einer dieser YouTube bist der wirklich sagt was er denkt und sehr oft sehr objektiv bleibt	UgxjMVUsn1O_MH23jNB4AaABAg.8mL008_xPhr8mLT4IAAeoq	2018-10-13T13:05:05.000Z	Reply	AmEK6SZncAw	iPhone Xs Max vs Galaxy Note 9 - Was ist besser?
iKnowReview tolle Videos und Vorstellung	UgxjMVUsn1O_MH23jNB4AaABAg.8mL008_xPhr8mLDuI4YlqF	2018-10-13T10:52:30.000Z	Reply	AmEK6SZncAw	iPhone Xs Max vs Galaxy Note 9 - Was ist besser?
