Comment	CommentID	CreateTimeStamp	Type	videoID	videoTitle
The time when this video was recorded the apps were not optimized for iPhone XS Max you can see any other video for speed tests the iPhone wins in all other videos	Ugx1Qbs3KeBbeW3Oskh4AaABAg	2018-10-07T22:56:00.000Z	Comment	bY81stVtst8	REAL LIFE iPhone Xs Max 512GB vs Galaxy Note 9 128GB Speed Test
But really Who needs GBs of storage	UgyZTXduMZlqdZTnA3F4AaABAg	2018-10-07T19:50:53.000Z	Comment	bY81stVtst8	REAL LIFE iPhone Xs Max 512GB vs Galaxy Note 9 128GB Speed Test
Is is the snapdragon	Ugy6TIIGIAYceNrL8E94AaABAg.8ligilrJr-P8lxtVsY9AXH	2018-10-04T00:03:45.000Z	Reply	bY81stVtst8	REAL LIFE iPhone Xs Max 512GB vs Galaxy Note 9 128GB Speed Test
It s all good when you Unlock developers options and decrease the animations and the phone freaking fast I know that trick on android galaxies	Ugy6TIIGIAYceNrL8E94AaABAg.8ligilrJr-P8lnmgZMXeQ5	2018-09-30T01:51:47.000Z	Reply	bY81stVtst8	REAL LIFE iPhone Xs Max 512GB vs Galaxy Note 9 128GB Speed Test
bro please help me do u gift me a note	Ugy6TIIGIAYceNrL8E94AaABAg.8ligilrJr-P8llkPznJh9q	2018-09-29T06:53:26.000Z	Reply	bY81stVtst8	REAL LIFE iPhone Xs Max 512GB vs Galaxy Note 9 128GB Speed Test
Which phone is the best Let me know down below	UgwOJ-NNeE0N6IRMohR4AaABAg	2018-09-22T00:28:50.000Z	Comment	5udhH1ay3jw	IPhone Xs Max vs Galaxy Note 9 // Real World Phone Battle!
Note for the overall features Iphone Xs in terms of camera because sometimes Note produces blurry in front and back cam	UgxnsYrS5M7bmbIBGGt4AaABAg	2018-11-10T16:49:55.000Z	Comment	5udhH1ay3jw	IPhone Xs Max vs Galaxy Note 9 // Real World Phone Battle!
Watching this on my note	UgzjYydivGMnkDS8_qh4AaABAg	2018-10-24T09:58:19.000Z	Comment	5udhH1ay3jw	IPhone Xs Max vs Galaxy Note 9 // Real World Phone Battle!
I say the I phone for best natter life	Ugyos3SzeWPpXnRogit4AaABAg	2018-10-24T01:23:47.000Z	Comment	5udhH1ay3jw	IPhone Xs Max vs Galaxy Note 9 // Real World Phone Battle!
Banana Ham Sandwich The Note is the ultimate winner here High end specs including that amazing Camera and battery	UgzBYa60ln_n0NGdnjB4AaABAg	2018-10-20T04:00:49.000Z	Comment	5udhH1ay3jw	IPhone Xs Max vs Galaxy Note 9 // Real World Phone Battle!
Banana ham sandwich Great comparison review	Ugy5gChjU-DQk_pn8E54AaABAg	2018-10-19T20:43:51.000Z	Comment	5udhH1ay3jw	IPhone Xs Max vs Galaxy Note 9 // Real World Phone Battle!
Note all day	UgwraL2UO0Q1KQg6WSt4AaABAg	2018-10-15T15:52:44.000Z	Comment	5udhH1ay3jw	IPhone Xs Max vs Galaxy Note 9 // Real World Phone Battle!
The note has Dolby atmos though	UgykfGxH02WtL8HouVB4AaABAg	2018-10-12T02:21:56.000Z	Comment	5udhH1ay3jw	IPhone Xs Max vs Galaxy Note 9 // Real World Phone Battle!
It s simple the iPhone is just bigger and the galaxy Note is bigger but more features that go along with its size	UgwtBpDHgwiYa_Pmujx4AaABAg	2018-10-11T02:32:16.000Z	Comment	5udhH1ay3jw	IPhone Xs Max vs Galaxy Note 9 // Real World Phone Battle!
Note hands down Samsungkights Note	UgzxwP-ubeO0N63B7mJ4AaABAg	2018-10-11T00:44:58.000Z	Comment	5udhH1ay3jw	IPhone Xs Max vs Galaxy Note 9 // Real World Phone Battle!
Pixel	UgyvOmhoXNhrSRCLKB94AaABAg	2018-10-09T10:42:04.000Z	Comment	5udhH1ay3jw	IPhone Xs Max vs Galaxy Note 9 // Real World Phone Battle!
Your videos look so nicely optimized on the xs max Is it because of the aspect ratio	Ugx9Fyh_PE7btTiKw154AaABAg	2018-10-09T03:58:53.000Z	Comment	5udhH1ay3jw	IPhone Xs Max vs Galaxy Note 9 // Real World Phone Battle!
Donot buyiphone xs max waste of money and buy iphone only showoff	UgxA5SpdY2ZPaA8MC0Z4AaABAg	2018-10-07T13:05:35.000Z	Comment	5udhH1ay3jw	IPhone Xs Max vs Galaxy Note 9 // Real World Phone Battle!
The apple phone is a easy to use good apps updated ios as for the note its a power user who wants to do more than what apple phones can do	UgwHQ9KHjfJKJirWIy94AaABAg	2018-10-07T05:29:11.000Z	Comment	5udhH1ay3jw	IPhone Xs Max vs Galaxy Note 9 // Real World Phone Battle!
Neither because the v just came out and it has the best camera setup by far U can t go wrong with either of them though it s all about preference	Ugwh3352tkqspw1CbmZ4AaABAg	2018-10-06T20:39:04.000Z	Comment	5udhH1ay3jw	IPhone Xs Max vs Galaxy Note 9 // Real World Phone Battle!
Samsund Apple Sample	UgyjjBgF8Bh14lnef8R4AaABAg	2018-10-06T16:58:38.000Z	Comment	5udhH1ay3jw	IPhone Xs Max vs Galaxy Note 9 // Real World Phone Battle!
I m loving my note but the camera seems dope on the XS MAX BANANA HAM SANDWICH	UgzWIr4dLdy1kFO2gcd4AaABAg	2018-10-05T08:59:00.000Z	Comment	5udhH1ay3jw	IPhone Xs Max vs Galaxy Note 9 // Real World Phone Battle!
Much more faster no need to add the more	UgysTzcdycNvUI4URqp4AaABAg	2018-10-05T06:55:22.000Z	Comment	5udhH1ay3jw	IPhone Xs Max vs Galaxy Note 9 // Real World Phone Battle!
I can take notes with the S Pen and talk at the same time on my Note	Ugythd4-xqrqN_KWmrR4AaABAg	2018-10-04T22:30:22.000Z	Comment	5udhH1ay3jw	IPhone Xs Max vs Galaxy Note 9 // Real World Phone Battle!
I got the Note because it has NFC and Magnetic Secure Transmission technology that make payment easy anywhere	UgxHMXdwYZLng3CFlH14AaABAg	2018-10-04T22:25:32.000Z	Comment	5udhH1ay3jw	IPhone Xs Max vs Galaxy Note 9 // Real World Phone Battle!
Note obviously	UgwOJ-NNeE0N6IRMohR4AaABAg.8lU1pydLUPq8mMMEjGopyI	2018-10-13T21:24:35.000Z	Reply	5udhH1ay3jw	IPhone Xs Max vs Galaxy Note 9 // Real World Phone Battle!
Note	UgwOJ-NNeE0N6IRMohR4AaABAg.8lU1pydLUPq8mJBU_UoWb5	2018-10-12T15:52:54.000Z	Reply	5udhH1ay3jw	IPhone Xs Max vs Galaxy Note 9 // Real World Phone Battle!
you are such a clueless cunt	UgwOJ-NNeE0N6IRMohR4AaABAg.8lU1pydLUPq8m1qhBMfjJg	2018-10-05T22:15:26.000Z	Reply	5udhH1ay3jw	IPhone Xs Max vs Galaxy Note 9 // Real World Phone Battle!
Steven Hyman someone who is smart I agree with you	UgwOJ-NNeE0N6IRMohR4AaABAg.8lU1pydLUPq8lgKyKqO3HS	2018-09-27T04:26:07.000Z	Reply	5udhH1ay3jw	IPhone Xs Max vs Galaxy Note 9 // Real World Phone Battle!
Rails Ruby iPhone X s more advanced than Note	UgwOJ-NNeE0N6IRMohR4AaABAg.8lU1pydLUPq8lejZT6dGO9	2018-09-26T13:31:18.000Z	Reply	5udhH1ay3jw	IPhone Xs Max vs Galaxy Note 9 // Real World Phone Battle!
You re way off when it comes to indoor lowlight shots on the Note buddy	UgwOJ-NNeE0N6IRMohR4AaABAg.8lU1pydLUPq8lejKwF9Fzx	2018-09-26T13:29:19.000Z	Reply	5udhH1ay3jw	IPhone Xs Max vs Galaxy Note 9 // Real World Phone Battle!
note	UgwOJ-NNeE0N6IRMohR4AaABAg.8lU1pydLUPq8lck6jnNP2P	2018-09-25T18:57:38.000Z	Reply	5udhH1ay3jw	IPhone Xs Max vs Galaxy Note 9 // Real World Phone Battle!
eljko Plav i not everyone would be signing contracts as you mentioned and not everyone thinks they should change a new phone every two years if their phone is still well supported	UgwOJ-NNeE0N6IRMohR4AaABAg.8lU1pydLUPq8l_wOA2cmDF	2018-09-24T16:47:09.000Z	Reply	5udhH1ay3jw	IPhone Xs Max vs Galaxy Note 9 // Real World Phone Battle!
You can t compare a Ferrari to a Honda iPhone is luxury Samsung is well it s a Samsung Samsung needs to adopt their own software instead of using android then they may be competition otherwise Samsung is stuck on Android Island whose population is spilling over	UgwOJ-NNeE0N6IRMohR4AaABAg.8lU1pydLUPq8l_tElrIQek	2018-09-24T16:19:39.000Z	Reply	5udhH1ay3jw	IPhone Xs Max vs Galaxy Note 9 // Real World Phone Battle!
Hands down Note The XS is just another apple with little real improvement beyond smoothness	UgwOJ-NNeE0N6IRMohR4AaABAg.8lU1pydLUPq8lZ1PF8Qsy_	2018-09-23T23:01:15.000Z	Reply	5udhH1ay3jw	IPhone Xs Max vs Galaxy Note 9 // Real World Phone Battle!
Team Apple	UgwOJ-NNeE0N6IRMohR4AaABAg.8lU1pydLUPq8lYyfFrTBmq	2018-09-23T22:28:37.000Z	Reply	5udhH1ay3jw	IPhone Xs Max vs Galaxy Note 9 // Real World Phone Battle!
You cannot compare a truck to a car You just cannot do that A note is different from a regular phone that s fact	UgwOJ-NNeE0N6IRMohR4AaABAg.8lU1pydLUPq8lYSduF31Ea	2018-09-23T17:40:04.000Z	Reply	5udhH1ay3jw	IPhone Xs Max vs Galaxy Note 9 // Real World Phone Battle!
I ve had a Samsung for years I ordered note gonna use it for days I might send it back and get new Iphone SX Max that gold one looks dope bananahamsandwhich	UgwOJ-NNeE0N6IRMohR4AaABAg.8lU1pydLUPq8lYSPfrif4D	2018-09-23T17:38:00.000Z	Reply	5udhH1ay3jw	IPhone Xs Max vs Galaxy Note 9 // Real World Phone Battle!
Galaxy Note	UgwOJ-NNeE0N6IRMohR4AaABAg.8lU1pydLUPq8lYPYHA4C3j	2018-09-23T17:12:57.000Z	Reply	5udhH1ay3jw	IPhone Xs Max vs Galaxy Note 9 // Real World Phone Battle!
Rails Ruby face id can be doomed by the twin but yo my man iris No chances at all	UgwOJ-NNeE0N6IRMohR4AaABAg.8lU1pydLUPq8lYMyD2fV-6	2018-09-23T16:50:25.000Z	Reply	5udhH1ay3jw	IPhone Xs Max vs Galaxy Note 9 // Real World Phone Battle!
iPhone Xs it s fast smooth better camera note only beats iPhone in low light It s also more advance phone FaceID gestures Note and iPhone Xs is similar in term of features	UgwOJ-NNeE0N6IRMohR4AaABAg.8lU1pydLUPq8lYMI4uR8E5	2018-09-23T16:44:32.000Z	Reply	5udhH1ay3jw	IPhone Xs Max vs Galaxy Note 9 // Real World Phone Battle!
bogoljub djordjevic whats that	UgwOJ-NNeE0N6IRMohR4AaABAg.8lU1pydLUPq8lXYecIwO3T	2018-09-23T09:13:21.000Z	Reply	5udhH1ay3jw	IPhone Xs Max vs Galaxy Note 9 // Real World Phone Battle!
redmi note	UgwOJ-NNeE0N6IRMohR4AaABAg.8lU1pydLUPq8lXYJTTx9TP	2018-09-23T09:10:20.000Z	Reply	5udhH1ay3jw	IPhone Xs Max vs Galaxy Note 9 // Real World Phone Battle!
Iphone max is just a joke this time	UgwOJ-NNeE0N6IRMohR4AaABAg.8lU1pydLUPq8lXXeHC5r_X	2018-09-23T09:04:34.000Z	Reply	5udhH1ay3jw	IPhone Xs Max vs Galaxy Note 9 // Real World Phone Battle!
I couldn t have had a worse phone than the note Swiftly got rid	UgwAn6AyEt_nX6Kp0Wd4AaABAg	2018-12-06T17:31:24.000Z	Comment	REDAgpbfUo0	Galaxy Note 9 vs iPhone Xs Max - Why iPhone gets BORING FAST
My three year old Note still works fine and has a higher resolution screen than any iPhone No viruses no lag everyone talking crap hasn t owned a newer model Samsung	Ugw6GVdfscxblpBFoQt4AaABAg	2018-12-06T06:34:13.000Z	Comment	REDAgpbfUo0	Galaxy Note 9 vs iPhone Xs Max - Why iPhone gets BORING FAST
I was using iPhone from iPhone to iPhone X but finally bored and took note and I must admit it s a beast n happy IAM	UgymLY7rIRMz5eGOzhV4AaABAg	2018-12-01T09:52:24.000Z	Comment	REDAgpbfUo0	Galaxy Note 9 vs iPhone Xs Max - Why iPhone gets BORING FAST
Main thing nothing to do in apple but the note have allot	UgxRTNY7gTeI6tDAeT54AaABAg	2018-11-29T05:39:45.000Z	Comment	REDAgpbfUo0	Galaxy Note 9 vs iPhone Xs Max - Why iPhone gets BORING FAST
I agree iPhones get boring and that s why I usually go back and forth but I will say I always keep my iPhone longer much longer because the things it does it typically does better It s more dependable generally Less fun No doubt it can be Who doesn t like features and customization	UgyZQu_ymV-Xih4ob3N4AaABAg	2018-11-28T23:38:26.000Z	Comment	REDAgpbfUo0	Galaxy Note 9 vs iPhone Xs Max - Why iPhone gets BORING FAST
Wtf you can do all that on a Samsung Insta switch but I don t got cash so next year lol	UgxaD9v_l3wDGMAjIl94AaABAg	2018-11-26T03:49:39.000Z	Comment	REDAgpbfUo0	Galaxy Note 9 vs iPhone Xs Max - Why iPhone gets BORING FAST
This really isn t anything that folks don t know already	UgwdFBVts4zM1yLWibF4AaABAg	2018-11-24T04:55:11.000Z	Comment	REDAgpbfUo0	Galaxy Note 9 vs iPhone Xs Max - Why iPhone gets BORING FAST
Look there are people who like coke and some people like Pepsi GIVE ME A BREAK	UgzcQA72wfE3gsycP994AaABAg	2018-11-23T04:16:37.000Z	Comment	REDAgpbfUo0	Galaxy Note 9 vs iPhone Xs Max - Why iPhone gets BORING FAST
I always group my iPhone icons and then I fix them just below the whole screen exactly as how it looks on the Samsung this is stupid just las you can drop apps on the screen on the Samsung it s the same with the iPhone you can add folders and then scroll them down to apps below and you re all good trash	Ugw2EWkG8Bu_RWO7q-54AaABAg	2018-11-23T03:11:09.000Z	Comment	REDAgpbfUo0	Galaxy Note 9 vs iPhone Xs Max - Why iPhone gets BORING FAST
This video bores me as well as the comments This is more of a bashing iPhone video than a comparison Do you realize how narcissistic you sound This video is just nit picking the iPhone we get it you re an android fan	UgwMzdAx2b5BN6MnSbJ4AaABAg	2018-11-22T13:05:32.000Z	Comment	REDAgpbfUo0	Galaxy Note 9 vs iPhone Xs Max - Why iPhone gets BORING FAST
It is a s series Ofcourse it didn t change	Ugwwi5EHcSiUBHShy_l4AaABAg	2018-11-21T18:24:10.000Z	Comment	REDAgpbfUo0	Galaxy Note 9 vs iPhone Xs Max - Why iPhone gets BORING FAST
No need for having iPhone to get bored just watching this video alone i get bored so fast	UgyjjFkezyfbY9zv9Kh4AaABAg	2018-11-21T11:05:31.000Z	Comment	REDAgpbfUo0	Galaxy Note 9 vs iPhone Xs Max - Why iPhone gets BORING FAST
I am on xs max and it s not boring for me You are one kind of you I respect that but can you keep this to yourself I think this is rude	Ugw_EKDfJGpJKXcFMz94AaABAg	2018-11-21T06:52:37.000Z	Comment	REDAgpbfUo0	Galaxy Note 9 vs iPhone Xs Max - Why iPhone gets BORING FAST
Boring is a subjective opinion Some people like changes But the others are afraid of changes Another people love a little improvement but the others need much improvement	Ugwqt8ToJ1W_eygFQ-t4AaABAg	2018-11-20T18:25:58.000Z	Comment	REDAgpbfUo0	Galaxy Note 9 vs iPhone Xs Max - Why iPhone gets BORING FAST
I can split someones wig with my nokia	UgyPb-lO8H8G4yhHzO94AaABAg	2018-11-20T07:01:18.000Z	Comment	REDAgpbfUo0	Galaxy Note 9 vs iPhone Xs Max - Why iPhone gets BORING FAST
I m getting the note wensday	Ugy00WlfkOXvgIbd0NJ4AaABAg	2018-11-20T00:40:09.000Z	Comment	REDAgpbfUo0	Galaxy Note 9 vs iPhone Xs Max - Why iPhone gets BORING FAST
Sakitech is one of my favorite Reviewers I m an year iphone user and totally bored of it I ve been saying it for two months Also lack of split screen and pop up windows is ridiculous in I m waiting for the S and its bye bye iphone	Ugw9oNB0jkdNQYxgEbB4AaABAg	2018-11-19T23:26:30.000Z	Comment	REDAgpbfUo0	Galaxy Note 9 vs iPhone Xs Max - Why iPhone gets BORING FAST
Hello sakitech you can do the wallpaper on the front and only have the dock apps on the iphone Just put it all on the second page	UgxOUXKWo2mlCY1TyNJ4AaABAg	2018-11-19T22:09:33.000Z	Comment	REDAgpbfUo0	Galaxy Note 9 vs iPhone Xs Max - Why iPhone gets BORING FAST
Customization No thanks I m an adult and need a reliable non lagging and crashing device I don t care about kid shit as customizing a damn phone I use for making calls social media and work I ll even take the iPhone Plus over any modern android flagship any day	UgzFA7r9K3beGAFwxXp4AaABAg	2018-11-19T22:05:17.000Z	Comment	REDAgpbfUo0	Galaxy Note 9 vs iPhone Xs Max - Why iPhone gets BORING FAST
As a reply to your first argument you can actually leave the first home screen page blank on iOS	Ugx_RX-2UEFLF6_DsWp4AaABAg	2018-11-19T21:26:21.000Z	Comment	REDAgpbfUo0	Galaxy Note 9 vs iPhone Xs Max - Why iPhone gets BORING FAST
ur just being sensitive He s stating his opinion in the nicest way possible	Ugw_EKDfJGpJKXcFMz94AaABAg.8nuDSRB5xFV8o3hjo0Hw-6	2018-11-25T08:38:25.000Z	Reply	REDAgpbfUo0	Galaxy Note 9 vs iPhone Xs Max - Why iPhone gets BORING FAST
srbell its just fancy texting man Let it go	Ugw9oNB0jkdNQYxgEbB4AaABAg.8nqqb3ulf_78nt1Fk3GYym	2018-11-20T19:46:47.000Z	Reply	REDAgpbfUo0	Galaxy Note 9 vs iPhone Xs Max - Why iPhone gets BORING FAST
I m w you but I can t leave iMessage and group texts	Ugw9oNB0jkdNQYxgEbB4AaABAg.8nqqb3ulf_78nr4xhtxVAf	2018-11-20T01:40:40.000Z	Reply	REDAgpbfUo0	Galaxy Note 9 vs iPhone Xs Max - Why iPhone gets BORING FAST
Iphone is my choice	Ugze96558vH0ACvgyUR4AaABAg	2018-11-21T17:13:56.000Z	Comment	kxNhL2ekzEI	iPhone Xs vs Samsung Galaxy Note 9 Camera Test!
Note	UgyI96Hvv0Wx7XHNScB4AaABAg	2018-11-05T18:48:31.000Z	Comment	kxNhL2ekzEI	iPhone Xs vs Samsung Galaxy Note 9 Camera Test!
Heres my honest opinion I own the note and I still think the I phone XS max has a slightly better camera in my opinion the pixel is number one the I phone is number and Samsung is number and seeing how good smart phone cameras are it could be a th place camera and it would still be A GREAT camera still they re all close	UgzQPJUOO7Z_y0Amh_d4AaABAg	2018-10-31T11:39:18.000Z	Comment	kxNhL2ekzEI	iPhone Xs vs Samsung Galaxy Note 9 Camera Test!
I liked the XS max photos even before they which one but come on I think all these flagships cameras are great nowadays I think the choice comes down to operating system and which you prefer	Ugybs6NfRkZIWk6Kjlp4AaABAg	2018-10-30T20:47:08.000Z	Comment	kxNhL2ekzEI	iPhone Xs vs Samsung Galaxy Note 9 Camera Test!
I prefer the note	Ugyxk3wiYY2AET83vrZ4AaABAg	2018-10-29T18:52:25.000Z	Comment	kxNhL2ekzEI	iPhone Xs vs Samsung Galaxy Note 9 Camera Test!
Both r good but I ll prefer xs	Ugw0hxqOx3kYFDWN9gt4AaABAg	2018-10-28T12:19:22.000Z	Comment	kxNhL2ekzEI	iPhone Xs vs Samsung Galaxy Note 9 Camera Test!
Both phones are great for pictures I have a Note but the iPhone does well too I like that all brands are all stepping up and you can t go wrong with either The only thing I don t like is the front facing camera on both phones I love the sharpness and HDR plus of the nexus pixel devices in terms of front facing and low light quality	UgxTgzWxRsitQBR272F4AaABAg	2018-10-26T03:52:35.000Z	Comment	kxNhL2ekzEI	iPhone Xs vs Samsung Galaxy Note 9 Camera Test!
Your friend with the shirt She picture is popping out to me	UgwBYVyBoFDt4GqGNzB4AaABAg	2018-10-21T02:05:29.000Z	Comment	kxNhL2ekzEI	iPhone Xs vs Samsung Galaxy Note 9 Camera Test!
Subtle differences here and there all you need to differentiate the pictures is the warmer tones on the iphone along with maintaining great details in areas which on the note get lost in overexposure eg the girl holding the cup in one hand and the iphone in the other iphone has a warmer image and the cup is blown out in the note s image	Ugx0KHQxG9cd9Xv2UJR4AaABAg	2018-10-20T12:46:34.000Z	Comment	kxNhL2ekzEI	iPhone Xs vs Samsung Galaxy Note 9 Camera Test!
The iphone pics looks so much better Tybing on my note	Ugz9aRsVRWWcUC2GSmF4AaABAg	2018-10-17T11:24:39.000Z	Comment	kxNhL2ekzEI	iPhone Xs vs Samsung Galaxy Note 9 Camera Test!
Hello is there anyone who can explain to me how to enter the settings to change the background of the photo selfie as indicated on the video because I do not have this option on my samsung note thank you	UgyGQQd6Qh07gVfu15d4AaABAg	2018-10-16T13:06:22.000Z	Comment	kxNhL2ekzEI	iPhone Xs vs Samsung Galaxy Note 9 Camera Test!
Love your videos they are super high quality Great audio too	UgzPgpLRbPNE-JY8vg54AaABAg	2018-10-16T11:30:53.000Z	Comment	kxNhL2ekzEI	iPhone Xs vs Samsung Galaxy Note 9 Camera Test!
You should have more subs	UgwwsWW--HBYRXJ7ROR4AaABAg	2018-10-16T00:36:42.000Z	Comment	kxNhL2ekzEI	iPhone Xs vs Samsung Galaxy Note 9 Camera Test!
Note camera is better for us blk folks	UgyqI1N6USICE0KNjW14AaABAg	2018-10-15T21:16:35.000Z	Comment	kxNhL2ekzEI	iPhone Xs vs Samsung Galaxy Note 9 Camera Test!
Note	UgxKGmBScFJI_1uXKVJ4AaABAg	2018-10-15T21:06:29.000Z	Comment	kxNhL2ekzEI	iPhone Xs vs Samsung Galaxy Note 9 Camera Test!
Excellent comparison thanks	UgwPOtQbvpIF3naG_td4AaABAg	2018-10-15T20:53:55.000Z	Comment	kxNhL2ekzEI	iPhone Xs vs Samsung Galaxy Note 9 Camera Test!
The max puts more blue in the note is more red heavy	UgwknuLJ4utldFo2q5J4AaABAg	2018-10-15T20:49:27.000Z	Comment	kxNhL2ekzEI	iPhone Xs vs Samsung Galaxy Note 9 Camera Test!
Watching on my note	UgyuTRiyW1g4OgkT--x4AaABAg	2018-10-15T15:38:10.000Z	Comment	kxNhL2ekzEI	iPhone Xs vs Samsung Galaxy Note 9 Camera Test!
I think the iPhone looks a lot better because of the colors and i think it has the perfect amount of light and sharpness	UgzPthOHyA9Lg2NRGPt4AaABAg	2018-10-15T14:17:47.000Z	Comment	kxNhL2ekzEI	iPhone Xs vs Samsung Galaxy Note 9 Camera Test!
iPhone XS Max is better unfortunately	UgzSbLCI8lyh7RIrOn94AaABAg	2018-10-15T13:45:26.000Z	Comment	kxNhL2ekzEI	iPhone Xs vs Samsung Galaxy Note 9 Camera Test!
Thank u	UgzPgpLRbPNE-JY8vg54AaABAg.8mT0fwmd_Eu8mTK8W8zOtz	2018-10-16T14:20:56.000Z	Reply	kxNhL2ekzEI	iPhone Xs vs Samsung Galaxy Note 9 Camera Test!
For the attention of Androwankers Your Note is not some magical device with extra features In fact Note has zero USEFUL extra features than the iPhone XS Max and don t behave as if your phone is cheap Note gb costs around Shut up and use your potentially explosive phone	UgwOQLzOQTTudZTJM4J4AaABAg	2018-09-25T04:17:47.000Z	Comment	glqk9301-dQ	iPhone XS Max vs. Galaxy Note 9: Spec comparison
One reason A bionic chip	Ugx7iNK8JxS29o9CQXt4AaABAg	2018-09-25T02:42:19.000Z	Comment	glqk9301-dQ	iPhone XS Max vs. Galaxy Note 9: Spec comparison
I would never get a note I don t like exploding phones	UgyyUiQ10s88SknPjFh4AaABAg	2018-09-24T11:51:31.000Z	Comment	glqk9301-dQ	iPhone XS Max vs. Galaxy Note 9: Spec comparison
Iphone captures real image no beauty effects without telling customers	Ugzm58v4S8gMGYK9RU14AaABAg	2018-09-23T06:50:54.000Z	Comment	glqk9301-dQ	iPhone XS Max vs. Galaxy Note 9: Spec comparison
Started with iphone and will start again with iphone lol	UgxcHAme-24gnJU0JJN4AaABAg	2018-09-21T20:24:13.000Z	Comment	glqk9301-dQ	iPhone XS Max vs. Galaxy Note 9: Spec comparison
Only thing the iPhone won is color options but most people buy a case anyway	UgxQCdeYzT35EHRTt854AaABAg	2018-09-21T14:22:51.000Z	Comment	glqk9301-dQ	iPhone XS Max vs. Galaxy Note 9: Spec comparison
iPhone Xs	Ugwyg2eCu8kbm83Dxu94AaABAg	2018-09-21T12:31:22.000Z	Comment	glqk9301-dQ	iPhone XS Max vs. Galaxy Note 9: Spec comparison
For all the Androwankers here shitting on the iPhone your Note will lose its value like a perishable food item Poor security and stability of Android combined with the ugly and unreliable TouchWiz skin on top is a big disadvantage iPhones hold their resale value much better iOS is in itself a pro with regular updates for up to years or more iMessage Your Android doesn t come with a stock messaging app The advantage of being inside the Apple ecosystem For the same cost you get a phone with better value better connectivity better ecosystem better operating system with better support better customer care better security	UgwAG-IIndBjMm7987N4AaABAg	2018-09-21T09:32:04.000Z	Comment	glqk9301-dQ	iPhone XS Max vs. Galaxy Note 9: Spec comparison
iPhone X s max has the fastest chip in any phone ever	Ugy9xKJ8pBIsEFt17zl4AaABAg	2018-09-21T08:31:33.000Z	Comment	glqk9301-dQ	iPhone XS Max vs. Galaxy Note 9: Spec comparison
Gotta tell ya by Monday I ll own both don t know which to keep I use both os But both excellent devices	Ugx3Y-WVJIodlem6hvJ4AaABAg	2018-09-20T23:49:24.000Z	Comment	glqk9301-dQ	iPhone XS Max vs. Galaxy Note 9: Spec comparison
Samsung nuff said	UgxXukY-6Xh5vQ1WlZF4AaABAg	2018-09-20T16:39:52.000Z	Comment	glqk9301-dQ	iPhone XS Max vs. Galaxy Note 9: Spec comparison
iPhone for sure I like getting updates	UgwwHEFpODqbsJ7fVJF4AaABAg	2018-09-20T16:39:25.000Z	Comment	glqk9301-dQ	iPhone XS Max vs. Galaxy Note 9: Spec comparison
I have both a Note and a IPhone X and I work for a cellphone company so this is probably the most unbiased opinion Though Samsung devices are better in every way than iPhones they don t use quality parts We sell preowned Galaxy S s and phones have burn in on the screen We also sale preowned iPhone and I ve never seen burn in one one iPhone s keep their value and work longer for someone who doesn t upgrade often I also prefer my Note but I know it will give out before my iPhone X	UgwQA4Jv3JSu-ruAyvZ4AaABAg	2018-09-20T12:17:41.000Z	Comment	glqk9301-dQ	iPhone XS Max vs. Galaxy Note 9: Spec comparison
Samsung have uped their game	UgzH3xGcMV3LcnsU97h4AaABAg	2018-09-20T11:46:57.000Z	Comment	glqk9301-dQ	iPhone XS Max vs. Galaxy Note 9: Spec comparison
GN for the win	UgyiXZ4nuOu3SpSq5qt4AaABAg	2018-09-20T06:59:28.000Z	Comment	glqk9301-dQ	iPhone XS Max vs. Galaxy Note 9: Spec comparison
Note is the winner iPhone x max is a joke	Ugy_rQ02PaWfR40fmQl4AaABAg	2018-09-20T04:43:52.000Z	Comment	glqk9301-dQ	iPhone XS Max vs. Galaxy Note 9: Spec comparison
I don t really think this was a guide to which one is right for the viewer it was more just a lazy spec comparison which I could read anywhere You guys really suck lately	UgysAaOGALcqrWjAnWp4AaABAg	2018-09-20T03:20:39.000Z	Comment	glqk9301-dQ	iPhone XS Max vs. Galaxy Note 9: Spec comparison
Ugh I still don t know which one to upgrade too I currently use the iPhone plus why is this such a tough decision	UgwJCKLOLunW68gbbRd4AaABAg	2018-09-20T01:30:40.000Z	Comment	glqk9301-dQ	iPhone XS Max vs. Galaxy Note 9: Spec comparison
what game or vid is that at with the back to the future delereon	Ugw4ZGstCbgAQPUt8rp4AaABAg	2018-09-19T23:57:39.000Z	Comment	glqk9301-dQ	iPhone XS Max vs. Galaxy Note 9: Spec comparison
Error comments not responding CLOSE WAIT	UgxPv36gmfav_1Tyjw54AaABAg	2018-09-19T20:20:30.000Z	Comment	glqk9301-dQ	iPhone XS Max vs. Galaxy Note 9: Spec comparison
Which phone do you think came out on top Comment below Get an iPhone XS or XS Max fast on eBay Buy the Samsung Galaxy Note	UgyUrKRT21-8yCABA6R4AaABAg	2018-09-29T17:06:45.000Z	Comment	eaXGtOESWPY	iPhone XS Max vs Note 9 Photo Comparison - That Bokeh! 
Note	UgzeMkjbyXLgsCiUYdx4AaABAg	2018-11-19T00:28:46.000Z	Comment	eaXGtOESWPY	iPhone XS Max vs Note 9 Photo Comparison - That Bokeh! 
Note	UgyUWo5fURn6Q4xqCPV4AaABAg	2018-11-02T05:37:43.000Z	Comment	eaXGtOESWPY	iPhone XS Max vs Note 9 Photo Comparison - That Bokeh! 
Note wow Camera king	UgxWhxCRpY95DbyCvXR4AaABAg	2018-10-30T06:48:25.000Z	Comment	eaXGtOESWPY	iPhone XS Max vs Note 9 Photo Comparison - That Bokeh! 
And people are complaining of apples beauty gate issue Lol Pretty sure the note is times worse	Ugz04P73jikDjg5AI-t4AaABAg	2018-10-14T03:01:01.000Z	Comment	eaXGtOESWPY	iPhone XS Max vs Note 9 Photo Comparison - That Bokeh! 
Samsung lose	UgzSSDm8tnt_l5pX5N14AaABAg	2018-10-08T15:30:21.000Z	Comment	eaXGtOESWPY	iPhone XS Max vs Note 9 Photo Comparison - That Bokeh! 
All bokeh does is blur the background but not actually capture more light	UgzYnIL7PLvPInQHEvN4AaABAg	2018-10-08T00:31:57.000Z	Comment	eaXGtOESWPY	iPhone XS Max vs Note 9 Photo Comparison - That Bokeh! 
