Comment	CreateTimeStamp	Type	videoID	videoTitle
If you decided to switch from on to another what was the reason	2018-11-26T16:15:10.000Z	Comment	UC1MmZA5I38	Mac vs PC - Which Is Better?
I don t understand why everyone makes a huge deal over which is better Use whatever you want they re both good in their own ways	2018-12-06T03:12:40.000Z	Comment	UC1MmZA5I38	Mac vs PC - Which Is Better?
Mac surfing internet drawing mini game flash game video editing Pc Gaming Conclusion If your a gaming person don t buy the Mac and if your not that interesting in gaming go for a mac	2018-12-05T11:56:17.000Z	Comment	UC1MmZA5I38	Mac vs PC - Which Is Better?
I m not convinced enough to let my imacs go	2018-12-05T06:07:59.000Z	Comment	UC1MmZA5I38	Mac vs PC - Which Is Better?
The way he says Linux bugs me for some reason	2018-12-05T03:46:40.000Z	Comment	UC1MmZA5I38	Mac vs PC - Which Is Better?
windows is better	2018-12-04T17:26:42.000Z	Comment	UC1MmZA5I38	Mac vs PC - Which Is Better?
linux IT IS FREE	2018-12-04T06:59:25.000Z	Comment	UC1MmZA5I38	Mac vs PC - Which Is Better?
Not a word about usability on this video	2018-12-03T23:31:14.000Z	Comment	UC1MmZA5I38	Mac vs PC - Which Is Better?
PC is obviously better	2018-12-03T21:33:18.000Z	Comment	UC1MmZA5I38	Mac vs PC - Which Is Better?
Those chose political correctness over Mac	2018-12-03T11:52:49.000Z	Comment	UC1MmZA5I38	Mac vs PC - Which Is Better?
F Mac and all product of apple	2018-12-03T06:12:14.000Z	Comment	UC1MmZA5I38	Mac vs PC - Which Is Better?
For me Mac is winner bc ecosystem	2018-12-02T21:29:34.000Z	Comment	UC1MmZA5I38	Mac vs PC - Which Is Better?
I don t care which is better Both probably because Apple supports Microsoft Windows And probably Mac because you can use Windows on a Mac with Bootcamp are you an American because I am british	2018-12-02T17:50:44.000Z	Comment	UC1MmZA5I38	Mac vs PC - Which Is Better?
i have a windows also my photo is a windows	2018-12-02T12:03:45.000Z	Comment	UC1MmZA5I38	Mac vs PC - Which Is Better?
Joke If apple made a car would it have windows	2018-12-01T19:32:52.000Z	Comment	UC1MmZA5I38	Mac vs PC - Which Is Better?
PC THE WINDOWS IS THE WINNER	2018-12-01T15:40:10.000Z	Comment	UC1MmZA5I38	Mac vs PC - Which Is Better?
get both	2018-12-01T09:29:01.000Z	Comment	UC1MmZA5I38	Mac vs PC - Which Is Better?
Apple users are peasants	2018-12-01T07:43:26.000Z	Comment	UC1MmZA5I38	Mac vs PC - Which Is Better?
Microsoft Windows Apple macOS	2018-12-01T03:00:47.000Z	Comment	UC1MmZA5I38	Mac vs PC - Which Is Better?
Pc is better mac is wasting your money	2018-11-30T21:48:56.000Z	Comment	UC1MmZA5I38	Mac vs PC - Which Is Better?
So many users leaving me and they ain t coming back Vista s got issues it s so glitchy they re leaving me for mac Problems too darn many patches not enough Expensive upgrades well I need plenty just to get me off to start People hate it when I crash and freeze Vista s got me out of sorts I m often sick to some degree and on hold with tech support After a year of fixes I m still blue The problems they repeat now there s only one thing left to do control alt delete	2018-12-05T16:47:54.000Z	Reply	UC1MmZA5I38	Mac vs PC Which Is Better
I switched from on to another	2018-11-29T15:29:36.000Z	Reply	UC1MmZA5I38	Mac vs PC Which Is Better
Oh no it is I Whroe	2018-12-06T04:44:00.000Z	Comment	thc9iLZf0HQ	Mac vs PC - ROLE REVERSAL feat. iJustine
yes	2018-12-06T03:32:36.000Z	Comment	thc9iLZf0HQ	Mac vs PC - ROLE REVERSAL feat. iJustine
we are not control freaks we re command freaks	2018-12-06T03:21:58.000Z	Comment	thc9iLZf0HQ	Mac vs PC - ROLE REVERSAL feat. iJustine
sorry Linus but that is NOT a screenshot	2018-12-06T01:19:45.000Z	Comment	thc9iLZf0HQ	Mac vs PC - ROLE REVERSAL feat. iJustine
to print screen on windows just use Windows Key and Print Screen dont need to use snipping if you want the full screen	2018-12-06T01:14:31.000Z	Comment	thc9iLZf0HQ	Mac vs PC - ROLE REVERSAL feat. iJustine
This is like watching a Vegan eating a steak burger and a Meat Eater eating a veggie burger lol	2018-12-06T00:16:29.000Z	Comment	thc9iLZf0HQ	Mac vs PC - ROLE REVERSAL feat. iJustine
yay	2018-12-05T23:59:58.000Z	Comment	thc9iLZf0HQ	Mac vs PC - ROLE REVERSAL feat. iJustine
If Linus ever get s divorced god forbid I think we have a replacement	2018-12-05T22:39:52.000Z	Comment	thc9iLZf0HQ	Mac vs PC - ROLE REVERSAL feat. iJustine
not a screenshot	2018-12-05T22:20:25.000Z	Comment	thc9iLZf0HQ	Mac vs PC - ROLE REVERSAL feat. iJustine
windows for life	2018-12-05T21:56:14.000Z	Comment	thc9iLZf0HQ	Mac vs PC - ROLE REVERSAL feat. iJustine
if you shoot the screen it s a screenshot it simple	2018-12-05T21:29:10.000Z	Comment	thc9iLZf0HQ	Mac vs PC - ROLE REVERSAL feat. iJustine
definatly a screenshot lol XD	2018-12-05T21:07:33.000Z	Comment	thc9iLZf0HQ	Mac vs PC - ROLE REVERSAL feat. iJustine
that was a screenshot if i have ever seen one	2018-12-05T20:58:29.000Z	Comment	thc9iLZf0HQ	Mac vs PC - ROLE REVERSAL feat. iJustine
Yey	2018-12-05T20:50:54.000Z	Comment	thc9iLZf0HQ	Mac vs PC - ROLE REVERSAL feat. iJustine
YES	2018-12-05T20:32:38.000Z	Comment	thc9iLZf0HQ	Mac vs PC - ROLE REVERSAL feat. iJustine
Linus is clearly uncomfortable near girls	2018-12-05T20:14:36.000Z	Comment	thc9iLZf0HQ	Mac vs PC - ROLE REVERSAL feat. iJustine
Not a screenshot	2018-12-05T20:02:16.000Z	Comment	thc9iLZf0HQ	Mac vs PC - ROLE REVERSAL feat. iJustine
Mac is shiiiiiiittt	2018-12-05T19:59:35.000Z	Comment	thc9iLZf0HQ	Mac vs PC - ROLE REVERSAL feat. iJustine
Linus I run all three Mac Linux mmm Windows and you did not have a screenshot when you said that s a screen shot Mac is for productivity for video and audio editing for the professionals Linux Word Processing internet responsiveness Windows Compatibility to most hardware just slow at EVERYTHING else	2018-12-05T19:53:04.000Z	Comment	thc9iLZf0HQ	Mac vs PC - ROLE REVERSAL feat. iJustine
screenshot yay	2018-12-05T19:46:48.000Z	Comment	thc9iLZf0HQ	Mac vs PC - ROLE REVERSAL feat. iJustine
Plz don t dislike if u think I said something wrong in this video cuz I made this video for entertainment so if u enjoyed hit the like button and if u didn t then u know what to do Thnx Note Am a Windows user and I love it	2017-07-22T07:01:27.000Z	Comment	srRrriOnHcQ	Mac Gamer Vs Windows Gamer
Mac good on everything but really bad in gaming	2018-12-05T19:54:02.000Z	Comment	srRrriOnHcQ	Mac Gamer Vs Windows Gamer
Windows is the best	2018-12-05T12:30:10.000Z	Comment	srRrriOnHcQ	Mac Gamer Vs Windows Gamer
i think mac will much more better than windows	2018-12-05T06:57:23.000Z	Comment	srRrriOnHcQ	Mac Gamer Vs Windows Gamer
I have a windows pc and it blasts music so freaking loud I can hear it through the whole house even with doors closed	2018-12-05T02:34:49.000Z	Comment	srRrriOnHcQ	Mac Gamer Vs Windows Gamer
This video was in my Youtube recommended page The truth is as follows nobody should be playing computer games As a platform Windows is the worst OS for anything especially games this is WHY people build gaming systems	2018-12-05T00:09:25.000Z	Comment	srRrriOnHcQ	Mac Gamer Vs Windows Gamer
That s tru mac can run windows	2018-12-04T16:03:02.000Z	Comment	srRrriOnHcQ	Mac Gamer Vs Windows Gamer
At least both computers can watch porn	2018-12-04T15:27:34.000Z	Comment	srRrriOnHcQ	Mac Gamer Vs Windows Gamer
i hAVE a iMacKool	2018-12-04T12:29:44.000Z	Comment	srRrriOnHcQ	Mac Gamer Vs Windows Gamer
Wtf man I am using a Apple pc and you say it suck you suck	2018-12-04T11:43:44.000Z	Comment	srRrriOnHcQ	Mac Gamer Vs Windows Gamer
macs aren t for fucking gaming omfg	2018-12-04T04:08:36.000Z	Comment	srRrriOnHcQ	Mac Gamer Vs Windows Gamer
Esses tipos de v deos est o cada vez mais famosos	2018-12-04T01:18:00.000Z	Comment	srRrriOnHcQ	Mac Gamer Vs Windows Gamer
Biased	2018-12-03T22:06:15.000Z	Comment	srRrriOnHcQ	Mac Gamer Vs Windows Gamer
Windows is better than iMac	2018-12-03T18:51:07.000Z	Comment	srRrriOnHcQ	Mac Gamer Vs Windows Gamer
top most horrible gaming setups	2018-12-03T04:28:12.000Z	Comment	srRrriOnHcQ	Mac Gamer Vs Windows Gamer
clearly this mac user has never used a mac before Plus Mac is far more accessible with finder than a start button	2018-12-02T15:05:27.000Z	Comment	srRrriOnHcQ	Mac Gamer Vs Windows Gamer
This is one of the reson why mac is so expenisve dude	2018-12-02T04:43:43.000Z	Comment	srRrriOnHcQ	Mac Gamer Vs Windows Gamer
In mac the people s reaction will be whoa	2018-12-02T02:28:11.000Z	Comment	srRrriOnHcQ	Mac Gamer Vs Windows Gamer
What song	2018-12-01T19:00:31.000Z	Comment	srRrriOnHcQ	Mac Gamer Vs Windows Gamer
u can get a mac gaming mouse	2018-12-01T12:09:01.000Z	Comment	srRrriOnHcQ	Mac Gamer Vs Windows Gamer
Here before replies	2018-12-03T14:52:55.000Z	Reply	srRrriOnHcQ	Mac Gamer Vs Windows Gamer
i am user windows	2018-12-01T09:51:15.000Z	Reply	srRrriOnHcQ	Mac Gamer Vs Windows Gamer
J D Game Rex I m mad at u jk cud c and v will do what control did it s just what Mac users know	2018-11-09T04:00:35.000Z	Reply	srRrriOnHcQ	Mac Gamer Vs Windows Gamer
like here IF YOU CLICK DISLIKE ON BOTH THE VIDEO AND THIS COMMENT hahahah	2018-11-05T22:43:02.000Z	Reply	srRrriOnHcQ	Mac Gamer Vs Windows Gamer
Can somebody rate my video Thx	2018-10-28T10:18:58.000Z	Reply	srRrriOnHcQ	Mac Gamer Vs Windows Gamer
MARTIN GARRIX MUSICBOX	2018-08-22T09:30:51.000Z	Reply	srRrriOnHcQ	Mac Gamer Vs Windows Gamer
END OF DISCUSSION	2018-07-17T04:47:08.000Z	Reply	srRrriOnHcQ	Mac Gamer Vs Windows Gamer
They re both PC too	2018-07-17T04:46:58.000Z	Reply	srRrriOnHcQ	Mac Gamer Vs Windows Gamer
STOP ARGUING AND HATING PLZ	2018-07-16T12:55:30.000Z	Reply	srRrriOnHcQ	Mac Gamer Vs Windows Gamer
Brush lier the price of iMac is or plus	2018-07-14T12:34:08.000Z	Reply	srRrriOnHcQ	Mac Gamer Vs Windows Gamer
me windows pro	2018-07-02T07:38:33.000Z	Reply	srRrriOnHcQ	Mac Gamer Vs Windows Gamer
Windows and Mac are OPERATIONAL SYSTEMS so nothing in hardware counts	2018-06-26T21:49:59.000Z	Reply	srRrriOnHcQ	Mac Gamer Vs Windows Gamer
ctrl c ctrl v is command c command v on mac right click is two finger touch on mac track pad Also window s mouse is not smooth af mac track pad is	2018-06-25T13:31:05.000Z	Reply	srRrriOnHcQ	Mac Gamer Vs Windows Gamer
i m a windows user	2018-06-22T19:40:16.000Z	Reply	srRrriOnHcQ	Mac Gamer Vs Windows Gamer
J D Game Rex I m not offended I liked the video	2018-06-16T15:22:55.000Z	Reply	srRrriOnHcQ	Mac Gamer Vs Windows Gamer
J D Game Rex are u an Infian	2018-06-09T20:46:11.000Z	Reply	srRrriOnHcQ	Mac Gamer Vs Windows Gamer
If you dislike lag get a good GPU	2018-06-05T03:11:15.000Z	Reply	srRrriOnHcQ	Mac Gamer Vs Windows Gamer
J D Game Rex you such a stupid pc player that didnt saying truth	2018-05-29T16:03:42.000Z	Reply	srRrriOnHcQ	Mac Gamer Vs Windows Gamer
Actually make that	2018-12-06T00:35:41.000Z	Comment	it2QQt5pn8Q	Mac vs Windows Myth Busting - with PCCentric
If you just build your own Windows PC at say you will experience a far better experience than anything Apple can offer It s all about taking the plunge into building own PC instead of pre built stuff Building a PC is not hard as long as you do the research	2018-12-06T00:34:32.000Z	Comment	it2QQt5pn8Q	Mac vs Windows Myth Busting - with PCCentric
Compare surface products	2018-12-05T12:59:19.000Z	Comment	it2QQt5pn8Q	Mac vs Windows Myth Busting - with PCCentric
if u say MacBooks suck because there overpriced i have learned one thing Cheap Crap	2018-11-28T17:42:42.000Z	Comment	it2QQt5pn8Q	Mac vs Windows Myth Busting - with PCCentric
i honestly cant remember the last time my windows OS crashed on me the only issue i had is with a program that stopped responding so i had to just force close that one program but that s not the OS fault that s the software developer	2018-11-24T23:50:06.000Z	Comment	it2QQt5pn8Q	Mac vs Windows Myth Busting - with PCCentric
I m certain these guys haven t seen too many PC s or too many Windows laptops Regardless of whether you prefer Mac or PC this comparison is a joke No details whatsoever no comparison in spec only repetition throughout i actually can t believe how lame their comments are here around both Windows and Macs Completely unprofessional	2018-11-14T01:21:46.000Z	Comment	it2QQt5pn8Q	Mac vs Windows Myth Busting - with PCCentric
What in God s name are you guys doing to crash your Windows PC Seriously	2018-11-13T03:04:59.000Z	Comment	it2QQt5pn8Q	Mac vs Windows Myth Busting - with PCCentric
get a gamer laptop for euros or less in an outlet or second hand compare the performance to a MacBook of the same price and then acknowledge that you can install in that gaming laptop the exact same operative systems including MacOs running with a better performance yes Hackintosh rules and acknowledge that pc maintenance is times cheaper than mac and then you have your question answered it s better to buy a gaming pc for cheap rather then spending a whole bunch of money on a mac the performance is better blabla there s just one thing in my own perspective where Macs excel pcs audio performance which is probably to better then windows and then yes you have less latency but even that can be fixed and then for windows people yes you can now run a Linux based terminal straight from Windows with package managers etc which makes your life times easier in what relates to maintaining opensource projects and code in general briefly my next machine will not be a mac but rather a pc where I will try to get Hackintosh Windows and Mac running in different boots and within different VMs within these boots	2018-11-08T21:37:37.000Z	Comment	it2QQt5pn8Q	Mac vs Windows Myth Busting - with PCCentric
You know that thing when a guy with an English accent walks into a bar in America says hello and all the ladies swoon that s my life owning a system	2018-11-02T17:45:04.000Z	Comment	it2QQt5pn8Q	Mac vs Windows Myth Busting - with PCCentric
you say it s a myth you argue it s a fact then you conclude it s a myth	2018-10-29T20:07:32.000Z	Comment	it2QQt5pn8Q	Mac vs Windows Myth Busting - with PCCentric
The only missing thing in the macOS are good office products I use Outlook and excel heavily and the office version in macOS is not so good Bummer because I love everything else in Macos	2018-10-28T14:21:27.000Z	Comment	it2QQt5pn8Q	Mac vs Windows Myth Busting - with PCCentric
i like Windows where most my apps runs however I love the Mac interface When I am on Windows i would make it look like the Mac I would use Mac Theme and I use Folderchanger utility to further enhance the overall look and feel on my Windows Google folderchanger works great	2018-10-28T11:53:25.000Z	Comment	it2QQt5pn8Q	Mac vs Windows Myth Busting - with PCCentric
Don t Foget those ANNOYING ASG UPDATES on Windows Mac Windows user	2018-10-26T16:15:12.000Z	Comment	it2QQt5pn8Q	Mac vs Windows Myth Busting - with PCCentric
What are a good company to buy a pre build system for video editing that also looks good I was looking online and most of them looks really bad I want to make the switch from Mac to PC but I would like a good a good performance and looking machine to have in our offices	2018-10-24T14:24:23.000Z	Comment	it2QQt5pn8Q	Mac vs Windows Myth Busting - with PCCentric
As a heavy windows user I can attest that windows is shit It s also a crap shoot whether it will wake up properly or freeze	2018-10-24T07:57:16.000Z	Comment	it2QQt5pn8Q	Mac vs Windows Myth Busting - with PCCentric
Did you guys try very hard not to make Apple angry This comparison was too wishy washy The bottom line is in my part of the country a Macbook Pro is about If I was to spend on a Windows based machine it would blow the Macbook out of the water in every category It sounded like you guys were comparing a Macbook Pro to an Windows computer Get real	2018-10-20T21:42:44.000Z	Comment	it2QQt5pn8Q	Mac vs Windows Myth Busting - with PCCentric
iPhones are the main engine of profit for Apple They are constantly upgrading phones vs Macs Macs are no longer a leap ahead of PCs	2018-10-19T16:42:47.000Z	Comment	it2QQt5pn8Q	Mac vs Windows Myth Busting - with PCCentric
sorry what I have seen and heard here is incorrect mac have more build construction problems than a windows system And yes macs are over priced for what you get please do another video with correct information	2018-10-18T18:31:00.000Z	Comment	it2QQt5pn8Q	Mac vs Windows Myth Busting - with PCCentric
Dualboot boiiiii	2018-10-18T13:48:46.000Z	Comment	it2QQt5pn8Q	Mac vs Windows Myth Busting - with PCCentric
NEW VID The most chill unboxing EVER	2018-11-09T20:41:03.000Z	Comment	HhebI9YMrrM	Here’s why MAC is better than WINDOWS (mac vs pc 2018)
You me a both mac an dpc user that cmd and control button is actually a valid point	2018-12-04T16:06:03.000Z	Comment	HhebI9YMrrM	Here’s why MAC is better than WINDOWS (mac vs pc 2018)
This video is complete trash you didnt even mentioned the winodows good points everything is false dislike	2018-12-04T14:29:17.000Z	Comment	HhebI9YMrrM	Here’s why MAC is better than WINDOWS (mac vs pc 2018)
mac is for beginners is you know top os are Microsoft Windows Ubuntu Windows Windows Windows XP Professional Linux Mint Android Windows XP Windows Macintosh OS X So did you realize that mac is not the best os	2018-12-04T14:20:07.000Z	Comment	HhebI9YMrrM	Here’s why MAC is better than WINDOWS (mac vs pc 2018)
Windows is free to download it is cad IMADiT	2018-12-04T14:01:45.000Z	Comment	HhebI9YMrrM	Here’s why MAC is better than WINDOWS (mac vs pc 2018)
main reasons I don t switch to mac all the shortcuts are different there s no window snapping	2018-12-03T04:49:13.000Z	Comment	HhebI9YMrrM	Here’s why MAC is better than WINDOWS (mac vs pc 2018)
A mac is way more expensive like I found a laptop dollar laptop that destroys any mac	2018-12-03T00:45:25.000Z	Comment	HhebI9YMrrM	Here’s why MAC is better than WINDOWS (mac vs pc 2018)
Macs are ok for gaming trust me I have used one for it	2018-12-02T18:13:33.000Z	Comment	HhebI9YMrrM	Here’s why MAC is better than WINDOWS (mac vs pc 2018)
Mac are shit litterally overpriced shit maybe he have in some tasks optimised for it something better perf but generally it is shit especially when Mac are weaker then PC	2018-12-02T17:03:23.000Z	Comment	HhebI9YMrrM	Here’s why MAC is better than WINDOWS (mac vs pc 2018)
I had hopes for this guy he seemed more objective than other fanboys he failed me	2018-12-02T08:28:40.000Z	Comment	HhebI9YMrrM	Here’s why MAC is better than WINDOWS (mac vs pc 2018)
See this one apple fans	2018-12-02T03:52:36.000Z	Comment	HhebI9YMrrM	Here’s why MAC is better than WINDOWS (mac vs pc 2018)
I have a Desktop PC Ryzen x ti gb ram tb NVME OS drive And I have a MBP inch coming from a The majority of what you spoke was very misinformed There s no way you were ever a regular Windows user	2018-12-01T08:39:12.000Z	Comment	HhebI9YMrrM	Here’s why MAC is better than WINDOWS (mac vs pc 2018)
Libre Office be like Am I a joke to you	2018-12-01T08:00:48.000Z	Comment	HhebI9YMrrM	Here’s why MAC is better than WINDOWS (mac vs pc 2018)
i have watched the whole video imadit you are wrong we do not need to purchase office we get that in the beginning when we purchase a pc And i have a surface pro it has surface studios for editing and it has various animation tools also How can you say that in a pc we need to buy video editing software And Surface Pro is far better than your mac Touch screen Removable keypad Available with a touch pen Sim is supported cheaper than mac Who will buy a mac when their is surface pro which is far better than mac	2018-11-30T22:19:32.000Z	Comment	HhebI9YMrrM	Here’s why MAC is better than WINDOWS (mac vs pc 2018)
You are comparing apples and oranges A PC does not have to do anything with Windows same goes with MAC products they are not bound just to MacOS You HAVE to distinguish software os from the hardware part Once you understand what this means make another video	2018-11-30T16:16:45.000Z	Comment	HhebI9YMrrM	Here’s why MAC is better than WINDOWS (mac vs pc 2018)
You gotta learn the hardware inside the PC the iMac its not worth it for the price	2018-11-30T04:52:47.000Z	Comment	HhebI9YMrrM	Here’s why MAC is better than WINDOWS (mac vs pc 2018)
Pc outperform mac in everything If you spend the same amount of money for your mac in building a PC	2018-11-30T04:49:14.000Z	Comment	HhebI9YMrrM	Here’s why MAC is better than WINDOWS (mac vs pc 2018)
Lol this is so biased	2018-11-30T03:44:13.000Z	Comment	HhebI9YMrrM	Here’s why MAC is better than WINDOWS (mac vs pc 2018)
a good video the dislikes are from dumb fanboys they are poor	2018-11-29T22:19:25.000Z	Comment	HhebI9YMrrM	Here’s why MAC is better than WINDOWS (mac vs pc 2018)
The only part where I agree with you is when you talk about macs being easier to use than windows that s true that s their main appeal and their main selling point The rest is wrong With windows you get free antivirus too no need to change windows defender for anything else they offer the same basic protection You cannot compare Office products with the included software on Mac Office is superior in many ways and you can also get similar free software for windows for free You can get both movie and audio editing programs for free on Windows good quality ones with no trial just need to google it for longer than minutes I personally hate garage band and having it preinstalled is actually a problem for me one of the reasons I use windows now I don t see all their software as useful but rather as bloatware You mention the many ways windows has to access and modify its settings and then say mac has more customisation options The iphone and the imac connect easily well windows phones tablets and pcs can also connect as easy as that the problem is only that windows phones never got to be as popular as iphones Plus with a bit of customisation you can get the same between android and windows What was that about a yo macbook pro review my brother uses a yo pc with no problems nad runs as smoothly as it was a t the beginning And finally I m sorry to say this but you have a man bun I shouldn t be expecting anything different	2018-11-28T14:03:34.000Z	Comment	HhebI9YMrrM	Here’s why MAC is better than WINDOWS (mac vs pc 2018)
narkar difference is not huge considering the Air has a x display whereas the x has a p display Also on the Air single core performance is as good as the i not to say that the x is not an amazing laptop with a better price per performance that the MBA cuz it it I clearly said that there are nice windows laptops but they are almost as expensive as Mac laptops The reason of the section in was to counter the viewers that will say yes macOS is free but the hardware is crazy expensive It was an attempt to remove hardware price from the comparison by saying that premium laptops cost more whether they are Apple or not Unfortunately I failed because of the comments are about the hardware price and not the actual software comparison	2018-11-21T18:43:57.000Z	Reply	HhebI9YMrrM	Here s why MAC is better than WINDOWS mac vs pc
iMADiT For example try Asus UX which is on Newegg For less than new MBA you actually get newest intel whiskey lake i U c t which is way superior compared to MBA s w dual core CPU You get better screen with crazy thin bezels ergo lift hinge and IMO really nice aesthetics Plus additional GB of storage wont cost you crazy because you can do it yourself Also if you spend similar amount on laptop you can get really nice ones like XPS or UX with really nice premium build I also dont like how you made this Software vs Software and then said how your hardware broke on Windows laptop which has nothing to do with Software Macbook has great build quality obviously but so do the premium windows laptop UX Surface Laptop Matebook X Pro Dell XPS	2018-11-21T16:12:58.000Z	Reply	HhebI9YMrrM	Here s why MAC is better than WINDOWS mac vs pc
Have you ever used the thumb method After only minutes of usage and person who uses shortcuts will immediately know which is better Also what is a good cheap laptop	2018-11-21T15:55:33.000Z	Reply	HhebI9YMrrM	Here s why MAC is better than WINDOWS mac vs pc
Just because you bought wrong Windows laptop for that price doesnt mean every win laptop for that money is bad lmao so bad arguments Using thumb is more natural position what the fuck so many arguments are ridiculous and full of lies	2018-11-21T13:47:44.000Z	Reply	HhebI9YMrrM	Here s why MAC is better than WINDOWS mac vs pc
Zenith Again that means I am biased but that doesn t make it all false	2018-12-04T20:01:00.000Z	Reply	HhebI9YMrrM	Here s why MAC is better than WINDOWS mac vs pc
iMADiT that s where you are wrong there are goid points in windowd	2018-12-04T19:39:59.000Z	Reply	HhebI9YMrrM	Here s why MAC is better than WINDOWS mac vs pc
If I didn t mention the windows good points that doesn t mean it s all false that means i m biased or that there are no good points in Windows	2018-12-04T15:20:01.000Z	Reply	HhebI9YMrrM	Here s why MAC is better than WINDOWS mac vs pc
Life Hacks If you are serious I ll be serious too but beware that I may offend you a list that combines mobile OSs and desktop OSs is stupid it only shows that the list is based on stupid methods There is no criteria that specifies how the list is created is it based on popularity impulsive subjective voting or maybe people like you who have never used both OSs extensively I could provide many other lists from websites that say otherwise when macOS users are approximately compared with windows users guess how the votes will go facepalm yeah so again lol what a list	2018-12-05T10:33:44.000Z	Reply	HhebI9YMrrM	Here s why MAC is better than WINDOWS mac vs pc
iMADiT i haven t created this list i have found it in a website So this is not my opinion people have rated this list	2018-12-05T01:56:04.000Z	Reply	HhebI9YMrrM	Here s why MAC is better than WINDOWS mac vs pc
Lol What a list	2018-12-04T15:18:43.000Z	Reply	HhebI9YMrrM	Here s why MAC is better than WINDOWS mac vs pc
