Comment	CreateTimeStamp	Type	videoID	videoTitle
Linux is a piece of garbage that only exists for learning how a OS works it s ugly even with customizations it s unusable you must learn and waist so much time learning how to use things Nvidia drivers doesn t work and overheats the PC Linux is a general purpose Kernel so nothing is optimized you want to use a Dolby audio chip no alsa is the only garbage that works razer backlit doesn t work etc Linux UI is crap just look at kde they makes all the functions but putted everything in a single window without organizing it fuck linus torvalds now you get why no one is doing development just for linux steam only uses that because Gabe hates Microsoft I m going for a Mac It s like merging the best of Windows and Linux	2018-11-27T12:46:58.000Z	Comment	ghTwo5Kvbmo	Mac vs Windows for Software Engineers (best laptop for programming)
Just intall ubuntu for a terminal	2018-11-26T10:24:17.000Z	Comment	ghTwo5Kvbmo	Mac vs Windows for Software Engineers (best laptop for programming)
Good lookin tree	2018-11-25T06:59:49.000Z	Comment	ghTwo5Kvbmo	Mac vs Windows for Software Engineers (best laptop for programming)
Do you think it s bad idea using mac os on pc for software development	2018-11-25T00:27:36.000Z	Comment	ghTwo5Kvbmo	Mac vs Windows for Software Engineers (best laptop for programming)
MS DOS is not a language it was an OS Stopped watching after that	2018-11-23T21:47:41.000Z	Comment	ghTwo5Kvbmo	Mac vs Windows for Software Engineers (best laptop for programming)
Ms dos is a language wtf It s the os	2018-11-19T20:49:59.000Z	Comment	ghTwo5Kvbmo	Mac vs Windows for Software Engineers (best laptop for programming)
WSL is not an emulation It is not even virtualisation It is Windows kernel masking itself as Linux kernel The most similar concept I know of is Wine which does the precise opposite	2018-11-19T15:28:28.000Z	Comment	ghTwo5Kvbmo	Mac vs Windows for Software Engineers (best laptop for programming)
U r the most talented I can tell	2018-11-19T13:40:29.000Z	Comment	ghTwo5Kvbmo	Mac vs Windows for Software Engineers (best laptop for programming)
Hey man nice review but the crashes that i had in my Zephyrus Was While finding the balance in my undervolt anyway Hope to see a new video from you	2018-08-13T12:05:06.000Z	Comment	WCAAMthPyH0	Mac VS PC 2018. Switching over to Windows, after 10 years on Macs.
Windows best	2018-12-05T14:57:17.000Z	Comment	Abs7_jdK5fI	Mac vs PC
LinuxFTW	2018-12-04T17:22:28.000Z	Comment	Abs7_jdK5fI	Mac vs PC
Mac loses windows win	2018-12-04T12:06:11.000Z	Comment	Abs7_jdK5fI	Mac vs PC
Windows	2018-12-03T18:03:44.000Z	Comment	Abs7_jdK5fI	Mac vs PC
windows word windows whamwindows powerpoint windows poofwindows excel windows e bombwindows access windows master key it has a key symbol	2018-12-02T09:37:37.000Z	Comment	Abs7_jdK5fI	Mac vs PC
Mac vs Windows	2018-12-01T21:15:59.000Z	Comment	Abs7_jdK5fI	Mac vs PC
Im on pc team	2018-12-01T02:03:18.000Z	Comment	Abs7_jdK5fI	Mac vs PC
Versions Used Mac macOS X Jaguar PC Microsoft Windows XP	2018-11-27T05:03:31.000Z	Comment	Abs7_jdK5fI	Mac vs PC
OH NO MY PC	2018-11-26T15:52:07.000Z	Comment	Abs7_jdK5fI	Mac vs PC
a chuva venceu	2018-11-24T16:20:17.000Z	Comment	Abs7_jdK5fI	Mac vs PC
I don t have Mac so windows win	2018-11-21T10:35:17.000Z	Comment	Abs7_jdK5fI	Mac vs PC
PC won	2018-11-19T08:43:43.000Z	Comment	Abs7_jdK5fI	Mac vs PC
I used to watch this when i was like xD	2018-11-18T18:53:11.000Z	Comment	Abs7_jdK5fI	Mac vs PC
PC Windows Mac Apple Mac	2018-11-18T18:00:37.000Z	Comment	Abs7_jdK5fI	Mac vs PC
COOL	2018-11-18T15:45:57.000Z	Comment	Abs7_jdK5fI	Mac vs PC
Kids these days are fighting over what game is the best PUBG or Fortnite but they are forgetting the real battle royale	2018-11-17T19:07:57.000Z	Comment	Abs7_jdK5fI	Mac vs PC
Windows is not PC Windows is Microsoft s program	2018-11-17T03:54:10.000Z	Comment	Abs7_jdK5fI	Mac vs PC
Windows is sort of a modular operating system and most of windows update is about upgrading a section of the OS hence un skippable That s why only Windows only has unskippable update I swear it s annoying Windows has drastically changed since due to the nature of Windows many updates add essential features or patch security flaws by just replacing that specific section of OS unlike previous iterations making updates mandatory Windows collects personal data to enhance the experience with cortana and other virtual assistances Macs don t have such a feature so don t require such an option Android iOS collects personal data for G Assistant Siri Both are great OSes And it all boils down to preference and need	2018-11-24T16:05:04.000Z	Comment	acN-99EOals	STOP Fighting Over Mac vs. Windows (An Unbiased Comparison)
I feel you I seriously hate the updates in Windows It sometimes drive me insane I ve been using Windows since W until W I have tried MBA during Sierra and High Sierra I miss Mac OS now I just find both useful but I prefer the Mac OS You just delete the App from Applications folder in the Finder your App will be uninstalled based on my experience Christian how long have you been using Mac Have you tried doing a Hackintosh	2018-10-16T06:52:02.000Z	Comment	acN-99EOals	STOP Fighting Over Mac vs. Windows (An Unbiased Comparison)
I use windows and I definitely like it probably because I mainly play games on it I think Mac is good for a workstation like making videos and such	2018-09-12T13:51:32.000Z	Comment	acN-99EOals	STOP Fighting Over Mac vs. Windows (An Unbiased Comparison)
Very well put together and all valid points I got a desktop and a MacBook and have the best of both worlds I play no favorites and each one has its strengths and weaknesses Love the thumbnail love the shirt	2018-09-11T15:09:50.000Z	Comment	acN-99EOals	STOP Fighting Over Mac vs. Windows (An Unbiased Comparison)
forcing an updates is quite good they are just to oimprove the OS the security on the other hand windows is probably the most instable and resource intensive OS hackintosh isn t illegal if you do it yourself I mean If I build myself a macintosh I didn t subscribe any contract the only thing you break is copyright if you mod it you don t even really break the copyright rules anymore the only thing you need to do is mod some proprietary librarys too making all that would bring oyu on the legal site	2018-09-11T14:14:22.000Z	Comment	acN-99EOals	STOP Fighting Over Mac vs. Windows (An Unbiased Comparison)
Seriously there is no difference once you re used to it I have both a MacBook pro and a Windows desktop honestly don t prefer one that much over the other	2018-09-11T13:36:14.000Z	Comment	acN-99EOals	STOP Fighting Over Mac vs. Windows (An Unbiased Comparison)
I m very happy with my MacBook Pro	2018-09-11T05:31:13.000Z	Comment	acN-99EOals	STOP Fighting Over Mac vs. Windows (An Unbiased Comparison)
I ve been a Windows girl from the get Still am	2018-09-11T02:54:57.000Z	Comment	acN-99EOals	STOP Fighting Over Mac vs. Windows (An Unbiased Comparison)
Mac maintain their value over time I am not gamer anymore At this period of my life I don t want troubleshoot or twinkle with dll settings and deal with intrusive windows updates I want spend more quality enjoying life So I am transitioning to the Apple ecosystem	2018-09-11T02:51:27.000Z	Comment	acN-99EOals	STOP Fighting Over Mac vs. Windows (An Unbiased Comparison)
I never used Mac before we got a Mac Air last year It s definitely not as intuitive as Windows but I do enjoy the fluidity of it Like you said you just need to figure out what works for you as neither is perfect	2018-09-11T01:03:39.000Z	Comment	acN-99EOals	STOP Fighting Over Mac vs. Windows (An Unbiased Comparison)
Honestly I use both both have advantages and disadvantages Most people who argue about it feel the need to validate their purchasing decision	2018-09-11T00:57:57.000Z	Comment	acN-99EOals	STOP Fighting Over Mac vs. Windows (An Unbiased Comparison)
The first IT S TIME TO STOP	2018-09-11T00:50:26.000Z	Comment	acN-99EOals	STOP Fighting Over Mac vs. Windows (An Unbiased Comparison)
Windows s annoying Unskippable updates are due to modular nature of Windows I ll admit it s annoying but Windows has drastically changed since due to the nature of Windows many updates add essential features or patch security flaws by just replacing that specific section of OS unlike previous iterations making updates mandatory	2018-11-24T16:13:45.000Z	Reply	acN-99EOals	STOP Fighting Over Mac vs Windows An Unbiased Comparison
Christian Taylor true I thought you would get in trouble if you sell it commercially Better be safe then	2018-10-16T13:52:06.000Z	Reply	acN-99EOals	STOP Fighting Over Mac vs Windows An Unbiased Comparison
I ve been using Mac for about a year I haven t considered a hackintosh but as I mentioned in the video I personally don t want to do it since it s not legal	2018-10-16T13:45:17.000Z	Reply	acN-99EOals	STOP Fighting Over Mac vs Windows An Unbiased Comparison
Windows is good too for photo editing and video editing But I ll admit Final Cut Pro is too good	2018-11-24T16:06:45.000Z	Reply	acN-99EOals	STOP Fighting Over Mac vs Windows An Unbiased Comparison
Yep Windows can t be touched for gaming	2018-09-12T15:02:39.000Z	Reply	acN-99EOals	STOP Fighting Over Mac vs Windows An Unbiased Comparison
Thank you Both have pros and cons and I m fortunate to be able to have both	2018-09-11T15:14:01.000Z	Reply	acN-99EOals	STOP Fighting Over Mac vs Windows An Unbiased Comparison
Yep they are pretty similar	2018-09-11T15:12:34.000Z	Reply	acN-99EOals	STOP Fighting Over Mac vs Windows An Unbiased Comparison
Nice You have a model right	2018-09-11T12:25:40.000Z	Reply	acN-99EOals	STOP Fighting Over Mac vs Windows An Unbiased Comparison
I can t deny that Windows is solid I miss some of the features and how intuitive it is	2018-09-11T02:55:43.000Z	Reply	acN-99EOals	STOP Fighting Over Mac vs Windows An Unbiased Comparison
Nice dude Yeah Mac computers hold their value very well You can t beat the uniformity of the Apple ecosystem either	2018-09-11T02:54:28.000Z	Reply	acN-99EOals	STOP Fighting Over Mac vs Windows An Unbiased Comparison
Yup It s all what works for you I agree that Windows is more intuitive One thing I forgot to mention that s huge to me is window snapping It s a mess on Mac	2018-09-11T01:05:34.000Z	Reply	acN-99EOals	STOP Fighting Over Mac vs Windows An Unbiased Comparison
Yep you re exactly right	2018-09-11T01:02:05.000Z	Reply	acN-99EOals	STOP Fighting Over Mac vs Windows An Unbiased Comparison
Literally thought about that meme before you even showed up	2018-09-11T00:54:09.000Z	Reply	acN-99EOals	STOP Fighting Over Mac vs Windows An Unbiased Comparison
Dell is a much better deal because it still supports Windows which the Macbook does not	2018-11-29T12:07:54.000Z	Comment	D91VxfK8h5k	Mac vs PC: 10 Years Later
My school laptop has been a d for the past year or so upgraded it a bit and it s actually not to bad fir school	2018-11-26T06:15:13.000Z	Comment	D91VxfK8h5k	Mac vs PC: 10 Years Later
I use linux	2018-11-26T00:14:43.000Z	Comment	D91VxfK8h5k	Mac vs PC: 10 Years Later
Pc for the win	2018-11-13T21:11:35.000Z	Comment	D91VxfK8h5k	Mac vs PC: 10 Years Later
MacBook is great and it s even better today as with Windows running on it it s good value though its probably a much better idea to get a Unibody ish MacBook	2018-11-05T16:55:29.000Z	Comment	D91VxfK8h5k	Mac vs PC: 10 Years Later
wdawwdwdwdawdawda dwdai windowssssssssssssssssssssssssssssssssssssssssssssssssssssssssssssssss	2018-11-05T13:13:19.000Z	Comment	D91VxfK8h5k	Mac vs PC: 10 Years Later
I d go for the MacBook It can run Windows no like seriously with a few drivers you can run windows	2018-10-29T01:50:43.000Z	Comment	D91VxfK8h5k	Mac vs PC: 10 Years Later
ill get the dell	2018-10-28T20:49:42.000Z	Comment	D91VxfK8h5k	Mac vs PC: 10 Years Later
Umm a pc	2018-10-27T11:53:31.000Z	Comment	D91VxfK8h5k	Mac vs PC: 10 Years Later
watching on my early MacBook	2018-10-23T16:23:05.000Z	Comment	D91VxfK8h5k	Mac vs PC: 10 Years Later
When you mean PC do you mean like any brand laptop like Acer Asus Lenovo etc I d also go PC over Mac	2018-10-17T07:48:09.000Z	Comment	D91VxfK8h5k	Mac vs PC: 10 Years Later
it s funny how MacBooks were cheaper back then	2018-10-13T13:14:57.000Z	Comment	D91VxfK8h5k	Mac vs PC: 10 Years Later
DELL	2018-10-05T07:03:59.000Z	Comment	D91VxfK8h5k	Mac vs PC: 10 Years Later
I would use the MacBook I owned one back in the day and it even today runs Snow Leopard Just It s running pretty hot on the trackpad when using the computer for a longer time like a few hours	2018-09-25T18:07:44.000Z	Comment	D91VxfK8h5k	Mac vs PC: 10 Years Later
I ll go with the macbook	2018-09-25T03:12:34.000Z	Comment	D91VxfK8h5k	Mac vs PC: 10 Years Later
Currently watching on a MacBook with somehow has Mountain Lion running on it	2018-09-23T02:46:00.000Z	Comment	D91VxfK8h5k	Mac vs PC: 10 Years Later
RIP ME I m watching this on my Mid MacBook Plastic Unibody xD	2018-09-18T04:31:43.000Z	Comment	D91VxfK8h5k	Mac vs PC: 10 Years Later
Mac sux in rip Steve jobs	2018-09-15T09:34:50.000Z	Comment	D91VxfK8h5k	Mac vs PC: 10 Years Later
I prefer the macbook because those things are made in VOLUME So finding parts for those is VERY easy and DIRT CHEAP and with apple s bootcamp you can load a copy of windows bit on this exact model models with the core duo can accept x flavours and you have the best of both worlds so if you would like to try out apple for the first time but you need windows to keep your software library install windows and you won t lose anything the build quality is fine though the late aluminium macbook is MUCH better you can officially install up to El Capitan and with the dosdude s high sierra patcher you can bring this laptop to the latest available operating system hope Mojave will fit on this so you are up to date	2018-09-06T20:57:14.000Z	Comment	D91VxfK8h5k	Mac vs PC: 10 Years Later
Hey For those wondering what music is at I found some information on it The music actually dates back all the way to Jacob Kitts was actually right about the music s relation to the Discovery Channel as there was an article about the Discovery Channel releasing their tracks onto APM Music as seen here Album Sci Tech Artist Richard Brown Title Zone NOTE This music is a little bit hard to find as you won t see it on YouTube Try looking on Spotify or Apple Music to find it	2018-05-04T04:32:59.000Z	Comment	Ph4Xf6ucjqM	Mac vs PC 4
This is so funny	2018-11-26T20:13:53.000Z	Comment	Ph4Xf6ucjqM	Mac vs PC 4
I saw the Target Bullseye the Taco Bell Logo and Nike Checkmark	2018-11-25T09:20:36.000Z	Comment	Ph4Xf6ucjqM	Mac vs PC 4
anyone	2018-11-17T15:56:37.000Z	Comment	Ph4Xf6ucjqM	Mac vs PC 4
lol windows xp is better than Vista	2018-11-17T15:56:28.000Z	Comment	Ph4Xf6ucjqM	Mac vs PC 4
Apple	2018-11-13T07:23:58.000Z	Comment	Ph4Xf6ucjqM	Mac vs PC 4
ARE YOU SPREADING THESE ERRORS	2018-11-10T08:14:13.000Z	Comment	Ph4Xf6ucjqM	Mac vs PC 4
Mac sucks	2018-11-06T11:14:09.000Z	Comment	Ph4Xf6ucjqM	Mac vs PC 4
y now Vista Sucks	2018-10-13T22:09:34.000Z	Comment	Ph4Xf6ucjqM	Mac vs PC 4
i stairs D	2018-09-30T09:07:08.000Z	Comment	Ph4Xf6ucjqM	Mac vs PC 4
Mac is doing sex	2018-09-07T10:18:16.000Z	Comment	Ph4Xf6ucjqM	Mac vs PC 4
Wow that s a epic fight	2018-09-02T20:02:35.000Z	Comment	Ph4Xf6ucjqM	Mac vs PC 4
You have a Virus Ha Ha Ha	2018-08-29T04:32:19.000Z	Comment	Ph4Xf6ucjqM	Mac vs PC 4
Spreading Spread complete	2018-08-29T04:31:58.000Z	Comment	Ph4Xf6ucjqM	Mac vs PC 4
Uploading Upload Complete	2018-08-29T04:30:56.000Z	Comment	Ph4Xf6ucjqM	Mac vs PC 4
VIRUS Computing Solution Dumping Windows XP Dump Complete Is it ok to dump XP YES Installing Vista Please Wait Done	2018-08-29T04:22:24.000Z	Comment	Ph4Xf6ucjqM	Mac vs PC 4
iComment	2018-08-21T02:19:16.000Z	Comment	Ph4Xf6ucjqM	Mac vs PC 4
I love Windows Microsoft	2018-08-19T12:46:27.000Z	Comment	Ph4Xf6ucjqM	Mac vs PC 4
Stop speaking about of Mac win or PC wins just they re tie And LINUX just ant to be a king of a software	2018-08-17T10:03:27.000Z	Comment	Ph4Xf6ucjqM	Mac vs PC 4
TheROFL its also on spotify my quest ends here thank you for finding this info	2018-09-22T21:37:09.000Z	Reply	Ph4Xf6ucjqM	Mac vs PC
TheROFL ITS ON ITUNES I JUST FOUND IT	2018-09-22T21:20:22.000Z	Reply	Ph4Xf6ucjqM	Mac vs PC
TheROFL WOW I ve honestly been after this song for years	2018-09-22T21:17:37.000Z	Reply	Ph4Xf6ucjqM	Mac vs PC
TheROFL s	2018-07-24T09:42:23.000Z	Reply	Ph4Xf6ucjqM	Mac vs PC
TheROFL	2018-07-20T11:11:30.000Z	Reply	Ph4Xf6ucjqM	Mac vs PC
Me Derp now	2018-07-19T20:18:27.000Z	Reply	Ph4Xf6ucjqM	Mac vs PC
wow is epic	2018-07-19T20:14:28.000Z	Reply	Ph4Xf6ucjqM	Mac vs PC
TheROFL thanks	2018-07-03T02:59:36.000Z	Reply	Ph4Xf6ucjqM	Mac vs PC
TangguhNI I make flash animations check me out	2018-06-03T17:30:12.000Z	Reply	Ph4Xf6ucjqM	Mac vs PC
the video is years old Jacob pin the comment lately	2018-06-01T08:39:57.000Z	Reply	Ph4Xf6ucjqM	Mac vs PC
Windows xp	2018-05-19T00:00:23.000Z	Reply	Ph4Xf6ucjqM	Mac vs PC
i love your videos both jacob and rofl	2018-05-18T23:42:04.000Z	Reply	Ph4Xf6ucjqM	Mac vs PC
TheROFL also where do you get those real Dell optiplex Windows XP hard drive sounds	2018-05-16T17:33:42.000Z	Reply	Ph4Xf6ucjqM	Mac vs PC
TheROFL what about the hard drive sounds I really like them where do you obtain those sounds because I want to make my own MAC VS PC version with classic Windows logo and the classic Apple logo	2018-05-16T17:31:59.000Z	Reply	Ph4Xf6ucjqM	Mac vs PC
Me Derp Took nine years just to find the music in the video	2018-05-05T16:18:42.000Z	Reply	Ph4Xf6ucjqM	Mac vs PC
dude this video is years old	2018-05-05T13:13:37.000Z	Reply	Ph4Xf6ucjqM	Mac vs PC
Great video Beebom Very helpfull	2018-12-05T02:43:57.000Z	Comment	I96nVmnzUqE	Switching from Windows to Mac: Everything You Need to Know (Complete Guide)
Why does beebom hate apple products so much I ll never know	2018-11-26T09:07:57.000Z	Comment	I96nVmnzUqE	Switching from Windows to Mac: Everything You Need to Know (Complete Guide)
Mac is based on Linux basically if someone has used Ubuntu before then it will not be a problem	2018-11-25T15:35:31.000Z	Comment	I96nVmnzUqE	Switching from Windows to Mac: Everything You Need to Know (Complete Guide)
Super likee thanku so muchhh	2018-11-25T07:36:42.000Z	Comment	I96nVmnzUqE	Switching from Windows to Mac: Everything You Need to Know (Complete Guide)
very helpful thanks	2018-11-25T01:17:38.000Z	Comment	I96nVmnzUqE	Switching from Windows to Mac: Everything You Need to Know (Complete Guide)
It s st user guide so I m wounder how to get into folder And you are saying about name changing of folder please add new video with details	2018-11-23T04:05:36.000Z	Comment	I96nVmnzUqE	Switching from Windows to Mac: Everything You Need to Know (Complete Guide)
Get cheap window product key can go Vanskeys com to get genuine it provide The price is cheap and their good service recommend to you	2018-11-22T02:19:20.000Z	Comment	I96nVmnzUqE	Switching from Windows to Mac: Everything You Need to Know (Complete Guide)
I started a new job where I have to use a Mac for work This video was really helpful in getting me to grips with the basics I still struggle with the Mac keyboard though it simply doesn t have the depth of a good ThinkPad	2018-11-21T13:48:54.000Z	Comment	I96nVmnzUqE	Switching from Windows to Mac: Everything You Need to Know (Complete Guide)
It s is an informative video Thanks	2018-11-19T14:02:27.000Z	Comment	I96nVmnzUqE	Switching from Windows to Mac: Everything You Need to Know (Complete Guide)
Light weight user use mac Heavy weight user use window If you gots window and mac and test on autodesk maya and another stuff you will findout mac is use less for overprice and low performence Am i right	2018-11-18T05:05:44.000Z	Comment	I96nVmnzUqE	Switching from Windows to Mac: Everything You Need to Know (Complete Guide)
So good	2018-11-08T19:41:02.000Z	Comment	I96nVmnzUqE	Switching from Windows to Mac: Everything You Need to Know (Complete Guide)
Thank too much brother	2018-11-08T05:48:34.000Z	Comment	I96nVmnzUqE	Switching from Windows to Mac: Everything You Need to Know (Complete Guide)
Great job thank you	2018-11-07T22:39:52.000Z	Comment	I96nVmnzUqE	Switching from Windows to Mac: Everything You Need to Know (Complete Guide)
Very well done video thank you	2018-11-07T19:52:51.000Z	Comment	I96nVmnzUqE	Switching from Windows to Mac: Everything You Need to Know (Complete Guide)
It not that hard to uninstall app on Windows just go to add or remove programs to uninstall any app you want or you can go to control panel and click on uninstall a program	2018-11-06T15:53:20.000Z	Comment	I96nVmnzUqE	Switching from Windows to Mac: Everything You Need to Know (Complete Guide)
Thanks It was a great help	2018-11-06T11:03:07.000Z	Comment	I96nVmnzUqE	Switching from Windows to Mac: Everything You Need to Know (Complete Guide)
When OSX will make Finder create a file from the UI	2018-11-06T01:40:52.000Z	Comment	I96nVmnzUqE	Switching from Windows to Mac: Everything You Need to Know (Complete Guide)
finally a tutorial by an indian guy that s understandable and high quality	2018-11-05T01:45:16.000Z	Comment	I96nVmnzUqE	Switching from Windows to Mac: Everything You Need to Know (Complete Guide)
Pepsi vs Coke	2018-11-03T17:57:37.000Z	Comment	I96nVmnzUqE	Switching from Windows to Mac: Everything You Need to Know (Complete Guide)
I didnt even know you could take screenshots on windows	2018-11-01T06:46:30.000Z	Comment	I96nVmnzUqE	Switching from Windows to Mac: Everything You Need to Know (Complete Guide)
My iMac got it in works fine My work Dell windows got it last year it s slow and laggy I m not saying that all windows is bad IV just lived with Mac	2018-11-17T10:51:50.000Z	Comment	Cl3ioA-k5ZE	Top 5 Reasons Why I Choose macOS vs Windows
Mac OS is free compares to windows That alone is a kicker In the professional world mac has always been more reliable and stable	2018-11-16T21:07:11.000Z	Comment	Cl3ioA-k5ZE	Top 5 Reasons Why I Choose macOS vs Windows
Fantastic and so helpful Thanks	2018-11-15T01:18:22.000Z	Comment	Cl3ioA-k5ZE	Top 5 Reasons Why I Choose macOS vs Windows
Windows lol	2018-11-04T16:29:44.000Z	Comment	Cl3ioA-k5ZE	Top 5 Reasons Why I Choose macOS vs Windows
dat monitor setup lol	2018-10-31T01:13:52.000Z	Comment	Cl3ioA-k5ZE	Top 5 Reasons Why I Choose macOS vs Windows
wow your first reason describes my feelings perfectly	2018-10-17T02:46:40.000Z	Comment	Cl3ioA-k5ZE	Top 5 Reasons Why I Choose macOS vs Windows
Oh sure Windows vs MacOS It s not like Linux is a thing	2018-10-15T02:49:43.000Z	Comment	Cl3ioA-k5ZE	Top 5 Reasons Why I Choose macOS vs Windows
He said Mac can do literally everything WTF fat cunt it can t even change GUI theme or adjusting GUI icon text etc size like WINDOW bitch it hurts my eyes It forces you to work with light theme and small texts all the time updating to Mac Mojave it ll be fucking slower	2018-10-13T20:39:20.000Z	Comment	Cl3ioA-k5ZE	Top 5 Reasons Why I Choose macOS vs Windows
Speaking of teade in value the PC crashes all the time so you end up having to shell out more money for repairs or buying a new one That in the long run will also cost more than a Mac	2018-10-13T01:56:05.000Z	Comment	Cl3ioA-k5ZE	Top 5 Reasons Why I Choose macOS vs Windows
nobody makes viruses to kill a very small community windows is a huge operating system compared to a operating system having boundaries from my experience when ever i use a apple device from system to iphone i feel limited	2018-10-12T13:38:03.000Z	Comment	Cl3ioA-k5ZE	Top 5 Reasons Why I Choose macOS vs Windows
Im a software engineer programming in C and im sick of the Windows OS i have used it heavily since Win and even as a very young child I used Win I earn my living supporting and creating applications for Windows but im sick of it and think Windows is a mess once you go into its settings control panel menus so im up for trying Mac OS The way i see it is ill get a Macbook Pro for fun and still keep my Windows desktop for gaming programming in C	2018-10-04T21:28:29.000Z	Comment	Cl3ioA-k5ZE	Top 5 Reasons Why I Choose macOS vs Windows
This will be my first time trying Mac OS for years of my existence Hope i like it I feel like it ll motivate me to learn drawing	2018-10-01T06:46:07.000Z	Comment	Cl3ioA-k5ZE	Top 5 Reasons Why I Choose macOS vs Windows
update to macOS Mojave is amazing	2018-09-29T13:20:45.000Z	Comment	Cl3ioA-k5ZE	Top 5 Reasons Why I Choose macOS vs Windows
I heard virtually every stupid PC vs Mac argument from my brother in law who owned and ran a PC store for over years then he FINALLY tried a Mac	2018-09-25T14:02:11.000Z	Comment	Cl3ioA-k5ZE	Top 5 Reasons Why I Choose macOS vs Windows
nibba if you call alienware good pc s you aren t smart	2018-09-23T19:09:40.000Z	Comment	Cl3ioA-k5ZE	Top 5 Reasons Why I Choose macOS vs Windows
Finally good to see a video like this on such a biased platform where everyone trashes and shits on anyone who talks good or switches to Apple products D and ends up liking them p	2018-09-21T14:41:23.000Z	Comment	Cl3ioA-k5ZE	Top 5 Reasons Why I Choose macOS vs Windows
At least we can fucking right click	2018-09-17T01:06:29.000Z	Comment	Cl3ioA-k5ZE	Top 5 Reasons Why I Choose macOS vs Windows
Its a myth that you cant play games on mac Ive played many games on imac and they run fine	2018-09-09T17:54:06.000Z	Comment	Cl3ioA-k5ZE	Top 5 Reasons Why I Choose macOS vs Windows
Found it super crappy there s nothing called a virus updates r hasslefree U didn t show compare the windows android iphone n all apple ecosystems	2018-09-04T12:23:05.000Z	Comment	Cl3ioA-k5ZE	Top 5 Reasons Why I Choose macOS vs Windows
your video explained it all it prooves windows are for rich and poor people while macs are only for rich lol thanks	2018-08-30T08:54:27.000Z	Comment	Cl3ioA-k5ZE	Top 5 Reasons Why I Choose macOS vs Windows
fake douche	2018-11-15T14:03:45.000Z	Comment	Iomm7dW5aQA	I switched from Mac to Windows and I'm never going back — here's why
